,Attribute,Description,Valid Values,DependsOn,DependsOn Component,Required,Parent,Validation Rules,Properties,Source,Module,multivalue,columnType,Ontology,Notes,UsedIn
66,gDNAconc,gDNA Concentration in ng,,,,True,ManifestColumn,,ManifestColumn,,ManifestColumn,False,NUMBER,Sage Bionetworks, ,bsSeq
67,genotypeTechnology,"Method(s) used to genotype variants in the discovery stage. Separate multiple methods separated by a semicolon (;). Example - genome-wide genotyping array, exome-wide sequencing, targeted genotyping array",,,,True,ManifestColumn,,ManifestColumn,,ManifestColumn,True,STRING,"Sage Bionetworks, EMBL-EBI","A data contributor should be able to write in a name OR provide one of these values: Unknown Not collected, Not applicable, Not specified. ",Genotyping_Human
68,Genotyping_Human,Template for Genotyping_Human,,"Filename,specimenID,stage,numberIndividuals,sampleType,useReagent,reagentIDs,reagentName,reagentManufacturer,reagentCatalogNumber,reagentLotNumber,reagentWeblink,reagentContact,useTreatment,treatmentID(s),treatmentName,treatmentAmountValue,treatmentAmountUnit,treatmentDurationValue,treatmentDurationUnit,treatmentTemperatureValue,treatmentTemperatureUnit,measurementTechnique,genotypeTechnology,arrayManufacturer,arrayInformation,imputation,imputationPanel,imputationSoftware,variantCount,statisticalModel,adjustedCovariates,reportedTrait,backgroundTrait,useReadMeFile,readmeFile,useSummaryFile,summaryFile,summaryStatisticsAssembly,Component",,False,Component,,Template,,Template,,,Sage Bionetworks, ,
69,hasAssayControl,"Boolean flag indicating whether or not a specimen is a technical or assay control. Examples include study pools or reference pools, blanks, or internal standards.",,,,False,ManifestColumn,,ManifestColumn,,ManifestColumn,False,BOOLEAN,Sage Bionetworks, ,Metabolomics
70,hasIonizationSource,Were the ionization conditions recorded to enable reproduction of the experiment?,"No,Yes",,,False,ManifestColumn,,ManifestColumn,,ManifestColumn,False,BOOLEAN,"Sage Bionetworks, Proposed minimum metadata relative to mass spectrometry", ,Metabolomics
71,imputation,Were SNPs imputed for the discovery GWAS?,,,,True,ManifestColumn,,ManifestColumn,,ManifestColumn,False,STRING,"Sage Bionetworks, EMBL-EBI", ,Genotyping_Human
72,imputationPanel,Panel used for imputation. Example - 1000 Genomes Phase 3,,,,False,ManifestColumn,,ManifestColumn,,ManifestColumn,False,STRING,"Sage Bionetworks, EMBL-EBI","A data contributor should be able to write in a name OR provide one of these values: Unknown Not collected, Not applicable, Not specified. ",Genotyping_Human
73,imputationSoftware,Imputation software. Example - IMPUTE,,,,False,ManifestColumn,,ManifestColumn,,ManifestColumn,False,STRING,"Sage Bionetworks, EMBL-EBI","A data contributor should be able to write in a name OR provide one of these values: Unknown Not collected, Not applicable, Not specified. ",Genotyping_Human
74,Individual_Human,Template for Individual_Human,,"Filename,individualID,cohort,studyCode,fieldCenterCode,visitCode,countryCode,consentGroupID,speciesGroup,sex,race,ethnicity,ethnicGroupCode,age,diagnosisStatus,diagnosis,Component",,False,Component,,Template,,Template,,,Sage Bionetworks, ,
75,Individual_non_Human,Template for Individual_non_Human,,"Filename,individualID,cohort,studyCode,taxon,speciesGroup,speciesName,commonName,sex,lifeStage,speciesAge,captivityStatus,captivityDuration,Component",,False,Component,,Template,,Template,,,Sage Bionetworks, ,
76,individualID,"Identifying string linked to the individual or animal being studied, provided by the data contributor",,,,True,ManifestColumn,,ManifestColumn,,ManifestColumn,False,STRING,Sage Bionetworks, ,"Biospecimen_human,Biospecimen_non_Human,Individual_Human,Individual_non_Human,Phenotype_human"
77,instrumentModel,"The model of the instrument used. Provide a value OR provide one of these values - Unknown Not collected, Not applicable, Not specified",,,,True,ManifestColumn,,ManifestColumn,,ManifestColumn,False,STRING,"DSLWG,Proposed minimum metadata relative to mass spectrometry,Sage Bionetworks","A data contributor should be able to write in a name OR provide one of these values: Unknown Not collected, Not applicable, Not specified OR use one of these possible values linked belowPossible values are listed under the instrument model term. https://www.ebi.ac.uk/ols/ontologies/ms/terms?iri=http%3A%2F%2Fpurl.obolibrary.org%2Fobo%2FMS_1000031&viewMode=All&siblings=false. ","Metabolomics,Metagenomics,Proteomics"
78,ionProperty,Ion charge state (positive or negative-ion analysis),"Negative,Positive",,,False,ManifestColumn,,ManifestColumn,,ManifestColumn,False,STRING,"Sage Bionetworks, Proposed minimum metadata relative to mass spectrometry", ,Metabolomics
79,isobaricLabelingReagent,"Reagent set used for isobaric labeling. Examples- iTRAQ113 TMT126Provide a value OR provide one of these values - Unknown Not collected, Not applicable, Not specified",,,,True,ManifestColumn,,ManifestColumn,,ManifestColumn,True,STRING,Proteomics Data Commons,"A data contributor should be able to write in a name OR provide one of these values: Unknown Not collected, Not applicable, Not specified. ",Proteomics
80,isPostMortem,Was the sample taken after death (true/false)?,,,,True,ManifestColumn,,ManifestColumn,,ManifestColumn,False,STRING,Sage Bionetworks, ,"Biospecimen_human,Biospecimen_non_Human"
81,isStranded,Whether or not the library is stranded.,"FALSE,TRUE",,,True,ManifestColumn,,ManifestColumn,,ManifestColumn,False,BOOLEAN,Sage Bionetworks, ,"Microbiome,RNAseq,Whole_Genome_Sequencing,bsSeq,scRNAseq"
82,labelFreeQuantitation,"Type of label-free data analysis strategyProvide a value OR provide one of these values - Unknown Not collected, Not applicable, Not specified","Label-free gene level quantitation,Label-free peptide level quantitation,Label-free protein group level quantitation,Label-free protein level quantitation,Label-free raw feature quantitation,Not applicable,Not available,Not collected,Not specified,Unknown",,,True,ManifestColumn,,ManifestColumn,,ManifestColumn,True,STRING,Proteomics Data Commons, ,Proteomics
83,labelQuantitation,"Type of labeling usedProvide a value OR provide one of these values - Unknown Not collected, Not applicable, Not specified","AminoxyTMT,DiART,DiLeu,Glyco-TMT,Hydrazide TMT,IodoTMT,IPTL,iTRAQ,iTRAQH,Label Free,Not available,Not collected,Not specified,TMT,Unknown",,,True,ManifestColumn,,ManifestColumn,,ManifestColumn,True,STRING,"Sage Bionetworks, DSLWG, https://www.ebi.ac.uk/ols/ontologies/pride/terms?iri=http%3A%2F%2Fpurl.obolibrary.org%2Fobo%2FPRIDE_0000514&viewMode=All&siblings=false Proteomics Data Commons https://pdc.cancer.gov/data-dictionary/dictionary.html", ,Proteomics
84,lambdaDNAconc,Lambda DNA spike-in concentration in ng,,,,True,ManifestColumn,,ManifestColumn,,ManifestColumn,False,NUMBER,Sage Bionetworks, ,bsSeq
85,lensVoltages ,"The skimmer/focusing lens voltages e.g., capillary voltage, etc.",,,,False,ManifestColumn,,ManifestColumn,,ManifestColumn,False,NUMBER,"Sage Bionetworks, Proposed minimum metadata relative to mass spectrometry", ,Metabolomics
86,lensVoltagesUnit ,Unit of lens voltages,,,,False,ManifestColumn,,ManifestColumn,,ManifestColumn,False,STRING,"Sage Bionetworks, Proposed minimum metadata relative to mass spectrometry", ,Metabolomics
87,libLayout,"Library layout. Specify whether to expect single, paired, or other configurations of reads. Provide a value OR provide one of these values - Unknown Not collected, Not applicable, Not specified",,,,True,ManifestColumn,,ManifestColumn,,ManifestColumn,False,STRING,MIMS (Minimum information about a metagenome sequence., https://pubmed.ncbi.nlm.nih.gov/18479204/,Metagenomics
88,libraryBatchID,"Library batch identifier, provided by the data contributor to Sage Bionetworks. The batch identifier(s) must be stored in a data dictionary .csv file uploaded to Synapse. Provide a value OR provide one of these values - Unknown Not collected, Not applicable, Not specified",,,,True,ManifestColumn,,ManifestColumn,,ManifestColumn,False,STRING,Sage Bionetworks,"A data contributor should be able to write in a name OR provide one of these values: Unknown Not collected, Not applicable, Not specified. ","Microbiome,Whole_Genome_Sequencing,bsSeq,scRNAseq"
89,libraryPrep,"The general strategy by which the library was prepared. Provide a value OR provide one of these values - Unknown Not collected, Not applicable, Not specified",,,,True,ManifestColumn,,ManifestColumn,,ManifestColumn,False,STRING,Sage Bionetworks,"A data contributor should be able to write in a name OR provide one of these values: Unknown Not collected, Not applicable, Not specified. ","Metagenomics,Microbiome,Whole_Genome_Sequencing,bsSeq,scRNAseq"
90,libraryPreparationMethod,"Method by which library was prepared. Provide a value OR provide one of these values - Unknown Not collected, Not applicable, Not specified",,,,True,ManifestColumn,,ManifestColumn,,ManifestColumn,False,STRING,Sage Bionetworks,"A data contributor should be able to write in a name OR provide one of these values: Unknown Not collected, Not applicable, Not specified. ","Microbiome,RNAseq,Whole_Genome_Sequencing,bsSeq,scRNAseq"
91,libraryVersion,"Library Version- for example, rnaSeq 10x library version. Provide a value OR provide one of these values - Unknown Not collected, Not applicable, Not specified",,,,True,ManifestColumn,,ManifestColumn,,ManifestColumn,False,STRING,Sage Bionetworks,"A data contributor should be able to write in a name OR provide one of these values: Unknown Not collected, Not applicable, Not specified. ","Microbiome,RNAseq,Whole_Genome_Sequencing,bsSeq,scRNAseq"
92,libReadsSeqd,"Library reads sequenced. Total number of clones sequenced from the library. Example - '20'Provide a value OR provide one of these values - Unknown Not collected, Not applicable, Not specified",,,,True,ManifestColumn,,ManifestColumn,,ManifestColumn,False,INTEGER,MIMS (Minimum information about a metagenome sequence., https://pubmed.ncbi.nlm.nih.gov/18479204/,Metagenomics
93,libSize,"Library size. Total number of clones in the library prepared for the project. Example - '50'Provide a value OR provide one of these values - Unknown Not collected, Not applicable, Not specified",,,,True,ManifestColumn,,ManifestColumn,,ManifestColumn,False,INTEGER,MIMS (Minimum information about a metagenome sequence., https://pubmed.ncbi.nlm.nih.gov/18479204/,Metagenomics
94,libVector,"Library vector. Cloning vector type(s) used in the construction of libraries. Example - 'Bacteriophage P1'Provide a value OR provide one of these values - Unknown Not collected, Not applicable, Not specified",,,,True,ManifestColumn,,ManifestColumn,,ManifestColumn,False,STRING,MIMS (Minimum information about a metagenome sequence., https://pubmed.ncbi.nlm.nih.gov/18479204/,Metagenomics
95,lifeStage,The life stage of the individual.note- Other values are possible depending on life stage terminology for individual species. Please let the data curation team know.,"Adult,Juvenile,Post-Juvenile",,,True,ManifestColumn,,ManifestColumn,,ManifestColumn,False,STRING,"Biological Collections Ontology, https://www.animalaudiograms.org/audiogram_metadata_scheme#:~:text=range%3A%20female%3B%20male-,life%20stage,-The%20life%20stage, https://www.ebi.ac.uk/ols/ontologies/pato", ,Individual_non_Human
96,meanCoverage,Total number of bases covered by ATAC-seq reads/size of genome,,,,True,ManifestColumn,,ManifestColumn,,ManifestColumn,False,NUMBER,Sage Bionetworks, ,bsSeq
97,measurementTechnique,"The name of the measurement technique describing the assay method. Provide a value OR provide one of these values - Unknown Not collected, Not applicable, Not specified",,,,True,ManifestColumn,,ManifestColumn,,ManifestColumn,True,STRING,Sage Bionetworks,"A data contributor should be able to write in a name OR provide one of these values: Unknown Not collected, Not applicable, Not specified. ","Biospecimen_human,Genotyping_Human,Metabolomics,Metagenomics,Microbiome,Proteomics,RNAseq,Whole_Genome_Sequencing,bsSeq,scRNAseq"
98,Metabolomics,Template for Metabolomics,,"Filename,specimenID,sampleType,measurementTechnique,technologyPlatformVersion,platformLocation,instrumentModel,samplePrepProtocol,dataFile,databaseSource,databaseWeblink,databaseName,msTarget,msAssayTechnique,msAnalyteType,sampleIntroduction,extractionMethod,acquisitionMode,acquisitionSoftware,acquistionSoftwareVersion,spectrometerFrequency,hasIonizationSource,ionProperty,vacuumPressure,vacuumPressureUnit,lensVoltages,lensVoltagesUnit,gasFlowTemperature,gasFlowTemperatureUnit,hasAssayControl,controlType,experimentalBatchSize,experimentalBatchSizeUnit,batchSize,batchSizeUnit,batchID,batchLabel,sampleBatchID,sampleBatchSize,sampleBatchSizeUnit,acquisitionBatchID,acquisitionBatchSize,acquisitionBatchSizeUnit,processingBatchID,processingBatchSize,processingBatchSizeUnit,Component",,False,Component,,Template,,Template,,,Sage Bionetworks, ,
99,Metagenomics,Template for Metagenomics,,"Filename,specimenID,sampleType,experimentType,measurementTechnique,technologyPlatformVersion,platformLocation,instrumentModel,samplePrepProtocol,dataFile,databaseSource,databaseWeblink,databaseName,databaseVersion,databaseLibrary,libraryPrep,libSize,mid,assemblyName,nucleAcidExt,sourceMatID,libReadsSeqd,numberContig,libLayout,assemblyQual,libVector,adapters,assemblySoftware,experimentalFactor,associatedResource,sop,targetGene,seqMethod,seqPlatform,DNAextraction,Component",,False,Component,,Template,,Template,,,Sage Bionetworks, ,
100,Microbiome,Template for Microbiome,,"Filename,specimenID,sampleType,measurementTechnique,technologyPlatformVersion,platformLocation,extractionMethod,libraryBatchID,sequencingBatchID,sequencingBatchSize,sequencingBatchSizeUnit,dnaBatchID,dnaBatchSize,dnaBatchSizeUnit,libraryPrep,libraryPreparationMethod,libraryVersion,isStranded,readStrandOrigin,readLength,readLengthUnits,runType,totalReads,Component",,False,Component,,Template,,Template,,,Sage Bionetworks, ,
101,mid,"Multiplex identifiers. Molecular barcodes, called Multiplex Identifiers (MIDs), are used to tag unique samples in a sequencing run specifically. Sequence should be reported in uppercase letters. Example - 'GTGAATAT'Provide a value OR provide one of these values - Unknown Not collected, Not applicable, Not specified",,,,True,ManifestColumn,,ManifestColumn,,ManifestColumn,False,STRING,MIMS (Minimum information about a metagenome sequence., https://pubmed.ncbi.nlm.nih.gov/18479204/,Metagenomics
102,modificationParameters,"Modification parameters for a search engine run. (ex. PSI- PI http-//www.w3.org/2002/07/owl#Axiom) or used in the peptide identification database search. Provide a value OR provide one of these values - Unknown Not collected, Not applicable, Not specified",,,,True,ManifestColumn,,ManifestColumn,,ManifestColumn,True,STRING,https://www.ebi.ac.uk/ols/ontologies/ms/terms?iri=http%3A%2F%2Fpurl.obolibrary.org%2Fobo%2FMS_1001055,"Possible values are listed under modification parameters:https://www.ebi.ac.uk/ols/ontologies/ms/terms?iri=http%3A%2F%2Fpurl.obolibrary.org%2Fobo%2FMS_1001055Other, Unknown, Not collected, Not applicable, Not specified. ",Proteomics
103,msAnalyteType,"The type of biospecimen subjected to analysis (ex., peptide, protein, metabolite, lipid)Provide a value OR provide one of these values - Unknown Not collected, Not applicable, Not specified",,,,True,ManifestColumn,,ManifestColumn,,ManifestColumn,False,STRING,"http://purl.obolibrary.org/obo/NCIT_C156434,http://purl.obolibrary.org/obo/NCIT_C156434 Proteomic Data Commons https://pdc.cancer.gov/data-dictionary/dictionary.html","A data contributor should be able to write in a name OR provide one of these values: Unknown Not collected, Not applicable, Not specified. ","Metabolomics,Proteomics"
104,msAssayTechnique,"Specified the mass spectrometer technique used or the name of the proteomics assay used (ex. DDA)Provide a value OR provide one of these values - Unknown Not collected, Not applicable, Not specified",,,,True,ManifestColumn,,ManifestColumn,,ManifestColumn,False,STRING,"Sage Bionetworks, DSLWG","A data contributor should be able to write in a name OR provide one of these values: Unknown Not collected, Not applicable, Not specified. ","Metabolomics,Proteomics"
105,msTarget,Specifies whether or not a specific molecule(s) is/are targeted for detection/measurement by the assay,"Not applicable,Not available,Not collected,Not specified,Targeted,Unknown,Untargeted",,,True,ManifestColumn,,ManifestColumn,,ManifestColumn,False,STRING,"DSLWG,Sage Bionetworks", ,"Metabolomics,Proteomics"
106,nucleAcidExt,"Nucleic acid extraction. A link to a literature reference, electronic resource or a standard operating procedure (SOP), that describes the material separation to recover the nucleic acid fraction from a sample. (example, https-//mobio.com/media/wysiwyg/pdfs/protocols/12888.pdf). Provide a value OR provide one of these values - Unknown Not collected, Not applicable, Not specified",,,,True,ManifestColumn,,ManifestColumn,,ManifestColumn,False,STRING,MIMS (Minimum information about a metagenome sequence., https://pubmed.ncbi.nlm.nih.gov/18479204/,Metagenomics
107,nucleicAcidSource,"Specifies the type of nucleic acid (DNA, RNA, Pooled, etc.) found in a sample.","bulk cell,bulk nuclei,mitochondria,Not applicable,Not collected,Not specified,single cell,single nucleus,sorted cells,sorted nuclei,Unknown",,,True,ManifestColumn,,ManifestColumn,,ManifestColumn,False,STRING,https://ncithesaurus.nci.nih.gov/ncitbrowser/ConceptReport.jsp?dictionary=NCI_Thesaurus&version=23.04d&ns=ncit&code=C171278&key=1146649015&b=1&n=1, ,"Biospecimen_human,Biospecimen_non_Human"
108,numberContig,"Number of contigs. Total number of contigs in the cleaned/submitted assembly that comprise a given genome, SAG, MAG, or UViG. Example - '40'Provide a value OR provide one of these values - Unknown Not collected, Not applicable, Not specified",,,,False,ManifestColumn,,ManifestColumn,,ManifestColumn,False,INTEGER,MIMS (Minimum information about a metagenome sequence., https://pubmed.ncbi.nlm.nih.gov/18479204/,Metagenomics
109,numberIndividuals,Number of individuals in a group. Example - 2000,,,,True,ManifestColumn,,ManifestColumn,,ManifestColumn,False,INTEGER,"Sage Bionetworks, EMBL-EBI", ,Genotyping_Human
110,organ,Indicate the organ the specimen is from,,,,True,ManifestColumn,,ManifestColumn,,ManifestColumn,False,STRING,http://purl.obolibrary.org/obo/NCIT_C13018, ,"Biospecimen_human,Biospecimen_non_Human"
111,pcrCycles,Number of PCR cycles to amplify transposased DNA fragments,,,,True,ManifestColumn,,ManifestColumn,,ManifestColumn,False,NUMBER,Sage Bionetworks, ,bsSeq
112,Phenotype_human,Template for Phenotype_human,,"Filename,individualID,cohort,speciesGroup,sex,race,ethnicity,ethnicGroupCode,age,diagnosisStatus,diagnosis,Component",,False,Component,,Template,,Template,,,Sage Bionetworks, ,
113,platformLocation,"The name of the laboratory, facility, vendor, company, or location where the data generation platform was located, provided by the data contributor. Provide a value OR provide one of these values - Unknown Not collected, Not applicable, Not specified",,,,True,ManifestColumn,,ManifestColumn,,ManifestColumn,True,STRING,"DSLWG,Sage Bionetworks","A data contributor should be able to write in a name OR provide one of these values: Unknown Not collected, Not applicable, Not specified. ","Metabolomics,Metagenomics,Microbiome,Proteomics,RNAseq,Whole_Genome_Sequencing,bsSeq,scRNAseq"
114,processingBatchID,"Processing batch identifier, provided by the data contributor to Sage Bionetworks. The batch identifier(s) must be stored in a data dictionary .csv file uploaded to Synapse",,,,False,ManifestColumn,,ManifestColumn,,ManifestColumn,False,STRING,Sage Bionetworks, ,Metabolomics
115,processingBatchSize,The number of samples,,,,False,ManifestColumn,,ManifestColumn,,ManifestColumn,False,STRING,Sage Bionetworks, ,Metabolomics
116,processingBatchSizeUnit,The unit of measurement for number of samples in a batch,,,,False,ManifestColumn,,ManifestColumn,,ManifestColumn,False,STRING,Sage Bionetworks, ,Metabolomics
117,Proteomics,Template for Proteomics,,"Filename,specimenID,sampleType,experimentType,measurementTechnique,technologyPlatformVersion,platformLocation,instrumentModel,samplePrepProtocol,dataFile,databaseSource,databaseWeblink,databaseName,modificationParameters,quantationStrategy,labelQuantitation,labelFreeQuantitation,isobaricLabelingReagent,msTarget,msAssayTechnique,msAnalyteType,digestionMethod,digestionReagent,fractionIdentifier,enrichmentStrategy,enrichment,Component",,False,Component,,Template,,Template,,,Sage Bionetworks, ,
118,quantationStrategy,"The general strategy used for differential analysis Example - Absolute quantitation analysis, Isobaric label quantitation analysis, LC-MS label-free quantitation analysis,Provide a value OR provide one of these values - Unknown Not collected, Not applicable, Not specified",,,,True,ManifestColumn,,ManifestColumn,,ManifestColumn,True,STRING,Sage Bionetworks,"A data contributor should be able to write in a name OR provide one of these values: Unknown Not collected, Not applicable, Not specified. ",Proteomics
119,race,Race of individual,"American Indian or Alaska Native,Asian,Black or African American,Multiracial,Native Hawaiian or Pacific Islander,Prefer not to answer,White",,,True,ManifestColumn,,ManifestColumn,,ManifestColumn,True,STRING,"Sage Bionetworks, https://www.synapse.org/#!Synapse:syn25878249, https://jamanetwork.com/pages/inclusive-language, https://thesaurus.cancer.gov/ncitbrowser/pages/home.jsf?version=23.04d", ,"Individual_Human,Phenotype_human"
120,readLength,The length of the read.,,,,True,ManifestColumn,,ManifestColumn,,ManifestColumn,False,NUMBER,Sage Bionetworks, ,"Microbiome,RNAseq,Whole_Genome_Sequencing,bsSeq,scRNAseq"
121,readLengthUnits,The units of measurement.,,,,True,ManifestColumn,,ManifestColumn,,ManifestColumn,False,STRING,Sage Bionetworks, ,"Microbiome,RNAseq,Whole_Genome_Sequencing,bsSeq,scRNAseq"
122,readmeFile,The name of any readme file uploaded to Synapse. Example - example.tsv,,,,False,ManifestColumn,,ManifestColumn,,ManifestColumn,False,STRING,"Sage Bionetworks, EMBL-EBI","A data contributor should be able to write in a name OR provide one of these values: Unknown Not collected, Not applicable, Not specified. ",Genotyping_Human
123,readStrandOrigin,The strand from which the read originates in a strand-specific protocol.,"Forward Reverse,forward reverse",,,True,ManifestColumn,,ManifestColumn,,ManifestColumn,False,STRING,Sage Bionetworks, ,"Microbiome,RNAseq,Whole_Genome_Sequencing,bsSeq,scRNAseq"
124,reagentCatalogNumber,"If the assay reagent is a commercial product, enter the vendor's catalog identifier. If the reagent is a custom preparation enter 'NA'.",,,,False,ManifestColumn,,ManifestColumn,,ManifestColumn,True,STRING,"Sage Bionetworks, ImmPort", ,Genotyping_Human
125,reagentContact,The contact information is particularly helpful when the reagent is not from a commercial vendor.,,,,False,ManifestColumn,,ManifestColumn,,ManifestColumn,True,STRING,"Sage Bionetworks, ImmPort", ,Genotyping_Human
126,reagentIDs,"One or more identifiers, separated by a semicolon (;). The reagent identifier(s) must be stored in a data dictionary .csv file uploaded to Synapse.",,,,False,ManifestColumn,,ManifestColumn,,ManifestColumn,True,STRING,"Sage Bionetworks, ImmPort","A data contributor should be able to write in a name OR provide one of these values: Unknown Not collected, Not applicable, Not specified. ",Genotyping_Human
127,reagentLotNumber,The lot number is often provided by a reagent source when the reagent is replenished over time.,,,,False,ManifestColumn,,ManifestColumn,,ManifestColumn,True,STRING,"Sage Bionetworks, ImmPort", ,Genotyping_Human
128,reagentManufacturer,"The manufacturer is the source of a reagent and may include commercial vendors as well as non-commercial sources (e.g., collaborating labs).",,,,False,ManifestColumn,,ManifestColumn,,ManifestColumn,True,STRING,"Sage Bionetworks, ImmPort", ,Genotyping_Human
129,reagentName,The reagent name is an alternative to the Reagent ID.,,,,False,ManifestColumn,,ManifestColumn,,ManifestColumn,True,STRING,"Sage Bionetworks, ImmPort", ,Genotyping_Human
130,reagentWeblink,An internet address that may provide details of an assay reagent.,,,,False,ManifestColumn,,ManifestColumn,,ManifestColumn,True,STRING,"Sage Bionetworks, ImmPort", ,Genotyping_Human
131,referenceTranscriptID,"The ID for the transcript/gene. Either the NCBI ID or the Ensembl ID must be provided. Provide a value OR provide one of these values - Unknown Not collected, Not applicable, Not specified",,,,True,ManifestColumn,,ManifestColumn,,ManifestColumn,False,STRING,Sage Bionetworks,"A data contributor should be able to write in a name OR provide one of these values: Unknown Not collected, Not applicable, Not specified. ","RNAseq,Whole_Genome_Sequencing,bsSeq,scRNAseq"
132,reportedTrait,"The trait under investigation. Please describe the trait concisely but with enough detail to be clear to a non-specialist. Avoid the use of abbreviations; if these are necessary, please define them or their source in the readme file. Example - Reticulocyte count",,,,True,ManifestColumn,,ManifestColumn,,ManifestColumn,False,STRING,"Sage Bionetworks, EMBL-EBI","A data contributor should be able to write in a name OR provide one of these values: Unknown Not collected, Not applicable, Not specified. ",Genotyping_Human
133,repositoryName,"The public repository name for the transcript (for example, Ensembl or NCBI Gene)","ArrayExpress,Broad Single Cell Portal,dbGAP,ENA,Ensembl,FlowRepository,GenBank,GEO,GISAID,IEDB,ImmPort,MassIVE,MetaboLights,Metabolomics Workbench,MGnify,NCBI Gene,PRIDE,SRA,UniProt",,,True,ManifestColumn,,ManifestColumn,,ManifestColumn,False,STRING,Sage Bionetworks, ,"RNAseq,Whole_Genome_Sequencing,scRNAseq"
