,Attribute,Description,Valid Values,DependsOn,DependsOn Component,Required,Parent,Validation Rules,Properties,Source,Module,multivalue,columnType,Ontology,Notes,UsedIn
134,resultUnit,The unit for the result value,"FPKM,Not applicable,Not collected,Not specified,RPKM,TPM,Unknown",,,True,ManifestColumn,,ManifestColumn,,ManifestColumn,False,STRING,Sage Bionetworks, ,"RNAseq,Whole_Genome_Sequencing,scRNAseq"
135,rnaBatchID,"Isolation batch identifier, provided by the data contributor to Sage Bionetworks. The batch identifier(s) must be stored in a data dictionary .csv file uploaded to Synapse. Provide a value OR provide one of these values - Unknown Not collected, Not applicable, Not specified",,,,True,ManifestColumn,,ManifestColumn,,ManifestColumn,False,STRING,Sage Bionetworks, ,"Whole_Genome_Sequencing,scRNAseq"
136,RNAseq,Template for RNAseq,,"Filename,specimenID,sampleType,measurementTechnique,technologyPlatformVersion,platformLocation,referenceTranscriptID,repositoryName,transcriptType,resultUnit,valueReported,libraryPreparationMethod,libraryVersion,isStranded,readStrandOrigin,readLength,readLengthUnits,runType,totalReads,Component",,False,Component,,Template,,Template,,,Sage Bionetworks, ,
137,runType,The type of run,"Not applicable,Not collected,Not specified,pairedEnd,singleEnd,singleEnd pairedEnd,Unknown",,,True,ManifestColumn,,ManifestColumn,,ManifestColumn,False,STRING,Sage Bionetworks, ,"Microbiome,RNAseq,Whole_Genome_Sequencing,bsSeq,scRNAseq"
138,sampleBatchID,"Sample batch lot identifier, provided by the data contributor to Sage Bionetworks. The batch identifier(s) must be stored in a data dictionary .csv file uploaded to Synapse",,,,False,ManifestColumn,,ManifestColumn,,ManifestColumn,False,STRING,http://purl.obolibrary.org/obo/MS_1000053, ,Metabolomics
139,sampleBatchSize,The number of samples,,,,False,ManifestColumn,,ManifestColumn,,ManifestColumn,False,STRING,Sage Bionetworks, ,Metabolomics
140,sampleBatchSizeUnit,The unit of measurement for number of samples in a batch,,,,False,ManifestColumn,,ManifestColumn,,ManifestColumn,False,STRING,Sage Bionetworks, ,Metabolomics
141,sampleIntroduction,"The sample introduction and delivery. From GC, from LC, direct infusion without chromatography, direct infusion using dedicated autosampler flow rate. Provide a value OR provide one of these values - Unknown Not collected, Not applicable, Not specified",,,,True,ManifestColumn,,ManifestColumn,,ManifestColumn,False,STRING,"Sage Bionetworks, Proposed minimum metadata relative to mass spectrometry","A data contributor should be able to write in a name OR provide one of these values: Unknown Not collected, Not applicable, Not specified. ",Metabolomics
142,samplePrepProtocol,"An internet address that may provide more details of the protocol information (web link). Provide a value OR provide one of these values - Unknown Not collected, Not applicable, Not specified",,,,True,ManifestColumn,,ManifestColumn,,ManifestColumn,False,STRING,"DSLWG,Sage Bionetworks","A data contributor should be able to write in a name OR provide one of these values: Unknown Not collected, Not applicable, Not specified. ","Metabolomics,Metagenomics,Proteomics"
143,sampleType,"The type of sample collected or the term used to describe the source of a biospecimen used for a laboratory test. Provide a value OR provide one of these values - Unknown Not collected, Not applicable, Not specified",,,,True,ManifestColumn,,ManifestColumn,,ManifestColumn,False,STRING,"ImmPort,Sage Bionetworks","A data contributor should be able to write in a name OR provide one of these values: Unknown Not collected, Not applicable, Not specifiedThe sample types are adopted from Uberon, Cell and ChEBI ontologies.. ","Genotyping_Human,Metabolomics,Metagenomics,Microbiome,Proteomics,RNAseq,Whole_Genome_Sequencing,bsSeq,scRNAseq"
144,samplingAge,"The calculated age of the sample, measurement is determined or coded by the data contributor.Other,Unknown, Not collected, Not applicable",,,,True,ManifestColumn,,ManifestColumn,,ManifestColumn,False,STRING,Sage Bionetworks, ,"Biospecimen_human,Biospecimen_non_Human"
145,seqMethod,"Sequencing method. Sequencing method used; Example - 'Sanger, pyrosequencing, ABI-solid'. Provide a value OR provide one of these values - Unknown Not collected, Not applicable, Not specified",,,,True,ManifestColumn,,ManifestColumn,,ManifestColumn,False,STRING,MIMS (Minimum information about a metagenome sequence., https://pubmed.ncbi.nlm.nih.gov/18479204/,Metagenomics
146,seqPlatform,"Sequencing platform information. Provide a value OR provide one of these values - Unknown Not collected, Not applicable, Not specified",,,,True,ManifestColumn,,ManifestColumn,,ManifestColumn,False,STRING,DSWG, ,Metagenomics
147,sequencingBatchID,"Sequencing batch identifier, provided by the data contributor to Sage Bionetworks. The batch identifier(s) must be stored in a data dictionary .csv file uploaded to Synapse. Provide a value OR provide one of these values - Unknown Not collected, Not applicable, Not specified",,,,True,ManifestColumn,,ManifestColumn,,ManifestColumn,False,STRING,Sage Bionetworks,"A data contributor should be able to write in a name OR provide one of these values: Unknown Not collected, Not applicable, Not specified. ","Microbiome,Whole_Genome_Sequencing,bsSeq,scRNAseq"
148,sequencingBatchSize,The number of samples,,,,True,ManifestColumn,,ManifestColumn,,ManifestColumn,False,NUMBER,Sage Bionetworks, ,"Microbiome,bsSeq,scRNAseq"
149,sequencingBatchSizeUnit,The unit of measurement for number of samples in a batch,,,,True,ManifestColumn,,ManifestColumn,,ManifestColumn,False,STRING,Sage Bionetworks, ,"Microbiome,bsSeq,scRNAseq"
150,sex,The biological sex of the individual,"Female,Male,Not applicable,Not collected,Not specified,Other,Unknown",,,True,ManifestColumn,,ManifestColumn,,ManifestColumn,False,STRING,"Sage Bionetworks,http://purl.obolibrary.org/obo/NCIT_C28421,https://www.synapse.org/#!Synapse:syn25878249", ,"Individual_Human,Individual_non_Human,Phenotype_human"
151,sop,"Relevant standard operating procedures. Standard operating procedures used in the assembly and/or annotation of genomes, metagenomes, or environmental sequences. Example - 'http-//press.igsb.anl.gov/earthmicrobiome/protocols-and-standards/its/)'Provide a value OR provide one of these values - Unknown Not collected, Not applicable, Not specified",,,,True,ManifestColumn,,ManifestColumn,,ManifestColumn,False,STRING,MIMS (Minimum information about a metagenome sequence., https://pubmed.ncbi.nlm.nih.gov/18479204/,Metagenomics
152,sourceMatID,"Source material identifiers. A unique identifier assigned to a material sample (as defined by http-//rs.tdwg.org/dwc/terms/materialSampleID and as opposed to a particular digital record of a material sample) used for extracting nucleic acids, and subsequent sequencing.The identifier can refer to the original material collected or any derived sub-samples. Provide a value OR provide one of these values - Unknown Not collected, Not applicable, Not specified",,,,True,ManifestColumn,,ManifestColumn,,ManifestColumn,False,STRING,MIMS (Minimum information about a metagenome sequence., https://pubmed.ncbi.nlm.nih.gov/18479204/,Metagenomics
153,speciesAge,"Age of individual (formatted in months, ex. ""72 months"").note- Uncertainty about the age might require recording age by specifying a lower and upper estimate in months for the age of the animal.",,,,True,ManifestColumn,,ManifestColumn,,ManifestColumn,False,STRING,"Sage Bionetworks, https://www.animalaudiograms.org/audiogram_metadata_scheme#:~:text=species%20are%20possible.-,age,-The%20age%20of", ,Individual_non_Human
154,speciesGroup,The taxonomic ranking including both species and subspecies the individual belongs to.,"Bird,Human,Mammal,Not applicable,Not collected,Not specified,Other,Primate,Rodent,Unknown",,,True,ManifestColumn,,ManifestColumn,,ManifestColumn,False,STRING,https://ontobee.org/ontology/NCIT?iri=http://purl.obolibrary.org/obo/NCIT_C62690https://www.ebi.ac.uk/ols/ontologies/edam/terms?iri=http%3A%2F%2Fedamontology.org%2Fdata_1045, ,"Individual_Human,Individual_non_Human,Phenotype_human"
155,speciesName,"The scientific name of the species (typically a taxonomic group, ex. ""Eremophila alpestris) the individual belongs to.""""""",,,,True,ManifestColumn,,ManifestColumn,,ManifestColumn,False,STRING,https://www.ebi.ac.uk/ols/ontologies/edam/terms?iri=http%3A%2F%2Fedamontology.org%2Fdata_1045,example: https://www.ncbi.nlm.nih.gov/Taxonomy/Browser/wwwtax.cgi?mode=Info&id=135430. ,Individual_non_Human
156,specimenAge,"The subject's age at the time of specimen extraction is the individual's age (since birth) at the time a given specimen was extracted. Measured as age in years. Other, Unknown, Not collected, Not applicable",,,,True,ManifestColumn,,ManifestColumn,,ManifestColumn,False,STRING,Sage Bionetworks, ,"Biospecimen_human,Biospecimen_non_Human"
157,specimenID,"Identifying string linked to a particular sample or specimen, provide by the data contributor",,,,True,ManifestColumn,,ManifestColumn,,ManifestColumn,False,STRING,Sage Bionetworks,n/a (unique to each data contributor). ,"Biospecimen_human,Biospecimen_non_Human,Genotyping_Human,Metabolomics,Metagenomics,Microbiome,Proteomics,RNAseq,Whole_Genome_Sequencing,bsSeq,scRNAseq"
158,specimenSource,Indicate the biological area of the specimen,,,,True,ManifestColumn,,ManifestColumn,,ManifestColumn,False,STRING,https://www.ebi.ac.uk/ols/ontologies/ccf/terms?iri=http%3A%2F%2Fpurl.obolibrary.org%2Fobo%2FUBERON_0004537&lang=en&viewMode=PreferredRoots&siblings=false, ,"Biospecimen_human,Biospecimen_non_Human"
159,specimenType,Type of biological material comprising the Specimen,"blood,Cerebrospinal Fluid (CSF),Not applicable,Not collected,Not specified,organoid,plasma,saliva,serum,sputum,stool,swabs,tissue,Unknown,urine",,,True,ManifestColumn,,ManifestColumn,,ManifestColumn,True,STRING,"Sage Bionetworks, http://purl.obolibrary.org/obo/NCIT_C70713", ,"Biospecimen_human,Biospecimen_non_Human"
160,spectrometerFrequency,The frequency at which a spectrometer causes hydrogen atoms to resonate (in MHz),,,,False,ManifestColumn,,ManifestColumn,,ManifestColumn,False,NUMBER,Sage Bionetworks, ,Metabolomics
161,stage,Stage of the experimental design.,"Discovery,Not applicable,Not collected,Not specified,Other,Replication,Unknown",,,True,ManifestColumn,,ManifestColumn,,ManifestColumn,False,STRING,"Sage Bionetworks, EMBL-EBI", ,Genotyping_Human
162,statisticalModel,"A brief description of the statistical model used to determine association significance. It is important to distinguish studies that would otherwise appear identical (e.g., the same trait analyzed using additive, dominant, and recessive models). Example - additive model",,,,False,ManifestColumn,,ManifestColumn,,ManifestColumn,False,STRING,"Sage Bionetworks, EMBL-EBI","A data contributor should be able to write in a name OR provide one of these values: Unknown Not collected, Not applicable, Not specified. ",Genotyping_Human
163,studyCode,"Unique identifier for the study, assigned by the DCC","ILO,LC,LG,LLFS",,,True,ManifestColumn,,ManifestColumn,,ManifestColumn,True,STRING,Sage Bionetworks, ,"Individual_Human,Individual_non_Human"
164,summaryFile,The name of any summary statistics file uploaded to Synapse. Example - example.tsv,,,,False,ManifestColumn,,ManifestColumn,,ManifestColumn,False,STRING,"Sage Bionetworks, EMBL-EBI","A data contributor should be able to write in a name OR provide one of these values: Unknown Not collected, Not applicable, Not specified. ",Genotyping_Human
165,summaryStatisticsAssembly,Genome assembly for the summary statistics. Example - GRCh38,,,,False,ManifestColumn,,ManifestColumn,,ManifestColumn,True,STRING,Sage Bionetworks,"A data contributor should be able to write in a name OR provide one of these values: Unknown Not collected, Not applicable, Not specified. ",Genotyping_Human
166,targetGene,"Targeted gene or locus name for marker gene studies. Provide a value OR provide one of these values - Unknown Not collected, Not applicable, Not specified",,,,True,ManifestColumn,,ManifestColumn,,ManifestColumn,False,STRING,MIMS (Minimum information about a metagenome sequence., https://pubmed.ncbi.nlm.nih.gov/18479204/,Metagenomics
167,taxon,"Taxonomic identifier. The National Center for Biotechnology Information taxon ID (formatted as, ex. ""txid9989"")",,,,True,ManifestColumn,,ManifestColumn,,ManifestColumn,False,STRING,"https://www.ncbi.nlm.nih.gov/taxonomy, http://edamontology.org/data_1179, http://purl.obolibrary.org/obo/TAXRANK_0000010", ,Individual_non_Human
168,technologyPlatformVersion,"The specific version (application, manufacturer, model, lab, etc.) of a technology that is used to carry out a laboratory or computational experiment. Provide a value OR provide one of these values - Unknown Not collected, Not applicable, Not specified",,,,True,ManifestColumn,,ManifestColumn,,ManifestColumn,True,STRING,"DSLWG,Sage Bionetworks,http://purl.obolibrary.org/obo/NCIT_C45378","A data contributor should be able to write in a name OR provide one of these values: Unknown Not collected, Not applicable, Not specified. ","Metabolomics,Metagenomics,Microbiome,Proteomics,RNAseq,Whole_Genome_Sequencing,bsSeq,scRNAseq"
169,tissue,Indicate the tissue the specimen is from,,,,True,ManifestColumn,,ManifestColumn,,ManifestColumn,False,STRING,http://purl.obolibrary.org/obo/NCIT_C12801, ,"Biospecimen_human,Biospecimen_non_Human"
170,tissueVolume,The volume of the tissue sample. Measured in microliters.,,,,True,ManifestColumn,,ManifestColumn,,ManifestColumn,False,STRING,Sage Bionetworks, ,"Biospecimen_human,Biospecimen_non_Human"
171,tissueWeight,The mass of the tissue specimen. Measured in mg.,,,,True,ManifestColumn,,ManifestColumn,,ManifestColumn,False,STRING,Sage Bionetworks, ,"Biospecimen_human,Biospecimen_non_Human"
172,totalReads,Total number of sequencing reads from a library.,,,,True,ManifestColumn,,ManifestColumn,,ManifestColumn,False,NUMBER,Sage Bionetworks, ,"Microbiome,RNAseq,Whole_Genome_Sequencing,bsSeq,scRNAseq"
173,transcriptType,The type of transcript reported,"lincRNA,mRNA,Not applicable,Not collected,Not specified,Other,snRNA,Unknown",,,True,ManifestColumn,,ManifestColumn,,ManifestColumn,False,STRING,ImmPort, ,"RNAseq,Whole_Genome_Sequencing,scRNAseq"
174,treatmentAmountUnit,Unit of treatment amount.,"AFU,AI,AU/ml,DK units/ml,g/dl,g/l,gm,HAU,IU,iu/l,IU/ml,Kallikrein Inactivator Unit per Milliliter,kg,l,M,mg,mg/dl,mg/l,mg/ml,miu/ml,ml,mM,MOI,ng,ng/dl,ng/ml,ng/nl,ng/ul,nl,nM,Not specified,NPX,optical density,other,PFU,PFUe,pg,pg/mg creatinine,pg/ml,pg/nl,pg/ul,pl,pM,Pound,TCID50,ug,ug/dl,ug/l,ug/ml,ug/ul,uiu/ml,ul,uM,umol/l,units/ml",,,False,ManifestColumn,,ManifestColumn,,ManifestColumn,True,NUMBER,"Sage Bionetworks, ImmPort", ,Genotyping_Human
175,treatmentAmountValue,"The Amount Value indicates how much (concentration, mass, volume) of a treatment agent was applied to a sample.",,,,False,ManifestColumn,,ManifestColumn,,ManifestColumn,True,STRING,"Sage Bionetworks, ImmPort", ,Genotyping_Human
176,treatmentDurationUnit,Unit of treatment duration.,"d.p.c.,Days,Hours,Minutes,Months,Not applicable,Not collected,Not specified,Seconds,Unknown,Weeks,Years",,,False,ManifestColumn,,ManifestColumn,,ManifestColumn,False,STRING,"Sage Bionetworks, ImmPort", ,Genotyping_Human
177,treatmentDurationValue,Duration of treatment.,,,,False,ManifestColumn,,ManifestColumn,,ManifestColumn,False,NUMBER,"Sage Bionetworks, ImmPort", ,Genotyping_Human
178,treatmentID(s),"One or more identifiers, separated by a semicolon (;). The treatment identifier(s) must be stored in a data dictionary .csv file uploaded to Synapse.",,,,False,ManifestColumn,,ManifestColumn,,ManifestColumn,True,STRING,"Sage Bionetworks, ImmPort","A data contributor should be able to write in a name OR provide one of these values: Unknown Not collected, Not applicable, Not specified. ",Genotyping_Human
179,treatmentName,"Treatments refer to in vitro modifications of samples. Three treatment types are supported- agent amount, duration, and temperature.  The treatment name is an alternate identifier to the Treatment ID.",,,,False,ManifestColumn,,ManifestColumn,,ManifestColumn,True,STRING,"Sage Bionetworks, ImmPort", ,Genotyping_Human
180,treatmentTemperatureUnit,Unit of treatment temperature.,"C,F,K,Not specified",,,False,ManifestColumn,,ManifestColumn,,ManifestColumn,False,STRING,"Sage Bionetworks, ImmPort", ,Genotyping_Human
181,treatmentTemperatureValue,Value of treatment temperature.,,,,False,ManifestColumn,,ManifestColumn,,ManifestColumn,False,NUMBER,"Sage Bionetworks, ImmPort", ,Genotyping_Human
182,useReadMeFile,Was a readme file uploaded to Synapse?,,,,True,ManifestColumn,,ManifestColumn,,ManifestColumn,False,STRING,Sage Bionetworks, ,Genotyping_Human
183,useReagent,Was a reagent applied to the sample?,"FALSE,TRUE",,,True,ManifestColumn,,ManifestColumn,,ManifestColumn,False,BOOLEAN,"Sage Bionetworks, ImmPort", ,Genotyping_Human
184,useSummaryFile,Was a summary statitics file uploded to Synapse?,,,,True,ManifestColumn,,ManifestColumn,,ManifestColumn,False,STRING,"Sage Bionetworks, EMBL-EBI", ,Genotyping_Human
185,useTreatment,Was a treatment applied to the sample?,,,,True,ManifestColumn,,ManifestColumn,,ManifestColumn,False,BOOLEAN,"Sage Bionetworks, ImmPort", ,Genotyping_Human
186,vacuumPressure,The recorded vacuum pressure value,,,,False,ManifestColumn,,ManifestColumn,,ManifestColumn,False,NUMBER,"Sage Bionetworks, Proposed minimum metadata relative to mass spectrometry", ,Metabolomics
187,vacuumPressureUnit,Unit of vacuum pressure value,"AFU,AI,AU/ml,bp g/dl,DK units/ml,g/l,gm,HAU,IU,iu/l,IU/ml,Kallikrein Inactivator Unit per Milliliter,kg,l,M,mg,mg/dl,mg/l,mg/ml,miu/ml,ml,mM,MOI,ng,ng/dl,ng/ml,ng/nl,ng/ul,nl,nM,Not specified,NPX,optical density,PFU,PFUe,pg,pg/mg creatinine,pg/ml,pg/nl,pg/ul,pl,pM,Pound,TCID50,ug,ug/dl,ug/l,ug/ml,ug/ul,uiu/ml,ul,uM,umol/l,units/ml",,,False,ManifestColumn,,ManifestColumn,,ManifestColumn,False,STRING,"Sage Bionetworks, Proposed minimum metadata relative to mass spectrometry", ,Metabolomics
188,valueReported,The count or gene count for the transcript,,,,True,ManifestColumn,,ManifestColumn,,ManifestColumn,False,NUMBER,Sage Bionetworks, ,"RNAseq,Whole_Genome_Sequencing,scRNAseq"
189,variantCount,The number of variants analysed in the discovery stage (after QC). Example - 52500,,,,True,ManifestColumn,,ManifestColumn,,ManifestColumn,False,STRING,"Sage Bionetworks, EMBL-EBI","A data contributor should be able to write in a name OR provide one of these values: Unknown Not collected, Not applicable, Not specified. ",Genotyping_Human
190,visitCode,"Indicate which longitudinal visit for the individual the data comes from, provided by the data contributor's data dictionary",,,,True,ManifestColumn,,ManifestColumn,,ManifestColumn,False,NUMBER,Sage Bionetworks, ,Individual_Human
191,Whole_Genome_Sequencing,Template for Whole_Genome_Sequencing,,"Filename,specimenID,sampleType,measurementTechnique,technologyPlatformVersion,platformLocation,referenceTranscriptID,repositoryName,transcriptType,resultUnit,valueReported,rnaBatchID,libraryBatchID,sequencingBatchID,libraryPrep,libraryPreparationMethod,libraryVersion,isStranded,readStrandOrigin,readLength,readLengthUnits,runType,totalReads,Component",,False,Component,,Template,,Template,,,Sage Bionetworks, ,
192,rnaBatchSize,The number of samples,,,,False,ManifestColumn,,ManifestColumn,,ManifestColumn,False,NUMBER,Sage Bionetworks, ,scRNAseq
193,rnaBatchSizeUnit,The unit of measurement for number of samples in a batch,"AFU,AI,AU/ml,bp g/dl,DK units/ml,g/l,gm,HAU,IU,iu/l,IU/ml,Kallikrein Inactivator Unit per Milliliter,kg,l,M,mg,mg/dl,mg/l,mg/ml,miu/ml,ml,mM,MOI,ng,ng/dl,ng/ml,ng/nl,ng/ul,nl,nM,Not specified,NPX,optical density,other,PFU,PFUe,pg,pg/mg creatinine,pg/ml,pg/nl,pg/ul,pl,pM,Pound,TCID50,ug,ug/dl,ug/l,ug/ml,ug/ul,uiu/ml,ul,uM,umol/l,units/ml",,,True,ManifestColumn,,ManifestColumn,,ManifestColumn,False,STRING,Sage Bionetworks, ,scRNAseq
194,scRNAseq,Template for scRNAseq,,"Filename,specimenID,sampleType,measurementTechnique,technologyPlatformVersion,platformLocation,referenceTranscriptID,repositoryName,transcriptType,resultUnit,valueReported,rnaBatchID,rnaBatchSize,rnaBatchSizeUnit,libraryBatchID,sequencingBatchID,sequencingBatchSize,sequencingBatchSizeUnit,libraryPrep,libraryPreparationMethod,libraryVersion,isStranded,readStrandOrigin,readLength,readLengthUnits,runType,totalReads,Component",,False,Component,,Template,,Template,,,Sage Bionetworks, ,
195,studyKey,,,,,True,ManifestColumn,,ManifestColumn,Sage Bionetworks,ManifestColumn,False,STRING,Sage Bionetworks,,study_folder_template
196,studyName,,,,,True,ManifestColumn,,ManifestColumn,Sage Bionetworks,ManifestColumn,False,STRING,Sage Bionetworks,,study_folder_template
197,projectShortName,,"LC,ILO,LLFS,LG",,,True,ManifestColumn,,ManifestColumn,Sage Bionetworks,ManifestColumn,False,STRING,Sage Bionetworks,,study_folder_template
198,projectFullName,,,,,True,ManifestColumn,,ManifestColumn,Sage Bionetworks,ManifestColumn,False,STRING,Sage Bionetworks,,study_folder_template
199,dataTypeAll,,,,,True,ManifestColumn,,ManifestColumn,Sage Bionetworks,ManifestColumn,True,STRING_LIST,Sage Bionetworks,,study_folder_template
200,species,,"Human,Mouse",,,True,ManifestColumn,,ManifestColumn,Sage Bionetworks,ManifestColumn,True,STRING_LIST,Sage Bionetworks,,study_folder_template
201,studyAbstract,,,,,True,ManifestColumn,,ManifestColumn,Sage Bionetworks,ManifestColumn,False,STRING,Sage Bionetworks,,study_folder_template
202,studyDescription,,,,,True,ManifestColumn,,ManifestColumn,Sage Bionetworks,ManifestColumn,False,STRING,Sage Bionetworks,,study_folder_template
203,studyFocus,,,,,True,ManifestColumn,,ManifestColumn,Sage Bionetworks,ManifestColumn,False,STRING,Sage Bionetworks,,study_folder_template
204,program,,"ELITE,AD",,,True,ManifestColumn,,ManifestColumn,Sage Bionetworks,ManifestColumn,False,STRING,Sage Bionetworks,,study_folder_template
205,grantNumber,,,,,True,ManifestColumn,,ManifestColumn,Sage Bionetworks,ManifestColumn,True,STRING_LIST,Sage Bionetworks,,study_folder_template
206,studyWiki,,,,,True,ManifestColumn,,ManifestColumn,Sage Bionetworks,ManifestColumn,False,STRING,Sage Bionetworks,,study_folder_template
207,acknowledgment,,,,,True,ManifestColumn,,ManifestColumn,Sage Bionetworks,ManifestColumn,False,STRING,Sage Bionetworks,,study_folder_template
208,methods,,,,,True,ManifestColumn,,ManifestColumn,Sage Bionetworks,ManifestColumn,False,STRING,Sage Bionetworks,,study_folder_template
209,relatedStudies,,,,,True,ManifestColumn,,ManifestColumn,Sage Bionetworks,ManifestColumn,True,STRING_LIST,Sage Bionetworks,,study_folder_template
210,studyType,,,,,True,ManifestColumn,,ManifestColumn,Sage Bionetworks,ManifestColumn,False,STRING,Sage Bionetworks,,study_folder_template
211,isModelSystem,,"TRUE,FALSE",,,True,ManifestColumn,,ManifestColumn,Sage Bionetworks,ManifestColumn,False,BOOLEAN,Sage Bionetworks,,study_folder_template
212,isFeatured,,"TRUE,FALSE",,,True,ManifestColumn,,ManifestColumn,Sage Bionetworks,ManifestColumn,False,BOOLEAN,Sage Bionetworks,,study_folder_template
213,ackContext,,,,,True,ManifestColumn,,ManifestColumn,Sage Bionetworks,ManifestColumn,False,STRING,Sage Bionetworks,,study_folder_template
214,studyMetadata,,,,,True,ManifestColumn,,ManifestColumn,Sage Bionetworks,ManifestColumn,False,STRING,Sage Bionetworks,,study_folder_template
215,accessReqs,,,,,True,ManifestColumn,,ManifestColumn,Sage Bionetworks,ManifestColumn,False,STRING,Sage Bionetworks,,study_folder_template
216,isReleased,,"TRUE,FALSE",,,True,ManifestColumn,,ManifestColumn,Sage Bionetworks,ManifestColumn,False,BOOLEAN,Sage Bionetworks,,study_folder_template
217,newsRelease,,,,,True,ManifestColumn,,ManifestColumn,Sage Bionetworks,ManifestColumn,False,STRING,Sage Bionetworks,,study_folder_template
218,metadataType,,,,,True,ManifestColumn,,ManifestColumn,Sage Bionetworks,ManifestColumn,False,STRING,Sage Bionetworks,,study_folder_template
219,study_folder_template,Annotations for study folders,,"studyKey,studyName,projectShortName,projectFullName,dataTypeAll,Species,specimenType,studyAbstract,studyDescription,studyFocus,program,grantNumber,studyWiki,acknowledgment,methods,relatedStudies,studyType,isModelSystem,isFeatured,ackContext,studyMetadata,accessReqs,isReleased,newsRelease,metadataType,Component",,,Component,,Template,Sage Bionetworks,Template,NA,NA,Sage Bionetworks,,
