,Attribute,Description,Valid Values,DependsOn,DependsOn Component,Required,Parent,Validation Rules,Properties,Source,Module,multivalue,columnType,Ontology,Notes,UsedIn
0,acquisitionBatchID,"Acquisition batch identifier, provided by the data contributor to Sage Bionetworks. The batch identifier(s) must be stored in a data dictionary .csv file uploaded to Synapse",,,,False,ManifestColumn,,ManifestColumn,,ManifestColumn,False,STRING,Sage Bionetworks, ,Metabolomics
1,acquisitionBatchSize,The number of samples,,,,False,ManifestColumn,,ManifestColumn,,ManifestColumn,False,STRING,Sage Bionetworks, ,Metabolomics
2,acquisitionBatchSizeUnit,The unit of measurement for number of samples in a batch,,,,False,ManifestColumn,,ManifestColumn,,ManifestColumn,False,STRING,Sage Bionetworks, ,Metabolomics
3,acquisitionMode,"The specific aspect of a mass spectrometer method by which mass ranges are selected and possibly dissociated (full scan, MSn, SIM, MRM, etc.). Provide a value OR provide one of these values - Unknown Not collected, Not applicable, Not specified",,,,True,ManifestColumn,,ManifestColumn,,ManifestColumn,False,STRING,https://www.ebi.ac.uk/ols/ontologies/ms/terms?iri=http%3A%2F%2Fpurl.obolibrary.org%2Fobo%2FMS_1003213,"A data contributor should be able to write in a name OR provide one of these values: Unknown Not collected, Not applicable, Not specified. ",Metabolomics
4,acquisitionSoftware,"The name of the acquisition software used. Provide a value OR provide one of these values - Unknown Not collected, Not applicable, Not specified",,,,True,ManifestColumn,,ManifestColumn,,ManifestColumn,False,STRING,http://purl.obolibrary.org/obo/MS_1001455,"A data contributor should be able to write in a name OR provide one of these values: Unknown Not collected, Not applicable, Not specified. ",Metabolomics
5,acquisitionSoftwareVersion,"The version number of software used. Provide a value OR provide one of these values - Unknown Not collected, Not applicable, Not specified",,,,True,ManifestColumn,,ManifestColumn,,ManifestColumn,False,NUMBER,Sage Bionetworks,"A data contributor should be able to write in a name OR provide one of these values: Unknown Not collected, Not applicable, Not specified. ",Metabolomics
6,adapters,"Adapters provide priming sequences for both amplification and sequencing of the sample-library fragments. Both adapters should be reported; in uppercase letters. Example - 'AATGATACGGCGACCACCGAGATCTACACGCT; CAAGCAGAAGACGGCATACGAGAT'Provide a value OR provide one of these values - Unknown Not collected, Not applicable, Not specified",,,,True,ManifestColumn,,ManifestColumn,,ManifestColumn,False,STRING,MIMS (Minimum information about a metagenome sequence., https://pubmed.ncbi.nlm.nih.gov/18479204/,Metagenomics
7,adjustedCovariates,Any covariates the GWAS is adjusted for. Multiple values can be listed separately by a semicolon (;). Example - age;sex,,,,False,ManifestColumn,,ManifestColumn,,ManifestColumn,True,STRING,"Sage Bionetworks, EMBL-EBI","A data contributor should be able to write in a name OR provide one of these values: Unknown Not collected, Not applicable, Not specified. ",Genotyping_Human
8,age,"Age of the individual (age in years of the individual at first recorded study event (enrollment, visit, observation, sample collection, survey completion, etc.)",,,,True,ManifestColumn,,ManifestColumn,,ManifestColumn,False,STRING,Sage Bionetworks,"A data contributor should be able to write in a name OR provide one of these values: Unknown Not collected, Not applicable, Not specified. ","Individual_Human,Phenotype_human"
9,arrayInformation,"Additional information about the genotyping array. For example, for targeted arrays, please provide the specific type of array. Example - Immunochip",,,,False,ManifestColumn,,ManifestColumn,,ManifestColumn,False,STRING,"Sage Bionetworks, EMBL-EBI","A data contributor should be able to write in a name OR provide one of these values: Unknown Not collected, Not applicable, Not specified. ",Genotyping_Human
10,arrayManufacturer,"Manufacturer of the genotyping array used for the discovery stage. Separate multiple manufacturers by a semicolon (;). Example - Illumina, Affymetrix, Perlegen",,,,False,ManifestColumn,,ManifestColumn,,ManifestColumn,True,STRING,"Sage Bionetworks, EMBL-EBI","A data contributor should be able to write in a name OR provide one of these values: Unknown Not collected, Not applicable, Not specified. ",Genotyping_Human
11,assay,The analysis or technology used to generate the data in this file,,,,True,ManifestColumn,,ManifestColumn,,ManifestColumn,False,STRING,Sage Bionetworks, ,Biospecimen_non_Human
12,assemblyName,"Name/version of the assembly provided by the submitter used in the genome browsers and the community. Example - 'HuRef, JCVI_ISG_3_1.0'Provide a value OR provide one of these values - Unknown Not collected, Not applicable, Not specified",,,,True,ManifestColumn,,ManifestColumn,,ManifestColumn,False,STRING,MIMS (Minimum information about a metagenome sequence., https://pubmed.ncbi.nlm.nih.gov/18479204/,Metagenomics
13,assemblyQual,"Assembly quality. The assembly quality category is based on sets of criteria outlined for each assembly quality category.High Quality- Multiple fragments where gaps span repetitive regions. Presence of the 23S, 16S and 5S rRNA genes and at least 18 tRNAs.Medium Quality- Many fragments with little to no review of assembly other than reporting of standard assembly statistics.Low Quality- Many fragments with little to no review of assembly other than reporting of standard assembly statistics. Assembly statistics include, but are not limited to, total assembly size, number of contigs, contig N50/L50, and maximum contig length. Example values - high-quality genome, medium-quality genome, low-quality genome",,,,True,ManifestColumn,,ManifestColumn,,ManifestColumn,False,STRING,MIMS (Minimum information about a metagenome sequence., https://pubmed.ncbi.nlm.nih.gov/18479204/,Metagenomics
14,assemblySoftware,"Tool(s) used for assembly, including version number and parameters. Example - 'metaSPAdes;3.11.0; kmer set 21,33,55,77,99,121, default parameters otherwise'. Provide a value OR provide one of these values - Unknown Not collected, Not applicable, Not specified",,,,True,ManifestColumn,,ManifestColumn,,ManifestColumn,False,STRING,MIMS (Minimum information about a metagenome sequence., https://pubmed.ncbi.nlm.nih.gov/18479204/,Metagenomics
15,assemblyQual,"Assembly quality. The assembly quality category is based on sets of criteria outlined for each assembly quality category.High Quality- Multiple fragments where gaps span repetitive regions. Presence of the 23S, 16S and 5S rRNA genes and at least 18 tRNAs.Medium Quality- Many fragments with little to no review of assembly other than reporting of standard assembly statistics.Low Quality- Many fragments with little to no review of assembly other than reporting of standard assembly statistics. Assembly statistics include, but are not limited to, total assembly size, number of contigs, contig N50/L50, and maximum contig length. Example values - high-quality genome, medium-quality genome, low-quality genome",,,,True,ManifestColumn,,ManifestColumn,,ManifestColumn,False,STRING,MIMS (Minimum information about a metagenome sequence., https://pubmed.ncbi.nlm.nih.gov/18479204/,Metagenomics
16,assemblySoftware,"Tool(s) used for assembly, including version number and parameters. Example - 'metaSPAdes;3.11.0; kmer set 21,33,55,77,99,121, default parameters otherwise'. Provide a value OR provide one of these values - Unknown Not collected, Not applicable, Not specified",,,,True,ManifestColumn,,ManifestColumn,,ManifestColumn,False,STRING,MIMS (Minimum information about a metagenome sequence., https://pubmed.ncbi.nlm.nih.gov/18479204/,Metagenomics
17,associatedResource,"Relevant electronic resources. A related resource that is referenced, cited, or otherwise associated to the sequence. Example - 'http-//www.earthmicrobiome.org/'Provide a value OR provide one of these values - Unknown Not collected, Not applicable, Not specified",,,,True,ManifestColumn,,ManifestColumn,,ManifestColumn,False,STRING,MIMS (Minimum information about a metagenome sequence., https://pubmed.ncbi.nlm.nih.gov/18479204/,Metagenomics
18,backgroundTrait,Any background trait(s) shared by all individuals in the GWAS (e.g. in both cases and controls). Example - Nicotine dependence,,,,False,ManifestColumn,,ManifestColumn,,ManifestColumn,True,STRING,"Sage Bionetworks, EMBL-EBI","A data contributor should be able to write in a name OR provide one of these values: Unknown Not collected, Not applicable, Not specified. ",Genotyping_Human
19,batchID,"ID used to identify a batch, provided by the data contributor to Sage Bionetworks. The batch identifier(s) must be stored in a data dictionary .csv file uploaded to Synapse",,,,False,ManifestColumn,,ManifestColumn,,ManifestColumn,False,STRING,Sage Bionetworks, ,Metabolomics
20,batchLabel,Used to supply batch label information with any string value,,,,False,ManifestColumn,,ManifestColumn,,ManifestColumn,False,STRING,http://purl.obolibrary.org/obo/MS_4000088, ,Metabolomics
21,batchSize,The number of samples,,,,False,ManifestColumn,,ManifestColumn,,ManifestColumn,False,NUMBER,Sage Bionetworks, ,Metabolomics
22,batchSizeUnit,The unit of measurement for number of samples in a batch,,,,False,ManifestColumn,,ManifestColumn,,ManifestColumn,False,STRING,Sage Bionetworks, ,Metabolomics
23,Biospecimen_human,Template for Biospecimen_human,,"Filename,individualID,specimenID,specimenType,measurementTechnique,specimenAge,samplingAge,organ,tissue,tissueVolume,tissueWeight,specimenSource,nucleicAcidSource,cellType,fastingState,isPostMortem,Component",,False,Component,,Template,,Template,,,Sage Bionetworks, ,
24,Biospecimen_non_Human,Template for Biospecimen_non_Human,,"Filename,individualID,specimenID,specimenType,assay,specimenAge,samplingAge,organ,tissue,tissueVolume,tissueWeight,specimenSource,nucleicAcidSource,cellType,fastingState,isPostMortem,Component",,False,Component,,Template,,Template,,,Sage Bionetworks, ,
25,bsSeq,Template for bsSeq,,"Filename,specimenID,sampleType,measurementTechnique,technologyPlatformVersion,platformLocation,referenceTranscriptID,dnaBatchID,dnaBatchSize,dnaBatchSizeUnit,libraryBatchID,libraryPrep,libraryPreparationMethod,libraryVersion,sequencingBatchID,sequencingBatchSize,sequencingBatchSizeUnit,isStranded,readStrandOrigin,readLength,readLengthUnits,runType,totalReads,directionalBSseqLibrary,gDNAconc,lambdaDNAconc,pcrCycles,meanCoverage,conversionRatio,conversionRatioUnits,enrichmentMethod,Component",,False,Component,,Template,,Template,,,Sage Bionetworks, ,
26,captivityDuration,"The duration of captivity in months for the individuals in captivity (formatted in months, ex. 72 months).note- Applicable only to animals with captivity status captive.",,,,False,ManifestColumn,,ManifestColumn,,ManifestColumn,False,STRING,"https://www.animalaudiograms.org/audiogram_metadata_scheme#:~:text=species%20are%20possible.-,captivity%20duration,-The%20duration%20of", ,Individual_non_Human
27,captivityStatus,"The status of the individual with regard to captivity.note- Wild, captive, and stranded values are applicable, especially for marine mammals. Depending on life stage terminology for individual species, other values are possible. Please let the data curation team know.","Captive,Stranded,Wild",,,True,ManifestColumn,,ManifestColumn,,ManifestColumn,False,STRING,"https://www.animalaudiograms.org/audiogram_metadata_scheme#:~:text=of%20the%20animal.-,captivity%20status,-The%20status%20of", ,Individual_non_Human
28,cellType,Indicate the cell type.,,,,True,ManifestColumn,,ManifestColumn,,ManifestColumn,False,STRING,"https://bioportal.bioontology.org/ontologies/CCF/?p=classes&conceptid=http%3A%2F%2Fpurl.org%2Fccf%2Fcell_type,https://www.ebi.ac.uk/ols/ontologies/ccf/terms?iri=http%3A%2F%2Fpurl.org%2Fccf%2Fcell_type", ,"Biospecimen_human,Biospecimen_non_Human"
29,cohort,Name of the cohort the individual belongs to,,,,True,ManifestColumn,,ManifestColumn,,ManifestColumn,True,STRING,Sage Bionetworks, ,"Individual_Human,Individual_non_Human,Phenotype_human"
30,commonName,"The biological species common name the individual belongs to (ex. ""Horned Lark""). note- As a default, the valid scientific name for the species should be indicated.",,,,True,ManifestColumn,,ManifestColumn,,ManifestColumn,False,STRING,https://www.ebi.ac.uk/ols/ontologies/edam/terms?iri=http%3A%2F%2Fedamontology.org%2Fdata_1874,example: https://www.ncbi.nlm.nih.gov/Taxonomy/Browser/wwwtax.cgi?mode=Info&id=135430. ,Individual_non_Human
31,consentGroupID,"Indicate the consent group for the individual, provided by the data contributor's data dictionary",,,,True,ManifestColumn,,ManifestColumn,,ManifestColumn,False,STRING,Sage Bionetworks, ,Individual_Human
32,controlType,"Control samples suitable for normalization and batch correction.Possible example values - GIS, GoldenWest, NIST SRM 1950, AIBL pool,Baker pool,water plus Baker ISTD, study pool, internal standards, Other, Unknown, Not collected, Not applicable, Not specified",,,,False,ManifestColumn,,ManifestColumn,,ManifestColumn,False,STRING,https://doi.org/10.1101/2020.05.19.105197 https://doi.org/10.1038/sdata.2017.140 https://www-s.nist.gov/srmors/view_detail.cfm?srm=1950 Sage Bionetworks DSLWG,"A data contributor should be able to write in a name OR provide one of these values: Unknown Not collected, Not applicable, Not specified. ",Metabolomics
33,conversionRatio,The ratio or % detailing how well the bisulfite conversion worked,,,,True,ManifestColumn,,ManifestColumn,,ManifestColumn,False,STRING,Sage Bionetworks, ,bsSeq
34,conversionRatioUnits,The units of measurement.,,,,True,ManifestColumn,,ManifestColumn,,ManifestColumn,False,STRING,Sage Bionetworks, ,bsSeq
35,countryCode,"Indicate the geographic region for the individual (shown as ex. ""840"")",,,,True,ManifestColumn,,ManifestColumn,,ManifestColumn,False,INTEGER,https://wits.worldbank.org/countryprofile/metadata/en/country/all, ,Individual_Human
36,databaseLibrary,"The name(s) of the associated database library. Provide a value OR provide one of these values - Unknown Not collected, Not applicable, Not specified",,,,True,ManifestColumn,,ManifestColumn,,ManifestColumn,True,STRING,DSWG, ,Metagenomics
37,databaseName,"The name of the search database (nr, SwissProt or est_human, and/or mass spectral library). Provide a value OR provide one of these values - Unknown Not collected, Not applicable, Not specified",,,,True,ManifestColumn,,ManifestColumn,,ManifestColumn,False,STRING,"DSLWG,Sage Bionetworks,http://purl.obolibrary.org/obo/MS_1001013","A data contributor should be able to write in a name OR provide one of these values: Unknown Not collected, Not applicable, Not specified. ","Metabolomics,Metagenomics,Proteomics"
38,databaseSource,"The name of the organization, project, or laboratory from where the database is obtained (UniProt, NCBI, EBI, other).",,,,True,ManifestColumn,,ManifestColumn,,ManifestColumn,False,STRING,"DSLWG,Sage Bionetworks,http://purl.obolibrary.org/obo/MS_1001012","A data contributor should be able to write in a name OR provide one of these values: Unknown Not collected, Not applicable, Not specified. ","Metabolomics,Metagenomics,Proteomics"
39,databaseVersion,"The version of the database. Provide a value OR provide one of these values - Unknown Not collected, Not applicable, Not specified",,,,True,ManifestColumn,,ManifestColumn,,ManifestColumn,True,STRING,DSWG, ,Metagenomics
40,databaseWeblink,"An internet address that may provide details of a database or software search, as well as for labs that generate their own search method (web link). Provide a value OR provide one of these values - Unknown Not collected, Not applicable, Not specified",,,,True,ManifestColumn,,ManifestColumn,,ManifestColumn,False,STRING,"Sage Bionetworks, DSLWG","A data contributor should be able to write in a name OR provide one of these values: Unknown Not collected, Not applicable, Not specified. ","Metabolomics,Metagenomics,Proteomics"
41,dataFile,"Name of additional file(s) accompanying the data. The file(s) provide, for example, the name of any raw files generated by the instrument, generated reports from a vendor, an Rscript, or an instructions document. The files can be instrument raw files, converted peak lists such as mzML, MGF, or result files like mzIdentML. The files can be additional documentation submitted alongside the data needed for reuse and sharing purposes. Provide the file names of any additional files submitted alongside the data (ex., an ADAT file). Multiple file names can be separated by (;)Provide a value OR provide one of these values - Unknown Not collected, Not applicable, Not specified",,,,True,ManifestColumn,,ManifestColumn,,ManifestColumn,True,STRING,"DSLWG,Proteomics Sample Metadata,Sage Bionetworks","A data contributor should be able to write in a name OR provide one of these values: Unknown Not collected, Not applicable, Not specified. ","Metabolomics,Metagenomics,Proteomics"
42,diagnosis,Indicate the disease or condition.,,,,False,ManifestColumn,,ManifestColumn,,ManifestColumn,True,STRING,"https://www.ebi.ac.uk/ols/ontologies/mondo, https://www.ebi.ac.uk/ols/ontologies/maxo, https://www.ebi.ac.uk/ols/ontologies/hp","HPO, MONDO, MAXO codes or labels (not listed for purposes of this RFC), Other, Unknown, Not collected, Not applicable, Not specified. ","Individual_Human,Phenotype_human"
43,diagnosisStatus,"Whether the individual has been diagnosed with a condition or disease (physical and/or cognitive), \True"" indicates the individual has been diagnosed""","FALSE,TRUE",,,True,ManifestColumn,,ManifestColumn,,ManifestColumn,True,STRING,Sage Bionetworks, ,"Individual_Human,Phenotype_human"
44,digestionMethod,"The type of digestion (ex. in-solution, in-gel)Provide a value OR provide one of these values - Unknown Not collected, Not applicable, Not specified",,,,True,ManifestColumn,,ManifestColumn,,ManifestColumn,True,STRING,"Sage Bionetworks, DSLWG","A data contributor should be able to write in a name OR provide one of these values: Unknown Not collected, Not applicable, Not specified. ",Proteomics
45,digestionReagent,Enzymes or reagents used for digestion.,"2-iodobenzoate,Arg-C,Asp-N,Asp-N_ambic,Chymotrypsin,CNBr,Formic_acid,Glutamyl endopeptidase,Leukocyte elastase,Lys-C,Lys-C/P,No cleavage,NoEnzyme,Not available,Not collected,Not specified,PepsinA,Proline endopeptidase,TrypChymo,Trypsin,Trypsin/P,Unknown,Unspecific cleavage,V8-DE,V8-E",,,True,ManifestColumn,,ManifestColumn,,ManifestColumn,True,STRING,Proteomics Data Commons, ,Proteomics
46,directionalBSseqLibrary,Indicates whether or not the bisulfiteSeq library is directional,,,,True,ManifestColumn,,ManifestColumn,,ManifestColumn,False,STRING,Sage Bionetworks, ,bsSeq
47,dnaBatchID,"DNA isolation batch identifier, provided by the data contributor to Sage Bionetworks. The batch identifier(s) must be stored in a data dictionary .csv file uploaded to Synapse. Provide a value OR provide one of these values - Unknown Not collected, Not applicable, Not specified",,,,True,ManifestColumn,,ManifestColumn,,ManifestColumn,False,STRING,Sage Bionetworks,"A data contributor should be able to write in a name OR provide one of these values: Unknown Not collected, Not applicable, Not specified. ","Microbiome,bsSeq"
48,dnaBatchSize,The number of samples,,,,True,ManifestColumn,,ManifestColumn,,ManifestColumn,False,NUMBER,Sage Bionetworks, ,"Microbiome,bsSeq"
49,dnaBatchSizeUnit,The unit of measurement for number of samples in a batch,"AFU,AI,AU/ml,bp g/dl,DK units/ml,g/l,gm,HAU,IU,iu/l,IU/ml,Kallikrein Inactivator Unit per Milliliter,kg,l,M,mg,mg/dl,mg/l,mg/ml,miu/ml,ml,mM,MOI,ng,ng/dl,ng/ml,ng/nl,ng/ul,nl,nM,Not specified,NPX,optical density,other,PFU,PFUe,pg,pg/mg creatinine,pg/ml,pg/nl,pg/ul,pl,pM,Pound,TCID50,ug,ug/dl,ug/l,ug/ml,ug/ul,uiu/ml,ul,uM,umol/l,units/ml",,,True,ManifestColumn,,ManifestColumn,,ManifestColumn,False,STRING,Sage Bionetworks, ,"Microbiome,bsSeq"
50,DNAextraction,"DNA extraction kit method. Provide a value OR provide one of these values - Unknown Not collected, Not applicable, Not specified",,,,True,ManifestColumn,,ManifestColumn,,ManifestColumn,False,STRING,DSWG, ,Metagenomics
51,enrichment,"Protocol or reagent used for enrichment (ex. Fe3+NTA-Agarose (Qiagen)Provide a value OR provide one of these values - Unknown Not collected, Not applicable, Not specified",,,,True,ManifestColumn,,ManifestColumn,,ManifestColumn,True,STRING,Proteomic Data Commons,"A data contributor should be able to write in a name OR provide one of these values: Unknown Not collected, Not applicable, Not specified. ",Proteomics
52,enrichmentMethod,"The method used for performing an enrichment of specific regions by a restriction enzyme digest. Provide a value OR provide one of these values - Unknown Not collected, Not applicable, Not specified",,,,True,ManifestColumn,,ManifestColumn,,ManifestColumn,False,STRING,Sage Bionetworks,"A data contributor should be able to write in a name OR provide one of these values: Unknown Not collected, Not applicable, Not specified. ",bsSeq
53,enrichmentStrategy,Type of peptide or protein enrichment,"Acetylome Proteome,Glycoproteome,Lipidome,Metabolome,Not applicable,Not available,Not collected,Not specified,Phosphoproteome,Ubiquitylome,Unknown",,,True,ManifestColumn,,ManifestColumn,,ManifestColumn,True,STRING,Proteomic Data Commons,"A data contributor should be able to write in a name OR provide one of these values: Unknown Not collected, Not applicable, Not specified. ",Proteomics
54,ethnicGroupCode,"A coded value specifying the self-declared ethnic origination independent of racial origination, provided by the data contributor's data dictionary",,,,False,ManifestColumn,,ManifestColumn,,ManifestColumn,True,STRING,https://ncithesaurus.nci.nih.gov/ncitbrowser/pages/concept_details.jsf?dictionary=NCI_Thesaurus&version=23.04d&code=C93563&ns=ncit&type=properties&key=1040179992&b=1&n=0&vse=null,"A data contributor should be able to write in a name OR provide one of these values: Unknown Not collected, Not applicable, Not specified. ","Individual_Human,Phenotype_human"
55,ethnicity,Ethnicity of individual,"Hispanic or Latino,Not Hispanic or Latino,Prefer not to answer",,,True,ManifestColumn,,ManifestColumn,,ManifestColumn,False,STRING,"Sage Bionetworks, https://www.synapse.org/#!Synapse:syn25878249", ,"Individual_Human,Phenotype_human"
56,experimentalBatchSize,The number of samples,,,,False,ManifestColumn,,ManifestColumn,,ManifestColumn,False,NUMBER,Sage Bionetworks, ,Metabolomics
57,experimentalBatchSizeUnit,The unit of measurement for number of samples in a experimental batch,,,,False,ManifestColumn,,ManifestColumn,,ManifestColumn,False,STRING,Sage Bionetworks, ,Metabolomics
58,experimentalFactor,"Variable aspects of an experiment design that can be used to describe an experiment or set of experiments in an increasingly detailed manner.This field accepts ontology terms from Experimental Factor Ontology (EFO) and/or Ontology for Biomedical Investigations (OBI). Example - 'time series design [EFO-0001779]'Provide a value OR provide one of these values - Unknown Not collected, Not applicable, Not specified",,,,True,ManifestColumn,,ManifestColumn,,ManifestColumn,False,STRING,MIMS (Minimum information about a metagenome sequence., https://pubmed.ncbi.nlm.nih.gov/18479204/,Metagenomics
59,experimentType,"The type of experiment used. Provide a value OR provide one of these values - Unknown Not collected, Not applicable, Not specified",,,,True,ManifestColumn,,ManifestColumn,,ManifestColumn,True,STRING,"Proteomic Data Commons,Sage Bionetworks","A data contributor should be able to write in a name OR provide one of these values: Unknown Not collected, Not applicable, Not specified. ","Metagenomics,Proteomics"
60,extractionMethod,"The name of the process used to separate a desired component of an input material from the remainder. Provide a value OR provide one of these values - Unknown Not collected, Not applicable, Not specified",,,,True,ManifestColumn,,ManifestColumn,,ManifestColumn,False,STRING,http://purl.obolibrary.org/obo/OBI_0302884,"A data contributor should be able to write in a name OR provide one of these values: Unknown Not collected, Not applicable, Not specified. ","Metabolomics,Microbiome"
61,fastingState,Was individual fasting when the sample was taken (true/false)?,"FALSE,Not applicable,Not collected,Not specified,TRUE,Unknown",,,True,ManifestColumn,,ManifestColumn,,ManifestColumn,False,STRING,Sage Bionetworks, ,"Biospecimen_human,Biospecimen_non_Human"
62,fieldCenterCode,Name of the field center,,,,True,ManifestColumn,,ManifestColumn,,ManifestColumn,False,STRING,Sage Bionetworks, ,Individual_Human
63,fractionIdentifier,"Number of fractions in the experimental runProvide a value OR provide one of these values - Unknown Not collected, Not applicable, Not specified",,,,True,ManifestColumn,,ManifestColumn,,ManifestColumn,True,STRING,"Sage Bionetworks, The Proteomics Sample Metadata Project, MS Ontology Proteomics Data Commons https://pdc.cancer.gov/data-dictionary/dictionary.html","A data contributor should be able to write in a name OR provide one of these values: Unknown Not collected, Not applicable, Not specified. ",Proteomics
64,gasFlowTemperature,"e.g., nebulization gas, cone gas, etc.Unit of measure-C, F, K, Not specified",,,,False,ManifestColumn,,ManifestColumn,,ManifestColumn,False,NUMBER,"Sage Bionetworks, Proposed minimum metadata relative to mass spectrometry", ,Metabolomics
65,gasFlowTemperatureUnit,Unit of gas flow temperature,"C,F,K",,,False,ManifestColumn,,ManifestColumn,,ManifestColumn,False,STRING,"Sage Bionetworks, Proposed minimum metadata relative to mass spectrometry", ,Metabolomics
