Attribute,Description,Valid Values,DependsOn,DependsOn Component,Required,Parent,Validation Rules,Properties,Source,Module,multivalue,columnType,Ontology,Notes,UsedIn,exists,ontology,term id,notes
sampleIntroduction,"The sample introduction and delivery. From GC, from LC, direct infusion without chromatography, direct infusion using dedicated autosampler flow rate.Provide a value OR provide one of these values: Unknown Not collected, Not applicable, Not specified",,,,True,,,ManifestColumn,,metabolomics,False,STRING,"Sage Bionetworks, Proposed minimum metadata relative to mass spectrometry","A data contributor should be able to write in a name OR provide one of these values: Unknown Not collected, Not applicable, Not specified",Metabolomics,False,,,
samplePrepProtocol,"An internet address that may provide more details of the protocol information (web link).Provide a value OR provide one of these values: Unknown Not collected, Not applicable, Not specified",,,,True,,,ManifestColumn,,metabolomics,False,STRING,"DSLWG,Sage Bionetworks","A data contributor should be able to write in a name OR provide one of these values: Unknown Not collected, Not applicable, Not specified","Metabolomics,Metagenomics,Proteomics",False,,,
sampleType,"The type of sample collected or the term used to describe the source of a biospecimen used for a laboratory test.Provide a value OR provide one of these values: Unknown Not collected, Not applicable, Not specified",,,,True,,,ManifestColumn,,bsSeq,False,STRING,"ImmPort,Sage Bionetworks","A data contributor should be able to write in a name OR provide one of these values: Unknown Not collected, Not applicable, Not specifiedThe sample types are adopted from Uberon, Cell and ChEBI ontologies.","Genotyping_Human,Metabolomics,Metagenomics,Microbiome,Proteomics,RNAseq,Whole_Genome_Sequencing,bsSeq,scRNAseq",False,,,
samplingAge,"The calculated age of the sample, measurement is determined or coded by the data contributor.Other,Unknown, Not collected, Not applicable",,,,True,,,ManifestColumn,,Biospecimen,False,STRING,Sage Bionetworks,,"Biospecimen_human,Biospecimen_non_Human",False,Sage Bionetworks,,
seqMethod,"Sequencing method. Sequencing method used;Example: 'Sanger, pyrosequencing, ABI-solid'.Provide a value OR provide one of these values: Unknown Not collected, Not applicable, Not specified",,,,True,,,ManifestColumn,,assay_metagenomics,False,STRING,MIMS (Minimum information about a metagenome sequence.,,Metagenomics,False,,,https://pubmed.ncbi.nlm.nih.gov/18479204/
seqPlatform,"Sequencing platform information.Provide a value OR provide one of these values: Unknown Not collected, Not applicable, Not specified",,,,True,,,ManifestColumn,,assay_metagenomics,False,STRING,DSWG,,Metagenomics,False,,,
sequencingBatchID,"Sequencing batch identifier, provided by the data contributor to Sage Bionetworks. The batch identifier(s) must be stored in a data dictionary .csv file uploaded to Synapse.Provide a value OR provide one of these values: Unknown Not collected, Not applicable, Not specified",,,,True,,,ManifestColumn,,bsSeq,False,STRING,Sage Bionetworks,"A data contributor should be able to write in a name OR provide one of these values: Unknown Not collected, Not applicable, Not specified","Microbiome,Whole_Genome_Sequencing,bsSeq,scRNAseq",False,,,
sequencingBatchSize,The number of samples,,,,True,,,ManifestColumn,,bsSeq,False,NUMBER,Sage Bionetworks,,"Microbiome,bsSeq,scRNAseq",False,,,
sequencingBatchSizeUnit,The unit of measurement for number of samples in a batch,,,,True,,,ManifestColumn,,"bsSeq, sequencingBatchSize",False,STRING,Sage Bionetworks,,"Microbiome,bsSeq,scRNAseq",False,,,
sex,The biological sex of the individual,"Male,Female",,,True,,,ManifestColumn,,Individual,False,STRING,"Sage Bionetworks,http://purl.obolibrary.org/obo/NCIT_C28421,https://www.synapse.org/#!Synapse:syn25878249",,"Individual_Human,Individual_non_Human,Phenotype_human",False,NCI Thesaurus OBO Edition,C28421,
sop,"Relevant standard operating procedures. Standard operating procedures used in the assembly and/or annotation of genomes, metagenomes, or environmental sequences.Example: 'http://press.igsb.anl.gov/earthmicrobiome/protocols-and-standards/its/)'Provide a value OR provide one of these values: Unknown Not collected, Not applicable, Not specified",,,,True,,,ManifestColumn,,assay_metagenomics,False,STRING,MIMS (Minimum information about a metagenome sequence.,,Metagenomics,False,,,https://pubmed.ncbi.nlm.nih.gov/18479204/
sourceMatID,"Source material identifiers. A unique identifier assigned to a material sample (as defined by http://rs.tdwg.org/dwc/terms/materialSampleID and as opposed to a particular digital record of a material sample) used for extracting nucleic acids, and subsequent sequencing.The identifier can refer to the original material collected or any derived sub-samples.Provide a value OR provide one of these values: Unknown Not collected, Not applicable, Not specified",,,,True,,,ManifestColumn,,assay_metagenomics,False,STRING,MIMS (Minimum information about a metagenome sequence.,,Metagenomics,False,,,https://pubmed.ncbi.nlm.nih.gov/18479204/
speciesAge,"Age of individual (formatted in months, ex. ""72 months"").note: Uncertainty about the age might require recording age by specifying a lower and upper estimate in months for the age of the animal.",,,,True,,,ManifestColumn,,Individual,False,STRING,"Sage Bionetworks, https://www.animalaudiograms.org/audiogram_metadata_scheme#:~:text=species%20are%20possible.-,age,-The%20age%20of",,Individual_non_Human,False,"Sage Bionetworks, Audiogram Metadata Scheme",,
speciesGroup,The taxonomic ranking including both species and subspecies the individual belongs to.,"Human,Rodent,Bird,Mammal,Primate",,,True,,,ManifestColumn,,Individual,False,STRING,https://ontobee.org/ontology/NCIT?iri=http://purl.obolibrary.org/obo/NCIT_C62690https://www.ebi.ac.uk/ols/ontologies/edam/terms?iri=http%3A%2F%2Fedamontology.org%2Fdata_1045,,"Individual_Human,Individual_non_Human,Phenotype_human",False,NCI Thesaurus OBO Edition,C62690,
speciesName,"The scientific name of the species (typically a taxonomic group, ex. ""Eremophila alpestris) the individual belongs to.""""""",,,,True,,,ManifestColumn,,Individual,False,STRING,https://www.ebi.ac.uk/ols/ontologies/edam/terms?iri=http%3A%2F%2Fedamontology.org%2Fdata_1045,example: https://www.ncbi.nlm.nih.gov/Taxonomy/Browser/wwwtax.cgi?mode=Info&id=135430,Individual_non_Human,False,EDAM - Bioscientific data analysis ontology,1045,
specimenAge,"The subject's age at the time of specimen extraction is the individual's age (since birth) at the time a given specimen was extracted. Measured as age in years. Other, Unknown, Not collected, Not applicable",,,,True,,,ManifestColumn,,Biospecimen,False,STRING,Sage Bionetworks,,"Biospecimen_human,Biospecimen_non_Human",False,Sage Bionetworks,,
specimenID,"Identifying string linked to a particular sample or specimen, provide by the data contributor",,,,True,,,ManifestColumn,,"Biospecimen, bsSeq",False,STRING,Sage Bionetworks,n/a (unique to each data contributor),"Biospecimen_human,Biospecimen_non_Human,Genotyping_Human,Metabolomics,Metagenomics,Microbiome,Proteomics,RNAseq,Whole_Genome_Sequencing,bsSeq,scRNAseq",False,,,
specimenSource,Indicate the biological area of the specimen,Human Reference Atlas values (not listed for purposes of this RFC),,,True,,,ManifestColumn,,BIospecimen,False,STRING,https://www.ebi.ac.uk/ols/ontologies/ccf/terms?iri=http%3A%2F%2Fpurl.obolibrary.org%2Fobo%2FUBERON_0004537&lang=en&viewMode=PreferredRoots&siblings=false,,"Biospecimen_human,Biospecimen_non_Human",False,Human Reference Atlas Common Coordinate Framework Ontology,,
specimenType,Type of biological material comprising the Specimen,"blood,plasma,urine,saliva,stool,serum,tissue,swabs,sputum,Cerebrospinal Fluid (CSF),organoid",,,True,,,ManifestColumn,,Biospecimen,True,STRING,"Sage Bionetworks, http://purl.obolibrary.org/obo/NCIT_C70713",,"Biospecimen_human,Biospecimen_non_Human",False,NCI Thesaurus OBO Edition,C70713,
spectrometerFrequency,The frequency at which a spectrometer causes hydrogen atoms to resonate (in MHz),,,,False,,,ManifestColumn,,metabolomics,False,NUMBER,Sage Bionetworks,,Metabolomics,False,,,
stage,Stage of the experimental design.,"Discovery,Replication",,,True,,,ManifestColumn,,"Biospecimen, genotyping",False,STRING,"Sage Bionetworks, EMBL-EBI",,Genotyping_Human,False,,,
statisticalModel,"A brief description of the statistical model used to determine association significance. It is important to distinguish studies that would otherwise appear identical (e.g., the same trait analyzed using additive, dominant, and recessive models).Example: additive model",,,,False,,,ManifestColumn,,genotyping,False,STRING,"Sage Bionetworks, EMBL-EBI","A data contributor should be able to write in a name OR provide one of these values: Unknown Not collected, Not applicable, Not specified",Genotyping_Human,False,,,
studyCode,"Unique identifier for the study, assigned by the DCC","LC,LG,ILO,LLFS",,,True,,,ManifestColumn,,Individual,True,STRING,Sage Bionetworks,,"Individual_Human,Individual_non_Human",False,,,
summaryFile,The name of any summary statistics file uploaded to Synapse.Example: example.tsv,,,,False,,,ManifestColumn,,"genotyping, useSummaryFile? = Yes",False,STRING,"Sage Bionetworks, EMBL-EBI","A data contributor should be able to write in a name OR provide one of these values: Unknown Not collected, Not applicable, Not specified",Genotyping_Human,False,,,
summaryStatisticsAssembly,Genome assembly for the summary statistics.Example: GRCh38,,,,False,,,ManifestColumn,,"genotyping, useSummaryFile? = Yes",True,STRING,Sage Bionetworks,"A data contributor should be able to write in a name OR provide one of these values: Unknown Not collected, Not applicable, Not specified",Genotyping_Human,False,,,
targetGene,"Targeted gene or locus name for marker gene studies.Provide a value OR provide one of these values: Unknown Not collected, Not applicable, Not specified",,,,True,,,ManifestColumn,,assay_metagenomics,False,STRING,MIMS (Minimum information about a metagenome sequence.,,Metagenomics,False,,,https://pubmed.ncbi.nlm.nih.gov/18479204/
taxon,"Taxonomic identifier. The National Center for Biotechnology Information taxon ID (formatted as, ex. ""txid9989"")",NCBI taxonomy values (not listed for purposes of this RFC),,,True,,,ManifestColumn,,Individual,False,STRING,"https://www.ncbi.nlm.nih.gov/taxonomy, http://edamontology.org/data_1179, http://purl.obolibrary.org/obo/TAXRANK_0000010",,Individual_non_Human,False,EDAM - Ontology of bioscientific data analysis and data management,"1179, C45293",
technologyPlatformVersion,"The specific version (application, manufacturer, model, lab, etc.) of a technology that is used to carry out a laboratory or computational experiment.Provide a value OR provide one of these values: Unknown Not collected, Not applicable, Not specified",,,,True,,,ManifestColumn,,bsSeq,True,STRING,"DSLWG,Sage Bionetworks,http://purl.obolibrary.org/obo/NCIT_C45378","A data contributor should be able to write in a name OR provide one of these values: Unknown Not collected, Not applicable, Not specified","Metabolomics,Metagenomics,Microbiome,Proteomics,RNAseq,Whole_Genome_Sequencing,bsSeq,scRNAseq",False,,,
tissue,Indicate the tissue the specimen is from,,,,True,,,ManifestColumn,,Biospecimen,False,STRING,http://purl.obolibrary.org/obo/NCIT_C12801,,"Biospecimen_human,Biospecimen_non_Human",False,NCI Thesaurus OBO Edition,C12801,
tissueVolume,The volume of the tissue sample. Measured in microliters.,,,,True,,,ManifestColumn,,Biospecimen,False,STRING,Sage Bionetworks,,"Biospecimen_human,Biospecimen_non_Human",False,Sage Bionetworks,,
tissueWeight,The mass of the tissue specimen. Measured in mg.,,,,True,,,ManifestColumn,,Biospecimen,False,STRING,Sage Bionetworks,,"Biospecimen_human,Biospecimen_non_Human",False,Sage Bionetworks,,
totalReads,Total number of sequencing reads from a library.,,,,True,,,ManifestColumn,,bsSeq,False,NUMBER,Sage Bionetworks,,"Microbiome,RNAseq,Whole_Genome_Sequencing,bsSeq,scRNAseq",False,,,
transcriptType,The type of transcript reported,"lincRNA,mRNA,snRNA",,,True,,,ManifestColumn,,RNAseq,False,STRING,ImmPort,,"RNAseq,Whole_Genome_Sequencing,scRNAseq",False,,,
treatmentAmountUnit,Unit of treatment amount.,"AFU,AI,AU/ml,DK units/ml,g/dl,g/l,gm,HAU,IU,iu/l,IU/ml,Kallikrein Inactivator Unit per Milliliter,kg,l,M,mg,mg/dl,mg/l,mg/ml,miu/ml,ml,mM,MOI,ng,ng/dl,ng/ml,ng/nl,ng/ul,nl,nM,Not Specified,NPX,optical density,other,PFU,PFUe,pg,pg/mg creatinine,pg/ml,pg/nl,pg/ul,pl,pM,Pound,TCID50,ug,ug/dl,ug/l,ug/ml,ug/ul,uiu/ml,ul,uM,umol/l,units/ml",,,False,,,ManifestColumn,,"genotyping, useTreatment? = Yes",True,NUMBER,"Sage Bionetworks, ImmPort",,Genotyping_Human,False,,,
treatmentAmountValue,"The Amount Value indicates how much (concentration, mass, volume) of a treatment agent was applied to a sample.",,,,False,,,ManifestColumn,,"genotyping, useTreatment? = Yes",True,STRING,"Sage Bionetworks, ImmPort",,Genotyping_Human,False,,,
treatmentDurationUnit,Unit of treatment duration.,"d.p.c.,Days,Hours,Minutes,Months,Not Specified,Seconds,Weeks,Years",,,False,,,ManifestColumn,,"genotyping, useTreatment? = Yes",False,STRING,"Sage Bionetworks, ImmPort",,Genotyping_Human,False,,,
treatmentDurationValue,Duration of treatment.,,,,False,,,ManifestColumn,,"genotyping, useTreatment? = Yes",False,NUMBER,"Sage Bionetworks, ImmPort",,Genotyping_Human,False,,,
treatmentID(s),"One or more identifiers, separated by a semicolon (;). The treatment identifier(s) must be stored in a data dictionary .csv file uploaded to Synapse.",,,,False,,,ManifestColumn,,"genotyping, useTreatment? = Yes",True,STRING,"Sage Bionetworks, ImmPort","A data contributor should be able to write in a name OR provide one of these values: Unknown Not collected, Not applicable, Not specified",Genotyping_Human,False,,,
treatmentName,"Treatments refer to in vitro modifications of samples. Three treatment types are supported: agent amount, duration, and temperature.  The treatment name is an alternate identifier to the Treatment ID.",,,,False,,,ManifestColumn,,"genotyping, useTreatment? = Yes",True,STRING,"Sage Bionetworks, ImmPort",,Genotyping_Human,False,,,
treatmentTemperatureUnit,Unit of treatment temperature.,"C,F,K,Not Specified",,,False,,,ManifestColumn,,"genotyping, useTreatment? = Yes",False,STRING,"Sage Bionetworks, ImmPort",,Genotyping_Human,False,,,
treatmentTemperatureValue,Value of treatment temperature.,,,,False,,,ManifestColumn,,"genotyping, useTreatment? = Yes",False,NUMBER,"Sage Bionetworks, ImmPort",,Genotyping_Human,False,,,
useReadMeFile?,Was a readme file uploaded to Synapse?,,,,True,,,ManifestColumn,,genotyping,False,STRING,Sage Bionetworks,,Genotyping_Human,False,,,
useReagent?,Was a reagent applied to the sample?,"Yes,No",,,True,,,ManifestColumn,,genotyping,False,BOOLEAN,"Sage Bionetworks, ImmPort",,Genotyping_Human,False,,,
useSummaryFile?,Was a summary statitics file uploded to Synapse?,,,,True,,,ManifestColumn,,genotyping,False,STRING,"Sage Bionetworks, EMBL-EBI",,Genotyping_Human,False,,,
useTreatment?,Was a treatment applied to the sample?,,,,True,,,ManifestColumn,,genotyping,False,BOOLEAN,"Sage Bionetworks, ImmPort",,Genotyping_Human,False,,,
vacuumPressure,The recorded vacuum pressure value,,,,False,,,ManifestColumn,,"metabolomics, hasIonizationSource? = Yes",False,NUMBER,"Sage Bionetworks, Proposed minimum metadata relative to mass spectrometry",,Metabolomics,False,,,
vacuumPressureUnit,Unit of vacuum pressure value,"AFU,AI,AU/ml,DK units/ml,bp g/dl,g/l,gm,HAU,IU,iu/l,IU/ml,Kallikrein Inactivator Unit per Milliliter,kg,l,M,mg,mg/dl,mg/l,mg/ml,miu/ml,ml,mM,MOI,ng,ng/dl,ng/ml,ng/nl,ng/ul,nl,nM,Not Specified,NPX,optical density,PFU,PFUe,pg,pg/mg creatinine,pg/ml,pg/nl,pg/ul,pl,pM,Pound,TCID50,ug,ug/dl,ug/l,ug/ml,ug/ul,uiu/ml,ul,uM,umol/l,units/ml",,,False,,,ManifestColumn,,"metabolomics, hasIonizationSource? = Yes, vaccuumPressure",False,STRING,"Sage Bionetworks, Proposed minimum metadata relative to mass spectrometry",,Metabolomics,False,,,
valueReported,The count or gene count for the transcript,,,,True,,,ManifestColumn,,RNAseq,False,NUMBER,Sage Bionetworks,,"RNAseq,Whole_Genome_Sequencing,scRNAseq",False,,,
variantCount,The number of variants analysed in the discovery stage (after QC).Example: 52500,,,,True,,,ManifestColumn,,genotyping,False,STRING,"Sage Bionetworks, EMBL-EBI","A data contributor should be able to write in a name OR provide one of these values: Unknown Not collected, Not applicable, Not specified",Genotyping_Human,False,,,
visitCode,"Indicate which longitudinal visit for the individual the data comes from, provided by the data contributor's data dictionary",,,,True,,,ManifestColumn,,Individual,False,NUMBER,Sage Bionetworks,,Individual_Human,False,,,
Whole_Genome_Sequencing,Template for Whole_Genome_Sequencing,,"Filename,specimenID,sampleType,measurementTechnique,technologyPlatformVersion,platformLocation,referenceTranscriptID,repositoryName,transcriptType,resultUnit,valueReported,rnaBatchID,libraryBatchID,sequencingBatchID,libraryPrep,libraryPreparationMethod,libraryVersion,isStranded,readStrandOrigin,readLength,readLengthUnits,runType,totalReads,Component",,False,Component,,,,Template,,,Sage Bionetworks,,,False,,,
rnaBatchSize,The number of samples,,,,False,,,ManifestColumn,,scRNAseq,False,NUMBER,Sage Bionetworks,,scRNAseq,False,,,
rnaBatchSizeUnit,The unit of measurement for number of samples in a batch,"AFU,AI,AU/ml,DK units/ml,bp g/dl,g/l,gm,HAU,IU,iu/l,IU/ml,Kallikrein Inactivator Unit per Milliliter,kg,l,M,mg,mg/dl,mg/l,mg/ml,miu/ml,ml,mM,MOI,ng,ng/dl,ng/ml,ng/nl,ng/ul,nl,nM,Not Specified,NPX,optical density,PFU,PFUe,pg,pg/mg creatinine,pg/ml,pg/nl,pg/ul,pl,pM,Pound,TCID50,ug,ug/dl,ug/l,ug/ml,ug/ul,uiu/ml,ul,uM,umol/l,units/ml,other",,,True,,,ManifestColumn,,"scRNAseq, rnaBatchSize",False,STRING,Sage Bionetworks,,scRNAseq,False,,,
scRNAseq,Template for scRNAseq,,"Filename,specimenID,sampleType,measurementTechnique,technologyPlatformVersion,platformLocation,referenceTranscriptID,repositoryName,transcriptType,resultUnit,valueReported,rnaBatchID,rnaBatchSize,rnaBatchSizeUnit,libraryBatchID,sequencingBatchID,sequencingBatchSize,sequencingBatchSizeUnit,libraryPrep,libraryPreparationMethod,libraryVersion,isStranded,readStrandOrigin,readLength,readLengthUnits,runType,totalReads,Component",,False,Component,,,,Template,,,Sage Bionetworks,,,False,,,
