Attribute,Description,Valid Values,DependsOn,DependsOn Component,Required,Parent,Validation Rules,Properties,Source,Module,multivalue,columnType,Ontology,Notes,UsedIn,exists,ontology,term id,notes
acquisitionBatchID,"Acquisition batch identifier, provided by the data contributor to Sage Bionetworks. The batch identifier(s) must be stored in a data dictionary .csv file uploaded to Synapse",,,,False,,,ManifestColumn,,metabolomics,False,STRING,Sage Bionetworks,,Metabolomics,False,,,
acquisitionBatchSize,The number of samples,,,,False,,,ManifestColumn,,metabolomics,False,STRING,Sage Bionetworks,,Metabolomics,False,,,
acquisitionBatchSizeUnit,The unit of measurement for number of samples in a batch,,,,False,,,ManifestColumn,,"metabolomics, acquisitionBatchSize",False,STRING,Sage Bionetworks,,Metabolomics,False,,,
acquisitionMode,"The specific aspect of a mass spectrometer method by which mass ranges are selected and possibly dissociated (full scan, MSn, SIM, MRM, etc.).Provide a value OR provide one of these values: Unknown Not collected, Not applicable, Not specified",,,,True,,,ManifestColumn,,metabolomics,False,STRING,https://www.ebi.ac.uk/ols/ontologies/ms/terms?iri=http%3A%2F%2Fpurl.obolibrary.org%2Fobo%2FMS_1003213,"A data contributor should be able to write in a name OR provide one of these values: Unknown Not collected, Not applicable, Not specified",Metabolomics,False,,,
acquisitionSoftware,"The name of the acquisition software used.Provide a value OR provide one of these values: Unknown Not collected, Not applicable, Not specified",,,,True,,,ManifestColumn,,metabolomics,False,STRING,http://purl.obolibrary.org/obo/MS_1001455,"A data contributor should be able to write in a name OR provide one of these values: Unknown Not collected, Not applicable, Not specified",Metabolomics,False,,,
acquistionSoftwareVersion,"The version number of software used.Provide a value OR provide one of these values: Unknown Not collected, Not applicable, Not specified",,,,True,,,ManifestColumn,,metabolomics,False,NUMBER,Sage Bionetworks,"A data contributor should be able to write in a name OR provide one of these values: Unknown Not collected, Not applicable, Not specified",Metabolomics,False,,,
adapters,"Adapters provide priming sequences for both amplification and sequencing of the sample-library fragments. Both adapters should be reported; in uppercase letters.Example: 'AATGATACGGCGACCACCGAGATCTACACGCT; CAAGCAGAAGACGGCATACGAGAT'Provide a value OR provide one of these values: Unknown Not collected, Not applicable, Not specified",,,,True,,,ManifestColumn,,assay_metagenomics,False,STRING,MIMS (Minimum information about a metagenome sequence.,,Metagenomics,False,,,https://pubmed.ncbi.nlm.nih.gov/18479204/
adjustedCovariates,Any covariates the GWAS is adjusted for. Multiple values can be listed separately by a semicolon (;).Example: age;sex,,,,False,,,ManifestColumn,,genotyping,True,STRING,"Sage Bionetworks, EMBL-EBI","A data contributor should be able to write in a name OR provide one of these values: Unknown Not collected, Not applicable, Not specified",Genotyping_Human,False,,,
age,"Age of the individual (age in years of the individual at first recorded study event (enrollment, visit, observation, sample collection, survey completion, etc.)",,,,True,,,ManifestColumn,,Phenotype,False,STRING,Sage Bionetworks,"A data contributor should be able to write in a name OR provide one of these values: Unknown Not collected, Not applicable, Not specified","Individual_Human,Phenotype_human",False,Sage Bionetworks,,
arrayInformation,"Additional information about the genotyping array. For example, for targeted arrays, please provide the specific type of array.Example: Immunochip",,,,False,,,ManifestColumn,,genotyping,False,STRING,"Sage Bionetworks, EMBL-EBI","A data contributor should be able to write in a name OR provide one of these values: Unknown Not collected, Not applicable, Not specified",Genotyping_Human,False,,,
arrayManufacturer,"Manufacturer of the genotyping array used for the discovery stage. Separate multiple manufacturers by a semicolon (;).Example: Illumina, Affymetrix, Perlegen",,,,False,,,ManifestColumn,,genotyping,True,STRING,"Sage Bionetworks, EMBL-EBI","A data contributor should be able to write in a name OR provide one of these values: Unknown Not collected, Not applicable, Not specified",Genotyping_Human,False,,,
assay,The analysis or technology used to generate the data in this file,,,,True,,,ManifestColumn,,Biospecimen,False,STRING,Sage Bionetworks,,Biospecimen_non_Human,False,Sage Bionetworks,,
assemblyName,"Name/version of the assembly provided by the submitter used in the genome browsers and the community.Example: 'HuRef, JCVI_ISG_3_1.0'Provide a value OR provide one of these values: Unknown Not collected, Not applicable, Not specified",,,,True,,,ManifestColumn,,assay_metagenomics,False,STRING,MIMS (Minimum information about a metagenome sequence.,,Metagenomics,False,,,https://pubmed.ncbi.nlm.nih.gov/18479204/
assemblyQual,"Assembly quality. The assembly quality category is based on sets of criteria outlined for each assembly quality category.High Quality: Multiple fragments where gaps span repetitive regions. Presence of the 23S, 16S and 5S rRNA genes and at least 18 tRNAs.Medium Quality: Many fragments with little to no review of assembly other than reporting of standard assembly statistics.Low Quality: Many fragments with little to no review of assembly other than reporting of standard assembly statistics. Assembly statistics include, but are not limited to, total assembly size, number of contigs, contig N50/L50, and maximum contig length.Example values: high-quality genome, medium-quality genome, low-quality genome",,,,True,,,ManifestColumn,,assay_metagenomics,False,STRING,MIMS (Minimum information about a metagenome sequence.,,Metagenomics,False,,,https://pubmed.ncbi.nlm.nih.gov/18479204/
assemblySoftware,"Tool(s) used for assembly, including version number and parameters.Example: 'metaSPAdes;3.11.0; kmer set 21,33,55,77,99,121, default parameters otherwise'.Provide a value OR provide one of these values: Unknown Not collected, Not applicable, Not specified",,,,True,,,ManifestColumn,,assay_metagenomics,False,STRING,MIMS (Minimum information about a metagenome sequence.,,Metagenomics,False,,,https://pubmed.ncbi.nlm.nih.gov/18479204/
associatedResource,"Relevant electronic resources. A related resource that is referenced, cited, or otherwise associated to the sequence.Example: 'http://www.earthmicrobiome.org/'Provide a value OR provide one of these values: Unknown Not collected, Not applicable, Not specified",,,,True,,,ManifestColumn,,assay_metagenomics,False,STRING,MIMS (Minimum information about a metagenome sequence.,,Metagenomics,False,,,https://pubmed.ncbi.nlm.nih.gov/18479204/
backgroundTrait,Any background trait(s) shared by all individuals in the GWAS (e.g. in both cases and controls).Example: Nicotine dependence,,,,False,,,ManifestColumn,,genotyping,True,STRING,"Sage Bionetworks, EMBL-EBI","A data contributor should be able to write in a name OR provide one of these values: Unknown Not collected, Not applicable, Not specified",Genotyping_Human,False,,,
batchID,"ID used to identify a batch, provided by the data contributor to Sage Bionetworks. The batch identifier(s) must be stored in a data dictionary .csv file uploaded to Synapse",,,,False,,,ManifestColumn,,metabolomics,False,STRING,Sage Bionetworks,,Metabolomics,False,,,
batchLabel,Used to supply batch label information with any string value,,,,False,,,ManifestColumn,,metabolomics,False,STRING,http://purl.obolibrary.org/obo/MS_4000088,,Metabolomics,False,,,
batchSize,The number of samples,,,,False,,,ManifestColumn,,metabolomics,False,NUMBER,Sage Bionetworks,,Metabolomics,False,,,
batchSizeUnit,The unit of measurement for number of samples in a batch,,,,False,,,ManifestColumn,,"metabolomics, batchSize",False,STRING,Sage Bionetworks,,Metabolomics,False,,,
Biospecimen_human,Template for Biospecimen_human,,"Filename,individualID,specimenID,specimenType,measurementTechnique,specimenAge,samplingAge,organ,tissue,tissueVolume,tissueWeight,specimenSource,nucleicAcidSource,cellType,fastingState,isPostMortem,Component",,False,Component,,,,Template,,,Sage Bionetworks,,,False,,,
Biospecimen_non_Human,Template for Biospecimen_non_Human,,"Filename,individualID,specimenID,specimenType,assay,specimenAge,samplingAge,organ,tissue,tissueVolume,tissueWeight,specimenSource,nucleicAcidSource,cellType,fastingState,isPostMortem,Component",,False,Component,,,,Template,,,Sage Bionetworks,,,False,,,
bsSeq,Template for bsSeq,,"Filename,specimenID,sampleType,measurementTechnique,technologyPlatformVersion,platformLocation,referenceTranscriptID,dnaBatchID,dnaBatchSize,dnaBatchSizeUnit,libraryBatchID,libraryPrep,libraryPreparationMethod,libraryVersion,sequencingBatchID,sequencingBatchSize,sequencingBatchSizeUnit,isStranded,readStrandOrigin,readLength,readLengthUnits,runType,totalReads,directionalBSseqLibrary,gDNAconc,lambdaDNAconc,pcrCycles,meanCoverage,conversionRatio,conversionRatioUnits,enrichmentMethod,Component",,False,Component,,,,Template,,,Sage Bionetworks,,,False,,,
captivityDuration,"The duration of captivity in months for the individuals in captivity (formatted in months, ex. 72 months).note: Applicable only to animals with captivity status captive.",,,,False,,,ManifestColumn,,"Individual, captivityStatus = captive",False,STRING,"https://www.animalaudiograms.org/audiogram_metadata_scheme#:~:text=species%20are%20possible.-,captivity%20duration,-The%20duration%20of",,Individual_non_Human,False,Audiogram Metadata Scheme,,
captivityStatus,"The status of the individual with regard to captivity.note: Wild, captive, and stranded values are applicable, especially for marine mammals. Depending on life stage terminology for individual species, other values are possible. Please let the data curation team know.","Captive,Stranded,Wild",,,True,,,ManifestColumn,,Individual,False,STRING,"https://www.animalaudiograms.org/audiogram_metadata_scheme#:~:text=of%20the%20animal.-,captivity%20status,-The%20status%20of",,Individual_non_Human,False,Audiogram Metadata Scheme,,
cellType,Indicate the cell type.,CCF-BSO values (not listed for purposes of this RFC),,,True,,,ManifestColumn,,Biospecimen,False,STRING,"https://bioportal.bioontology.org/ontologies/CCF/?p=classes&conceptid=http%3A%2F%2Fpurl.org%2Fccf%2Fcell_type,https://www.ebi.ac.uk/ols/ontologies/ccf/terms?iri=http%3A%2F%2Fpurl.org%2Fccf%2Fcell_type",,"Biospecimen_human,Biospecimen_non_Human",False,CCF Biological Structure (CCF-BSO) ontology,,
cohort,Name of the cohort the individual belongs to,,,,True,,,ManifestColumn,,Individual,True,STRING,Sage Bionetworks,,"Individual_Human,Individual_non_Human,Phenotype_human",False,,,
commonName,"The biological species common name the individual belongs to (ex. ""Horned Lark""). note: As a default, the valid scientific name for the species should be indicated.",Genbank common names (not listed for purposes of this RFC),,,True,,,ManifestColumn,,Individual,False,STRING,https://www.ebi.ac.uk/ols/ontologies/edam/terms?iri=http%3A%2F%2Fedamontology.org%2Fdata_1874,example: https://www.ncbi.nlm.nih.gov/Taxonomy/Browser/wwwtax.cgi?mode=Info&id=135430,Individual_non_Human,False,EDAM - Bioscientific data analysis ontology,1874,
consentGroupID,"Indicate the consent group for the individual, provided by the data contributor's data dictionary",,,,True,,,ManifestColumn,,Individual,False,STRING,Sage Bionetworks,,Individual_Human,False,,,
controlType,"Control samples suitable for normalization and batch correction.Possible example values: GIS, GoldenWest, NIST SRM 1950, AIBL pool,Baker pool,water plus Baker ISTD, study pool, internal standards, Other, Unknown, Not collected, Not applicable, Not specified",,,,False,,,ManifestColumn,,"metabolomics, hasAssayControl = Yes",False,STRING,https://doi.org/10.1101/2020.05.19.105197 https://doi.org/10.1038/sdata.2017.140 https://www-s.nist.gov/srmors/view_detail.cfm?srm=1950 Sage Bionetworks DSLWG,"A data contributor should be able to write in a name OR provide one of these values: Unknown Not collected, Not applicable, Not specified",Metabolomics,False,,,
conversionRatio,The ratio or % detailing how well the bisulfite conversion worked,,,,True,,,ManifestColumn,,bsSeq,False,STRING,Sage Bionetworks,,bsSeq,False,,,
conversionRatioUnits,The units of measurement.,,,,True,,,ManifestColumn,,"bsSeq, readLength",False,STRING,Sage Bionetworks,,bsSeq,False,,,
countryCode,"Indicate the geographic region for the individual (shown as ex. ""840"")",World Bank country codes (not listed for purposes of this RFC),,,True,,,ManifestColumn,,Individual,False,INTEGER,https://wits.worldbank.org/countryprofile/metadata/en/country/all,,Individual_Human,False,,,
databaseLibrary,"The name(s) of the associated database library.Provide a value OR provide one of these values: Unknown Not collected, Not applicable, Not specified",,,,True,,,ManifestColumn,,assay_metagenomics,True,STRING,DSWG,,Metagenomics,False,,,
databaseName,"The name of the search database (nr, SwissProt or est_human, and/or mass spectral library).Provide a value OR provide one of these values: Unknown Not collected, Not applicable, Not specified",,,,True,,,ManifestColumn,,metabolomics,False,STRING,"DSLWG,Sage Bionetworks,http://purl.obolibrary.org/obo/MS_1001013","A data contributor should be able to write in a name OR provide one of these values: Unknown Not collected, Not applicable, Not specified","Metabolomics,Metagenomics,Proteomics",False,,,
databaseSource,"The name of the organization, project, or laboratory from where the database is obtained (UniProt, NCBI, EBI, other).",,,,True,,,ManifestColumn,,metabolomicss,False,STRING,"DSLWG,Sage Bionetworks,http://purl.obolibrary.org/obo/MS_1001012","A data contributor should be able to write in a name OR provide one of these values: Unknown Not collected, Not applicable, Not specified","Metabolomics,Metagenomics,Proteomics",False,,,
databaseVersion,"The version of the database.Provide a value OR provide one of these values: Unknown Not collected, Not applicable, Not specified",,,,True,,,ManifestColumn,,assay_metagenomics,True,STRING,DSWG,,Metagenomics,False,,,
databaseWeblink,"An internet address that may provide details of a database or software search, as well as for labs that generate their own search method (web link).Provide a value OR provide one of these values: Unknown Not collected, Not applicable, Not specified",,,,True,,,ManifestColumn,,metabolomics,False,STRING,"Sage Bionetworks, DSLWG","A data contributor should be able to write in a name OR provide one of these values: Unknown Not collected, Not applicable, Not specified","Metabolomics,Metagenomics,Proteomics",False,,,
dataFile,"Name of additional file(s) accompanying the data. The file(s) provide, for example, the name of any raw files generated by the instrument, generated reports from a vendor, an Rscript, or an instructions document. The files can be instrument raw files, converted peak lists such as mzML, MGF, or result files like mzIdentML. The files can be additional documentation submitted alongside the data needed for reuse and sharing purposes.Provide the file names of any additional files submitted alongside the data (ex., an ADAT file). Multiple file names can be separated by (;)Provide a value OR provide one of these values: Unknown Not collected, Not applicable, Not specified",,,,True,,,ManifestColumn,,metabolomics,True,STRING,"DSLWG,Proteomics Sample Metadata,Sage Bionetworks","A data contributor should be able to write in a name OR provide one of these values: Unknown Not collected, Not applicable, Not specified","Metabolomics,Metagenomics,Proteomics",False,,,
diagnosis,Indicate the disease or condition.,,,,False,,,ManifestColumn,,"Phenotype, diagnosisStatus = true",True,STRING,"https://www.ebi.ac.uk/ols/ontologies/mondo, https://www.ebi.ac.uk/ols/ontologies/maxo, https://www.ebi.ac.uk/ols/ontologies/hp","HPO, MONDO, MAXO codes or labels (not listed for purposes of this RFC), Other, Unknown, Not collected, Not applicable, Not specified","Individual_Human,Phenotype_human",False,"HPO, MONDO, MAXO",,
diagnosisStatus,"Whether the individual has been diagnosed with a condition or disease (physical and/or cognitive), \True"" indicates the individual has been diagnosed""","True,False",,,True,,,ManifestColumn,,Phenotype,True,STRING,Sage Bionetworks,,"Individual_Human,Phenotype_human",False,Sage Bionetworks,,
digestionMethod,"The type of digestion (ex. in-solution, in-gel)Provide a value OR provide one of these values: Unknown Not collected, Not applicable, Not specified",,,,True,,,ManifestColumn,,proteomics,True,STRING,"Sage Bionetworks, DSLWG","A data contributor should be able to write in a name OR provide one of these values: Unknown Not collected, Not applicable, Not specified",Proteomics,False,,,
digestionReagent,Enzymes or reagents used for digestion.,"2-iodobenzoate,Arg-C,Asp-N,Asp-N_ambic,Chymotrypsin,CNBr,Formic_acid,Glutamyl endopeptidase,Leukocyte elastase,Lys-C,Lys-C/P,No cleavage,NoEnzyme,PepsinA,Proline endopeptidase,TrypChymo,Trypsin,Trypsin/P,Unspecific cleavage,V8-DE,V8-E,Lys-C,Trypsin",,,True,,,ManifestColumn,,proteomics,True,STRING,Proteomics Data Commons,,Proteomics,False,,,
directionalBSseqLibrary,Indicates whether or not the bisulfiteSeq library is directional,,,,True,,,ManifestColumn,,bsSeq,False,STRING,Sage Bionetworks,,bsSeq,False,,,
dnaBatchID,"DNA isolation batch identifier, provided by the data contributor to Sage Bionetworks. The batch identifier(s) must be stored in a data dictionary .csv file uploaded to Synapse.Provide a value OR provide one of these values: Unknown Not collected, Not applicable, Not specified",,,,True,,,ManifestColumn,,bsSeq,False,STRING,Sage Bionetworks,"A data contributor should be able to write in a name OR provide one of these values: Unknown Not collected, Not applicable, Not specified","Microbiome,bsSeq",False,,,
dnaBatchSize,The number of samples,,,,True,,,ManifestColumn,,bsSeq,False,NUMBER,Sage Bionetworks,,"Microbiome,bsSeq",False,,,
dnaBatchSizeUnit,The unit of measurement for number of samples in a batch,"AFU,AI,AU/ml,DK units/ml,bp g/dl,g/l,gm,HAU,IU,iu/l,IU/ml,Kallikrein Inactivator Unit per Milliliter,kg,l,M,mg,mg/dl,mg/l,mg/ml,miu/ml,ml,mM,MOI,ng,ng/dl,ng/ml,ng/nl,ng/ul,nl,nM,Not Specified,NPX,optical density,PFU,PFUe,pg,pg/mg creatinine,pg/ml,pg/nl,pg/ul,pl,pM,Pound,TCID50,ug,ug/dl,ug/l,ug/ml,ug/ul,uiu/ml,ul,uM,umol/l,units/ml,other",,,True,,,ManifestColumn,,"bsSeq, dnaBatchSize",False,STRING,Sage Bionetworks,,"Microbiome,bsSeq",False,,,
DNAextraction,"DNA extraction kit method.Provide a value OR provide one of these values: Unknown Not collected, Not applicable, Not specified",,,,True,,,ManifestColumn,,assay_metagenomics,False,STRING,DSWG,,Metagenomics,False,,,
enrichment,"Protocol or reagent used for enrichment (ex. Fe3+NTA-Agarose (Qiagen)Provide a value OR provide one of these values: Unknown Not collected, Not applicable, Not specified",,,,True,,,ManifestColumn,,proteomics,True,STRING,Proteomic Data Commons,"A data contributor should be able to write in a name OR provide one of these values: Unknown Not collected, Not applicable, Not specified",Proteomics,False,,,
enrichmentMethod,"The method used for performing an enrichment of specific regions by a restriction enzyme digest.Provide a value OR provide one of these values: Unknown Not collected, Not applicable, Not specified",,,,True,,,ManifestColumn,,bsSeq,False,STRING,Sage Bionetworks,"A data contributor should be able to write in a name OR provide one of these values: Unknown Not collected, Not applicable, Not specified",bsSeq,False,,,
enrichmentStrategy,Type of peptide or protein enrichment,"Acetylome Proteome,Phosphoproteome,Glycoproteome,Ubiquitylome,Metabolome,Lipidome",,,True,,,ManifestColumn,,proteomics,True,STRING,Proteomic Data Commons,"A data contributor should be able to write in a name OR provide one of these values: Unknown Not collected, Not applicable, Not specified",Proteomics,False,,,
ethnicGroupCode,"A coded value specifying the self-declared ethnic origination independent of racial origination, provided by the data contributor's data dictionary",,,,False,,,ManifestColumn,,"Phenotype, ethnicity = Hispanic or Latino",True,STRING,https://ncithesaurus.nci.nih.gov/ncitbrowser/pages/concept_details.jsf?dictionary=NCI_Thesaurus&version=23.04d&code=C93563&ns=ncit&type=properties&key=1040179992&b=1&n=0&vse=null,"A data contributor should be able to write in a name OR provide one of these values: Unknown Not collected, Not applicable, Not specified","Individual_Human,Phenotype_human",False,NCI Thesaurus,C93563,
ethnicity,Ethnicity of individual,"Not Hispanic or Latino,Hispanic or Latino,Prefer not to answer",,,True,,,ManifestColumn,,Phenotype,False,STRING,"Sage Bionetworks, https://www.synapse.org/#!Synapse:syn25878249",,"Individual_Human,Phenotype_human",False,Sage Bionetworks,,
experiementalBatchSize,The number of samples,,,,False,,,ManifestColumn,,metabolomics,False,NUMBER,Sage Bionetworks,,Metabolomics,False,,,
experiementalBatchSizeUnit,The unit of measurement for number of samples in a experimental batch,,,,False,,,ManifestColumn,,"metabolomics, experimentalBatchSize",False,STRING,Sage Bionetworks,,Metabolomics,False,,,
experimentalFactor,"Variable aspects of an experiment design that can be used to describe an experiment or set of experiments in an increasingly detailed manner.This field accepts ontology terms from Experimental Factor Ontology (EFO) and/or Ontology for Biomedical Investigations (OBI).Example: 'time series design [EFO:0001779]'Provide a value OR provide one of these values: Unknown Not collected, Not applicable, Not specified",,,,True,,,ManifestColumn,,assay_metagenomics,False,STRING,MIMS (Minimum information about a metagenome sequence.,,Metagenomics,False,,,https://pubmed.ncbi.nlm.nih.gov/18479204/
experimentType,"The type of experiment used.Provide a value OR provide one of these values: Unknown Not collected, Not applicable, Not specified",,,,True,,,ManifestColumn,,proteomics,True,STRING,"Proteomic Data Commons,Sage Bionetworks","A data contributor should be able to write in a name OR provide one of these values: Unknown Not collected, Not applicable, Not specified","Metagenomics,Proteomics",False,,,
extractionMethod,"The name of the process used to separate a desired component of an input material from the remainder.Provide a value OR provide one of these values: Unknown Not collected, Not applicable, Not specified",,,,True,,,ManifestColumn,,metabolomics,False,STRING,http://purl.obolibrary.org/obo/OBI_0302884,"A data contributor should be able to write in a name OR provide one of these values: Unknown Not collected, Not applicable, Not specified","Metabolomics,Microbiome",False,,,
fastingState,Was individual fasting when the sample was taken (true/false)?,"True,False,,Uknown",,,True,,,ManifestColumn,,Biospecimen,False,STRING,Sage Bionetworks,,"Biospecimen_human,Biospecimen_non_Human",False,Sage Bionetworks,,
fieldCenterCode,Name of the field center,"BU,PT,NY,DK",,,True,,,ManifestColumn,,Individual,False,STRING,Sage Bionetworks,,Individual_Human,False,,,
fractionIdentifier,"Number of fractions in the experimental runProvide a value OR provide one of these values: Unknown Not collected, Not applicable, Not specified",,,,True,,,ManifestColumn,,proteomics,True,STRING,"Sage Bionetworks, The Proteomics Sample Metadata Project, MS Ontology Proteomics Data Commons https://pdc.cancer.gov/data-dictionary/dictionary.html","A data contributor should be able to write in a name OR provide one of these values: Unknown Not collected, Not applicable, Not specified",Proteomics,False,,,
gasFlowTemperature,"e.g., nebulization gas, cone gas, etc.Unit of measure:C, F, K, Not specified",,,,False,,,ManifestColumn,,"metabolomics, hasIonizationSource? = Yes",False,NUMBER,"Sage Bionetworks, Proposed minimum metadata relative to mass spectrometry",,Metabolomics,False,,,
gasFlowTemperatureUnit,Unit of gas flow temperature,"C,F,K",,,False,,,ManifestColumn,,"metabolomics, hasIonizationSource? = Yes",False,STRING,"Sage Bionetworks, Proposed minimum metadata relative to mass spectrometry",,Metabolomics,False,,,
gDNAconc,gDNA Concentration in ng,,,,True,,,ManifestColumn,,bsSeq,False,NUMBER,Sage Bionetworks,,bsSeq,False,,,
genotypeTechnology,"Method(s) used to genotype variants in the discovery stage. Separate multiple methods separated by a semicolon (;).Example: genome-wide genotyping array, exome-wide sequencing, targeted genotyping array",,,,True,,,ManifestColumn,,genotyping,True,STRING,"Sage Bionetworks, EMBL-EBI","A data contributor should be able to write in a name OR provide one of these values: Unknown Not collected, Not applicable, Not specified",Genotyping_Human,False,,,
Genotyping_Human,Template for Genotyping_Human,,"Filename,specimenID,stage,numberIndividuals,sampleType,useReagent?,reagentID(s),reagentName,reagentManufacturer,reagentCatalogNumber,reagentLotNumber,reagentWeblink,reagentContact,useTreatment?,treatmentID(s),treatmentName,treatmentAmountValue,treatmentAmountUnit,treatmentDurationValue,treatmentDurationUnit,treatmentTemperatureValue,treatmentTemperatureUnit,measurementTechnique,genotypeTechnology,arrayManufacturer,arrayInformation,imputation,imputationPanel,imputationSoftware,variantCount,statisticalModel,adjustedCovariates,reportedTrait,backgroundTrait,useReadMeFile?,readmeFile,useSummaryFile?,summaryFile,summaryStatisticsAssembly,Component",,False,Component,,,,Template,,,Sage Bionetworks,,,False,,,
hasAssayControl,"Boolean flag indicating whether or not a specimen is a technical or assay control. Examples include study pools or reference pools, blanks, or internal standards.",,,,False,,,ManifestColumn,,metabolomics,False,BOOLEAN,Sage Bionetworks,,Metabolomics,False,,,
