Attribute,Description,Valid Values,DependsOn,DependsOn Component,Required,Parent,Validation Rules,Properties,Source,Module,multivalue,columnType,Ontology,Notes,UsedIn,exists,ontology,term id,notes
hasIonizationSource?,Were the ionization conditions recorded to enable reproduction of the experiment?,"Yes,No",,,False,,,ManifestColumn,,metabolomics,False,BOOLEAN,"Sage Bionetworks, Proposed minimum metadata relative to mass spectrometry",,Metabolomics,False,,,
imputation,Were SNPs imputed for the discovery GWAS?,,,,True,,,ManifestColumn,,genotyping,False,STRING,"Sage Bionetworks, EMBL-EBI",,Genotyping_Human,False,,,
imputationPanel,Panel used for imputation.Example: 1000 Genomes Phase 3,,,,False,,,ManifestColumn,,genotyping,False,STRING,"Sage Bionetworks, EMBL-EBI","A data contributor should be able to write in a name OR provide one of these values: Unknown Not collected, Not applicable, Not specified",Genotyping_Human,False,,,
imputationSoftware,Imputation software.Example: IMPUTE,,,,False,,,ManifestColumn,,genotyping,False,STRING,"Sage Bionetworks, EMBL-EBI","A data contributor should be able to write in a name OR provide one of these values: Unknown Not collected, Not applicable, Not specified",Genotyping_Human,False,,,
Individual_Human,Template for Individual_Human,,"Filename,individualID,cohort,studyCode,fieldCenterCode,visitCode,countryCode,consentGroupID,speciesGroup,sex,race,ethnicity,ethnicGroupCode,age,diagnosisStatus,diagnosis,Component",,False,Component,,,,Template,,,Sage Bionetworks,,,False,,,
Individual_non_Human,Template for Individual_non_Human,,"Filename,individualID,cohort,studyCode,taxon,speciesGroup,speciesName,commonName,sex,lifeStage,speciesAge,captivityStatus,captivityDuration,Component",,False,Component,,,,Template,,,Sage Bionetworks,,,False,,,
individualID,"Identifying string linked to the individual or animal being studied, provided by the data contributor",,,,True,,,ManifestColumn,,Individual,False,STRING,Sage Bionetworks,,"Biospecimen_human,Biospecimen_non_Human,Individual_Human,Individual_non_Human,Phenotype_human",False,,,
instrumentModel,"The model of the instrument used.Provide a value OR provide one of these values: Unknown Not collected, Not applicable, Not specified",,,,True,,,ManifestColumn,,metabolomics,False,STRING,"DSLWG,Proposed minimum metadata relative to mass spectrometry,Sage Bionetworks","A data contributor should be able to write in a name OR provide one of these values: Unknown Not collected, Not applicable, Not specified OR use one of these possible values linked belowPossible values are listed under the instrument model term. https://www.ebi.ac.uk/ols/ontologies/ms/terms?iri=http%3A%2F%2Fpurl.obolibrary.org%2Fobo%2FMS_1000031&viewMode=All&siblings=false","Metabolomics,Metagenomics,Proteomics",False,,,
ionProperty,Ion charge state (positive or negative-ion analysis),"Positive,Negative",,,False,,,ManifestColumn,,"metabolomics, hasIonizationSource? = Yes",False,STRING,"Sage Bionetworks, Proposed minimum metadata relative to mass spectrometry",,Metabolomics,False,,,
isobaricLabelingReagent,"Reagent set used for isobaric labeling.Examples: iTRAQ113 TMT126Provide a value OR provide one of these values: Unknown Not collected, Not applicable, Not specified",,,,True,,,ManifestColumn,,proteomics,True,STRING,Proteomics Data Commons,"A data contributor should be able to write in a name OR provide one of these values: Unknown Not collected, Not applicable, Not specified",Proteomics,False,,,
isPostMortem,Was the sample taken after death (true/false)?,,,,True,,,ManifestColumn,,Biospecimen,False,STRING,Sage Bionetworks,,"Biospecimen_human,Biospecimen_non_Human",False,Sage Bionetworks,,
isStranded,Whether or not the library is stranded.,"False,True,false False FALSE true True TRUE",,,True,,,ManifestColumn,,bsSeq,False,BOOLEAN,Sage Bionetworks,,"Microbiome,RNAseq,Whole_Genome_Sequencing,bsSeq,scRNAseq",False,,,
labelFreeQuantitation,"Type of label-free data analysis strategyProvide a value OR provide one of these values: Unknown Not collected, Not applicable, Not specified","Label-free protein level quantitation,Label-free peptide level quantitation,Label-free protein group level quantitation,Label-free raw feature quantitation,Label-free gene level quantitation",,,True,,,ManifestColumn,,proteomics labelQuantiation = Label Free,True,STRING,Proteomics Data Commons,,Proteomics,False,,,
labelQuantitation,"Type of labeling usedProvide a value OR provide one of these values: Unknown Not collected, Not applicable, Not specified","AminoxyTMT,DiART,DiLeu,Glyco-TMT,Hydrazide TMT,IodoTMT,IPTL,iTRAQ,iTRAQH,Label Free,TMT",,,True,,,ManifestColumn,,proteomics,True,STRING,"Sage Bionetworks, DSLWG, https://www.ebi.ac.uk/ols/ontologies/pride/terms?iri=http%3A%2F%2Fpurl.obolibrary.org%2Fobo%2FPRIDE_0000514&viewMode=All&siblings=false Proteomics Data Commons https://pdc.cancer.gov/data-dictionary/dictionary.html",,Proteomics,False,,,
lambdaDNAconc,Lambda DNA spike-in concentration in ng,,,,True,,,ManifestColumn,,bsSeq,False,NUMBER,Sage Bionetworks,,bsSeq,False,,,
lensVoltages ,"The skimmer/focusing lens voltages e.g., capillary voltage, etc.",,,,False,,,ManifestColumn,,"metabolomics, hasIonizationSource? = Yes",False,NUMBER,"Sage Bionetworks, Proposed minimum metadata relative to mass spectrometry",,Metabolomics,False,,,
lensVoltagesUnit ,Unit of lens voltages,,,,False,,,ManifestColumn,,"metabolomics, hasIonizationSource? = Yes, lensVoltages",False,STRING,"Sage Bionetworks, Proposed minimum metadata relative to mass spectrometry",,Metabolomics,False,,,
libLayout,"Library layout. Specify whether to expect single, paired, or other configurations of reads.Provide a value OR provide one of these values: Unknown Not collected, Not applicable, Not specified",,,,True,,,ManifestColumn,,assay_metagenomics,False,STRING,MIMS (Minimum information about a metagenome sequence.,,Metagenomics,False,,,https://pubmed.ncbi.nlm.nih.gov/18479204/
libraryBatchID,"Library batch identifier, provided by the data contributor to Sage Bionetworks. The batch identifier(s) must be stored in a data dictionary .csv file uploaded to Synapse.Provide a value OR provide one of these values: Unknown Not collected, Not applicable, Not specified",,,,True,,,ManifestColumn,,bsSeq,False,STRING,Sage Bionetworks,"A data contributor should be able to write in a name OR provide one of these values: Unknown Not collected, Not applicable, Not specified","Microbiome,Whole_Genome_Sequencing,bsSeq,scRNAseq",False,,,
libraryPrep,"The general strategy by which the library was prepared.Provide a value OR provide one of these values: Unknown Not collected, Not applicable, Not specified",,,,True,,,ManifestColumn,,bsSeq,False,STRING,Sage Bionetworks,"A data contributor should be able to write in a name OR provide one of these values: Unknown Not collected, Not applicable, Not specified","Metagenomics,Microbiome,Whole_Genome_Sequencing,bsSeq,scRNAseq",False,,,
libraryPreparationMethod,"Method by which library was prepared.Provide a value OR provide one of these values: Unknown Not collected, Not applicable, Not specified",,,,True,,,ManifestColumn,,bsSeq,False,STRING,Sage Bionetworks,"A data contributor should be able to write in a name OR provide one of these values: Unknown Not collected, Not applicable, Not specified","Microbiome,RNAseq,Whole_Genome_Sequencing,bsSeq,scRNAseq",False,,,
libraryVersion,"Library Version: for example, rnaSeq 10x library version.Provide a value OR provide one of these values: Unknown Not collected, Not applicable, Not specified",,,,True,,,ManifestColumn,,bsSeq,False,STRING,Sage Bionetworks,"A data contributor should be able to write in a name OR provide one of these values: Unknown Not collected, Not applicable, Not specified","Microbiome,RNAseq,Whole_Genome_Sequencing,bsSeq,scRNAseq",False,,,
libReadsSeqd,"Library reads sequenced. Total number of clones sequenced from the library.Example: '20'Provide a value OR provide one of these values: Unknown Not collected, Not applicable, Not specified",,,,True,,,ManifestColumn,,assay_metagenomics,False,INTEGER,MIMS (Minimum information about a metagenome sequence.,,Metagenomics,False,,,https://pubmed.ncbi.nlm.nih.gov/18479204/
libSize,"Library size. Total number of clones in the library prepared for the project.Example: '50'Provide a value OR provide one of these values: Unknown Not collected, Not applicable, Not specified",,,,True,,,ManifestColumn,,assay_metagenomics,False,INTEGER,MIMS (Minimum information about a metagenome sequence.,,Metagenomics,False,,,https://pubmed.ncbi.nlm.nih.gov/18479204/
libVector,"Library vector. Cloning vector type(s) used in the construction of libraries.Example: 'Bacteriophage P1'Provide a value OR provide one of these values: Unknown Not collected, Not applicable, Not specified",,,,True,,,ManifestColumn,,assay_metagenomics,False,STRING,MIMS (Minimum information about a metagenome sequence.,,Metagenomics,False,,,https://pubmed.ncbi.nlm.nih.gov/18479204/
lifeStage,The life stage of the individual.note: Other values are possible depending on life stage terminology for individual species. Please let the data curation team know.,"Juvenile,Post-Juvenile,Adult",,,True,,,ManifestColumn,,Individual,False,STRING,"Biological Collections Ontology, https://www.animalaudiograms.org/audiogram_metadata_scheme#:~:text=range%3A%20female%3B%20male-,life%20stage,-The%20life%20stage, https://www.ebi.ac.uk/ols/ontologies/pato",,Individual_non_Human,False,"Biological Collections Ontology, Audiogram Metadata Scheme, PATO - the Phenotype And Trait Ontology",,
meanCoverage,Total number of bases covered by ATAC-seq reads/size of genome,,,,True,,,ManifestColumn,,bsSeq,False,NUMBER,Sage Bionetworks,,bsSeq,False,,,
measurementTechnique,"The name of the measurement technique describing the assay method.Provide a value OR provide one of these values: Unknown Not collected, Not applicable, Not specified",,,,True,,,ManifestColumn,,bsSeq,True,STRING,Sage Bionetworks,"A data contributor should be able to write in a name OR provide one of these values: Unknown Not collected, Not applicable, Not specified","Biospecimen_human,Genotyping_Human,Metabolomics,Metagenomics,Microbiome,Proteomics,RNAseq,Whole_Genome_Sequencing,bsSeq,scRNAseq",False,,,
Metabolomics,Template for Metabolomics,,"Filename,specimenID,sampleType,measurementTechnique,technologyPlatformVersion,platformLocation,instrumentModel,samplePrepProtocol,dataFile,databaseSource,databaseWeblink,databaseName,msTarget,msAssayTechnique,msAnalyteType,sampleIntroduction,extractionMethod,acquisitionMode,acquisitionSoftware,acquistionSoftwareVersion,spectrometerFrequency,hasIonizationSource?,ionProperty,vacuumPressure,vacuumPressureUnit,lensVoltages,lensVoltagesUnit,gasFlowTemperature,gasFlowTemperatureUnit,hasAssayControl,controlType,experiementalBatchSize,experiementalBatchSizeUnit,batchSize,batchSizeUnit,batchID,batchLabel,sampleBatchID,sampleBatchSize,sampleBatchSizeUnit,acquisitionBatchID,acquisitionBatchSize,acquisitionBatchSizeUnit,processingBatchID,processingBatchSize,processingBatchSizeUnit,Component",,False,Component,,,,Template,,,Sage Bionetworks,,,False,,,
Metagenomics,Template for Metagenomics,,"Filename,specimenID,sampleType,experimentType,measurementTechnique,technologyPlatformVersion,platformLocation,instrumentModel,samplePrepProtocol,dataFile,databaseSource,databaseWeblink,databaseName,databaseVersion,databaseLibrary,libraryPrep,libSize,mid,assemblyName,nucleAcidExt,sourceMatID,libReadsSeqd,numberContig,libLayout,assemblyQual,libVector,adapters,assemblySoftware,experimentalFactor,associatedResource,sop,targetGene,seqMethod,seqPlatform,DNAextraction,Component",,False,Component,,,,Template,,,Sage Bionetworks,,,False,,,
Microbiome,Template for Microbiome,,"Filename,specimenID,sampleType,measurementTechnique,technologyPlatformVersion,platformLocation,extractionMethod,libraryBatchID,sequencingBatchID,sequencingBatchSize,sequencingBatchSizeUnit,dnaBatchID,dnaBatchSize,dnaBatchSizeUnit,libraryPrep,libraryPreparationMethod,libraryVersion,isStranded,readStrandOrigin,readLength,readLengthUnits,runType,totalReads,Component",,False,Component,,,,Template,,,Sage Bionetworks,,,False,,,
mid,"Multiplex identifiers. Molecular barcodes, called Multiplex Identifiers (MIDs), are used to tag unique samples in a sequencing run specifically. Sequence should be reported in uppercase letters.Example: 'GTGAATAT'Provide a value OR provide one of these values: Unknown Not collected, Not applicable, Not specified",,,,True,,,ManifestColumn,,assay_metagenomics,False,STRING,MIMS (Minimum information about a metagenome sequence.,,Metagenomics,False,,,https://pubmed.ncbi.nlm.nih.gov/18479204/
modificationParameters,"Modification parameters for a search engine run. (ex. PSI: PI http://www.w3.org/2002/07/owl#Axiom) or used in the peptide identification database search.Provide a value OR provide one of these values: Unknown Not collected, Not applicable, Not specified",,,,True,,,ManifestColumn,,proteomics,True,STRING,https://www.ebi.ac.uk/ols/ontologies/ms/terms?iri=http%3A%2F%2Fpurl.obolibrary.org%2Fobo%2FMS_1001055,"Possible values are listed under modification parameters:https://www.ebi.ac.uk/ols/ontologies/ms/terms?iri=http%3A%2F%2Fpurl.obolibrary.org%2Fobo%2FMS_1001055Other, Unknown, Not collected, Not applicable, Not specified",Proteomics,False,,,
msAnalyteType,"The type of biospecimen subjected to analysis (ex., peptide, protein, metabolite, lipid)Provide a value OR provide one of these values: Unknown Not collected, Not applicable, Not specified",,,,True,,,ManifestColumn,,"metabolomics, msTarget = Targeted",False,STRING,"http://purl.obolibrary.org/obo/NCIT_C156434,http://purl.obolibrary.org/obo/NCIT_C156434 Proteomic Data Commons https://pdc.cancer.gov/data-dictionary/dictionary.html","A data contributor should be able to write in a name OR provide one of these values: Unknown Not collected, Not applicable, Not specified","Metabolomics,Proteomics",False,,,
msAssayTechnique,"Specified the mass spectrometer technique used or the name of the proteomics assay used (ex. DDA)Provide a value OR provide one of these values: Unknown Not collected, Not applicable, Not specified",,,,True,,,ManifestColumn,,metabolomics,False,STRING,"Sage Bionetworks, DSLWG","A data contributor should be able to write in a name OR provide one of these values: Unknown Not collected, Not applicable, Not specified","Metabolomics,Proteomics",False,,,
msTarget,Specifies whether or not a specific molecule(s) is/are targeted for detection/measurement by the assay,"Targeted,Untargeted",,,True,,,ManifestColumn,,metabolomics,False,STRING,"DSLWG,Sage Bionetworks",,"Metabolomics,Proteomics",False,,,
nucleAcidExt,"Nucleic acid extraction. A link to a literature reference, electronic resource or a standard operating procedure (SOP), that describes the material separation to recover the nucleic acid fraction from a sample. (example, https://mobio.com/media/wysiwyg/pdfs/protocols/12888.pdf).Provide a value OR provide one of these values: Unknown Not collected, Not applicable, Not specified",,,,True,,,ManifestColumn,,assay_metagenomics,False,STRING,MIMS (Minimum information about a metagenome sequence.,,Metagenomics,False,,,https://pubmed.ncbi.nlm.nih.gov/18479204/
nucleicAcidSource,"Specifies the type of nucleic acid (DNA, RNA, Pooled, etc.) found in a sample.","bulk cell,single cell,bulk nuclei,single nucleus,mitochondria,sorted cells,sorted nuclei",,,True,,,ManifestColumn,,Biospecimen,False,STRING,https://ncithesaurus.nci.nih.gov/ncitbrowser/ConceptReport.jsp?dictionary=NCI_Thesaurus&version=23.04d&ns=ncit&code=C171278&key=1146649015&b=1&n=1,,"Biospecimen_human,Biospecimen_non_Human",False,NCI Thesaurus OBO Edition,C171278,
numberContig,"Number of contigs. Total number of contigs in the cleaned/submitted assembly that comprise a given genome, SAG, MAG, or UViG.Example: '40'Provide a value OR provide one of these values: Unknown Not collected, Not applicable, Not specified",,,,False,,,ManifestColumn,,assay_metagenomics,False,INTEGER,MIMS (Minimum information about a metagenome sequence.,,Metagenomics,False,,,https://pubmed.ncbi.nlm.nih.gov/18479204/
numberIndividuals,Number of individuals in a group.Example: 2000,,,,True,,,ManifestColumn,,"Biospecimen, genotyping",False,INTEGER,"Sage Bionetworks, EMBL-EBI",,Genotyping_Human,False,,,
organ,Indicate the organ the specimen is from,NCI values (not listed for purposes of this RFC),,,True,,,ManifestColumn,,Biospecimen,False,STRING,http://purl.obolibrary.org/obo/NCIT_C13018,,"Biospecimen_human,Biospecimen_non_Human",False,NCI Thesaurus OBO Edition,C13018,
pcrCycles,Number of PCR cycles to amplify transposased DNA fragments,,,,True,,,ManifestColumn,,bsSeq,False,NUMBER,Sage Bionetworks,,bsSeq,False,,,
Phenotype_human,Template for Phenotype_human,,"Filename,individualID,cohort,speciesGroup,sex,race,ethnicity,ethnicGroupCode,age,diagnosisStatus,diagnosis,Component",,False,Component,,,,Template,,,Sage Bionetworks,,,False,,,
platformLocation,"The name of the laboratory, facility, vendor, company, or location where the data generation platform was located, provided by the data contributor.Provide a value OR provide one of these values: Unknown Not collected, Not applicable, Not specified",,,,True,,,ManifestColumn,,bsSeq,True,STRING,"DSLWG,Sage Bionetworks","A data contributor should be able to write in a name OR provide one of these values: Unknown Not collected, Not applicable, Not specified","Metabolomics,Metagenomics,Microbiome,Proteomics,RNAseq,Whole_Genome_Sequencing,bsSeq,scRNAseq",False,,,
processingBatchID,"Processing batch identifier, provided by the data contributor to Sage Bionetworks. The batch identifier(s) must be stored in a data dictionary .csv file uploaded to Synapse",,,,False,,,ManifestColumn,,metabolomics,False,STRING,Sage Bionetworks,,Metabolomics,False,,,
processingBatchSize,The number of samples,,,,False,,,ManifestColumn,,metabolomics,False,STRING,Sage Bionetworks,,Metabolomics,False,,,
processingBatchSizeUnit,The unit of measurement for number of samples in a batch,,,,False,,,ManifestColumn,,"metabolomics, processingBatchSize",False,STRING,Sage Bionetworks,,Metabolomics,False,,,
Proteomics,Template for Proteomics,,"Filename,specimenID,sampleType,experimentType,measurementTechnique,technologyPlatformVersion,platformLocation,instrumentModel,samplePrepProtocol,dataFile,databaseSource,databaseWeblink,databaseName,modificationParameters,quantationStrategy,labelQuantitation,labelFreeQuantitation,isobaricLabelingReagent,msTarget,msAssayTechnique,msAnalyteType,digestionMethod,digestionReagent,fractionIdentifier,enrichmentStrategy,enrichment,Component",,False,Component,,,,Template,,,Sage Bionetworks,,,False,,,
quantationStrategy,"The general strategy used for differential analysisExample: Absolute quantitation analysis, Isobaric label quantitation analysis, LC-MS label-free quantitation analysis,Provide a value OR provide one of these values: Unknown Not collected, Not applicable, Not specified",,,,True,,,ManifestColumn,,proteomics,True,STRING,Sage Bionetworks,"A data contributor should be able to write in a name OR provide one of these values: Unknown Not collected, Not applicable, Not specified",Proteomics,False,,,
race,Race of individual,"White,Black or African American,Asian,American Indian or Alaska Native,Native Hawaiian or  Pacific Islander,Multiracial, race,Prefer not to answer",,,True,,,ManifestColumn,,Phenotype,True,STRING,"Sage Bionetworks, https://www.synapse.org/#!Synapse:syn25878249, https://jamanetwork.com/pages/inclusive-language, https://thesaurus.cancer.gov/ncitbrowser/pages/home.jsf?version=23.04d",,"Individual_Human,Phenotype_human",False,"Sage Bionetworks, AMA Manual of Style, 11th edition, NCI Thesaurus",,
readLength,The length of the read.,,,,True,,,ManifestColumn,,bsSeq,False,NUMBER,Sage Bionetworks,,"Microbiome,RNAseq,Whole_Genome_Sequencing,bsSeq,scRNAseq",False,,,
readLengthUnits,The units of measurement.,,,,True,,,ManifestColumn,,"bsSeq, readLength",False,STRING,Sage Bionetworks,,"Microbiome,RNAseq,Whole_Genome_Sequencing,bsSeq,scRNAseq",False,,,
readmeFile,The name of any readme file uploaded to Synapse.Example: example.tsv,,,,False,,,ManifestColumn,,"genotyping, useReadMeFile? = Yes",False,STRING,"Sage Bionetworks, EMBL-EBI","A data contributor should be able to write in a name OR provide one of these values: Unknown Not collected, Not applicable, Not specified",Genotyping_Human,False,,,
readStrandOrigin,The strand from which the read originates in a strand-specific protocol.,"Forward Reverse,forward reverse",,,True,,,ManifestColumn,,bsSeq,False,STRING,Sage Bionetworks,,"Microbiome,RNAseq,Whole_Genome_Sequencing,bsSeq,scRNAseq",False,,,
reagentCatalogNumber,"If the assay reagent is a commercial product, enter the vendor's catalog identifier. If the reagent is a custom preparation enter 'NA'.",,,,False,,,ManifestColumn,,"genotyping, useReagent = Yes",True,STRING,"Sage Bionetworks, ImmPort",,Genotyping_Human,False,,,
reagentContact,The contact information is particularly helpful when the reagent is not from a commercial vendor.,,,,False,,,ManifestColumn,,"genotyping, useReagent = Yes",True,STRING,"Sage Bionetworks, ImmPort",,Genotyping_Human,False,,,
reagentID(s),"One or more identifiers, separated by a semicolon (;). The reagent identifier(s) must be stored in a data dictionary .csv file uploaded to Synapse.",,,,False,,,ManifestColumn,,"genotyping, useReagent = Yes",True,STRING,"Sage Bionetworks, ImmPort","A data contributor should be able to write in a name OR provide one of these values: Unknown Not collected, Not applicable, Not specified",Genotyping_Human,False,,,
reagentLotNumber,The lot number is often provided by a reagent source when the reagent is replenished over time.,,,,False,,,ManifestColumn,,"genotyping, useReagent = Yes",True,STRING,"Sage Bionetworks, ImmPort",,Genotyping_Human,False,,,
reagentManufacturer,"The manufacturer is the source of a reagent and may include commercial vendors as well as non-commercial sources (e.g., collaborating labs).",,,,False,,,ManifestColumn,,"genotyping, useReagent = Yes",True,STRING,"Sage Bionetworks, ImmPort",,Genotyping_Human,False,,,
reagentName,The reagent name is an alternative to the Reagent ID.,,,,False,,,ManifestColumn,,"genotyping, useReagent = Yes",True,STRING,"Sage Bionetworks, ImmPort",,Genotyping_Human,False,,,
reagentWeblink,An internet address that may provide details of an assay reagent.,,,,False,,,ManifestColumn,,"genotyping, useReagent = Yes",True,STRING,"Sage Bionetworks, ImmPort",,Genotyping_Human,False,,,
referenceTranscriptID,"The ID for the transcript/gene. Either the NCBI ID or the Ensembl ID must be provided.Provide a value OR provide one of these values: Unknown Not collected, Not applicable, Not specified",,,,True,,,ManifestColumn,,bsSeq,False,STRING,Sage Bionetworks,"A data contributor should be able to write in a name OR provide one of these values: Unknown Not collected, Not applicable, Not specified","RNAseq,Whole_Genome_Sequencing,bsSeq,scRNAseq",False,,,
reportedTrait,"The trait under investigation. Please describe the trait concisely but with enough detail to be clear to a non-specialist. Avoid the use of abbreviations; if these are necessary, please define them or their source in the readme file.Example: Reticulocyte count",,,,True,,,ManifestColumn,,genotyping,False,STRING,"Sage Bionetworks, EMBL-EBI","A data contributor should be able to write in a name OR provide one of these values: Unknown Not collected, Not applicable, Not specified",Genotyping_Human,False,,,
repositoryName,"The public repository name for the transcript (for example, Ensembl or NCBI Gene)","ArrayExpress,Broad Single Cell Portal,dbGAP,ENA,Ensembl,FlowRepository,GenBank,GEO,GISAID,IEDB,ImmPort,MassIVE,MetaboLights,Metabolomics Workbench,MGnify,NCBI Gene,PRIDE,SRA,UniProt",,,True,,,ManifestColumn,,RNAseq,False,STRING,Sage Bionetworks,,"RNAseq,Whole_Genome_Sequencing,scRNAseq",False,,,
resultUnit,The unit for the result value,"FPKM,RPKM,TPM,Not Specified",,,True,,,ManifestColumn,,RNAseq,False,STRING,Sage Bionetworks,,"RNAseq,Whole_Genome_Sequencing,scRNAseq",False,,,
rnaBatchID,"Isolation batch identifier, provided by the data contributor to Sage Bionetworks. The batch identifier(s) must be stored in a data dictionary .csv file uploaded to Synapse.Provide a value OR provide one of these values: Unknown Not collected, Not applicable, Not specified",,,,True,,,ManifestColumn,,WGS,False,STRING,Sage Bionetworks,,"Whole_Genome_Sequencing,scRNAseq",False,,,
RNAseq,Template for RNAseq,,"Filename,specimenID,sampleType,measurementTechnique,technologyPlatformVersion,platformLocation,referenceTranscriptID,repositoryName,transcriptType,resultUnit,valueReported,libraryPreparationMethod,libraryVersion,isStranded,readStrandOrigin,readLength,readLengthUnits,runType,totalReads,Component",,False,Component,,,,Template,,,Sage Bionetworks,,,False,,,
runType,The type of run,"pairedEnd,singleEnd,singleEnd pairedEnd",,,True,,,ManifestColumn,,bsSeq,False,STRING,Sage Bionetworks,,"Microbiome,RNAseq,Whole_Genome_Sequencing,bsSeq,scRNAseq",False,,,
sampleBatchID,"Sample batch lot identifier, provided by the data contributor to Sage Bionetworks. The batch identifier(s) must be stored in a data dictionary .csv file uploaded to Synapse",,,,False,,,ManifestColumn,,metabolomics,False,STRING,http://purl.obolibrary.org/obo/MS_1000053,,Metabolomics,False,,,
sampleBatchSize,The number of samples,,,,False,,,ManifestColumn,,metabolomics,False,STRING,Sage Bionetworks,,Metabolomics,False,,,
sampleBatchSizeUnit,The unit of measurement for number of samples in a batch,,,,False,,,ManifestColumn,,"metabolomics, sampleBatchSize",False,STRING,Sage Bionetworks,,Metabolomics,False,,,
