Key,Key Description,Valid Values,columnType,Parent,module
cellType,Indicate the cell type.,"A549, arachnoid, astrocytes, B-lymphocytes, CD138+, CD8+ T-Cells, CNON, dopaminergic neurons, Embryonic stem cells, epithelial, epithelial-like, fibroblast, GABAergic neurons, glia, GLUtamatergic neurons, immune cell, iPSC, iPSC-derived astrocytes, iPSC-derived glia, iPSC-derived neuron, iPSC-derived neuronal progenitor cell, iPSC-derived telencephalic organoids, lymphoblast, lymphoblastoid cell line, macrophages, meningioma, microglia, monocytes, monocyte-derived microglia, NCX NES, NeuN-, NeuN+, neural progenitor cell, neuron, oligodendrocyte, peripheral blood mononuclear cell, polygonal, round, schwann, Schwann cell precusor, schwannoma, SH-SY5Y",STRING,ManifestColumn,biospecimen
fastingState,Was individual fasting when the sample was taken (true/false)?,"FALSE,Not applicable,Not collected,Not specified,TRUE,Unknown",STRING,ManifestColumn,biospecimen
isPostMortem,Was the sample taken after death (true/false)?,"TRUE, FALSE",STRING,ManifestColumn,biospecimen
nucleicAcidSource,"Specifies the type of nucleic acid (DNA, RNA, Pooled, etc.) found in a sample.","bulk cell,bulk nuclei,mitochondria,Not applicable,Not collected,Not specified,single cell,single nucleus,sorted cells,sorted nuclei,Unknown",STRING,ManifestColumn,biospecimen
organ,Indicate the organ the specimen is from,"blood, bone marrow, brain, breast, Bursa Of Fabricius, cerebrospinal fluid, colon, kidney, large intestine, liver, lung, lymph node, mammary gland, nerves, nose, ovary, pancreas, prostate, skin, spleen",STRING,ManifestColumn,biospecimen
samplingAge,"The calculated age of the sample, measurement is determined or coded by the data contributor.Other,Unknown, Not collected, Not applicable",,STRING,ManifestColumn,biospecimen
specimenID,"Identifying string linked to a particular sample or specimen, provide by the data contributor",,STRING,ManifestColumn,biospecimen
tissue,Indicate the tissue the specimen is from,"amygdala, amygdaloid complex, anterior cingulate cortex, angular gyrus, blood, bone marrow, Buccal Mucosa, Buffy Coat, caudate nucleus, cecum derived fecal material, cerebellar cortex, cerebellum, cerebral cortex, cortical plate, dorsal anterior cingulate cortex, dorsal pallium, Dorsal Root Ganglion, dorsolateral prefrontal cortex, dorsomedial prefrontal cortex, embryonic tissue, entorhinal cortex, fecal material, forebrain, frontal cortex, frontal lobe, frontal pole, fusiform gyrus, hippocampus, head of caudate nucleus, inferior frontal gyrus, inferior temporal cortex, inferior temporal gyrus, inferolateral temporal cortex, insula, insular cortex, lateral entorhinal cortex, left cerebral hemisphere, liver, mammillary body, medial dorsal nucleus of thalamus, medial entorhinal cortex, medial frontal cortex, medial ganglionic eminence, medial orbital frontal cortex, medial prefrontal cortex, meninges, midbrain, middle frontal gyrus, middle temporal gyrus, nerve tissue, Not Applicable, nucleus accumbens, occipital lobe, occipital visual cortex, olfactory neuroepithelium, orbitofrontal cortex, parahippocampal gyrus, parietal cortex, parietal lobe, plasma, posterior cingulate cortex, posteroinferior parietal cortex, posterior inferior parietal cortex, posterior superior temporal cortex, precentral gyrus, prefrontal cortex, primary auditory cortex, primary motor cortex, primary somatosensory cortex, primary tumor, primary visual cortex, putamen, right cerebral hemisphere, serum, splenocyte, striatum, subgenual anterior cingulate cortex, subgenual cingulate cortex, superior parietal lobe, superior temporal gyrus, temporal cortex, temporal lobe, temporal pole, thalamus, unspecified, ventricular zone, ventrolateral prefrontal cortex, VZ/SVZ, whole brain",STRING,ManifestColumn,biospecimen
tissueWeight,The mass of the tissue specimen. Measured in mg.,,STRING,ManifestColumn,biospecimen
