Key,Key Description,Valid Values,columnType,Parent,module
seqMethod,"Sequencing method. Sequencing method used; Example - 'Sanger, pyrosequencing, ABI-solid'. Provide a value OR provide one of these values - Unknown Not collected, Not applicable, Not specified",,STRING,ManifestColumn,ManifestColumn
seqPlatform,"Sequencing platform information. Provide a value OR provide one of these values - Unknown Not collected, Not applicable, Not specified",,STRING,ManifestColumn,ManifestColumn
sequencingBatchID,"Sequencing batch identifier, provided by the data contributor to Sage Bionetworks. The batch identifier(s) must be stored in a data dictionary .csv file uploaded to Synapse. Provide a value OR provide one of these values - Unknown Not collected, Not applicable, Not specified",,STRING,ManifestColumn,ManifestColumn
sequencingBatchSize,The number of samples. Provide a value or Unknown Not collected Not applicable Not specified,,STRING,ManifestColumn,ManifestColumn
sequencingBatchSizeUnit,The unit of measurement for number of samples in a batch. Provide a value or Unknown Not collected Not applicable Not specified,,STRING,ManifestColumn,ManifestColumn
sop,"Relevant standard operating procedures. Standard operating procedures used in the assembly and/or annotation of genomes, metagenomes, or environmental sequences. Example - 'http-//press.igsb.anl.gov/earthmicrobiome/protocols-and-standards/its/)'Provide a value OR provide one of these values - Unknown Not collected, Not applicable, Not specified",,STRING,ManifestColumn,ManifestColumn
sourceMatID,"Source material identifiers. A unique identifier assigned to a material sample (as defined by http-//rs.tdwg.org/dwc/terms/materialSampleID and as opposed to a particular digital record of a material sample) used for extracting nucleic acids, and subsequent sequencing.The identifier can refer to the original material collected or any derived sub-samples. Provide a value OR provide one of these values - Unknown Not collected, Not applicable, Not specified",,STRING,ManifestColumn,ManifestColumn
speciesAge,"Age of individual (formatted in months, ex. ""72 months"").note- Uncertainty about the age might require recording age by specifying a lower and upper estimate in months for the age of the animal.",,STRING,ManifestColumn,ManifestColumn
speciesGroup,The taxonomic ranking including both species and subspecies the individual belongs to.,"Amphibian,Bird,Fish,Invertebrate,Mammal,Not applicable,Not collected,Not specified,Reptile,Unknown",STRING,ManifestColumn,ManifestColumn
speciesName,"The scientific name of the species (typically a taxonomic group, ex. ""Eremophila alpestris) the individual belongs to.""""""","Acomys cahirinus, Acomys russatus, Accipiter cooperii, Actitis macularius, Aix sponsa, Anas acuta, Anas carolinensis, Anas platyrhynchos, Antigone canadensis, Archilochus colubris, Artibeus jamaicensis, Baeolophus bicolor, Balaena mysticetus, Blarina brevicauda, Bombycilla cedrorum, Bonasa umbellus, Bos taurus, Branta canadensis, Bubo virginianus, Buteo jamaicensis, Buteo lineatus, Canis latrans, Cardinalis cardinalis, Castor canadensis, Cavia porcellus, Charadrius vociferus, Chinchilla lanigera, Columba livia, Condylura cristata, Corvus brachyrhynchos, Cricetomys ansorgei, Cricetulus barabensis, Cricetulus griseus, Cryptomys damarensis, Cuniculus paca, Cyanocitta cristata, Cygnus olor, Dryobates pubescens, Dumetella carolinensis, Ellobius lutescens, Ellobius talpinus, Eonycteris spelaea, Eptesicus fuscus, Equus caballus, Eremophila alpestris, Fukomys damarensis, Haemorhous mexicanus, Heterocephalus glaber, Hirundo rustica, Homo sapiens, Hydrochoerus hydrochaeris, Hydroprogne caspia, Hylocichla mustelina, Icteria virens, Larus argentatus, Larus delawarensis, Macaca fascicularis, Macaca mulatta, Mareca strepera, Marmota monax, Melanerpes carolinus, Meleagris gallopavo, Melospiza melodia, Meriones unguiculatus, Mesocricetus auratus, Microtus pennsylvanicus, Mimus polyglottos, Molothrus ater, Multi-species, Mus musculus, Myocastor coypus, Myotis lucifugus, Nannospalax galili, Neosciurus carolinensis, Neotoma cinerea, Neotoma floridana, Not applicable, Not collected, Not provided, Not specified, Octodon degus, Odocoileus virginianus, Ondatra zibethicus, Other, Pan troglodytes, Papio anubis, Passer domesticus, Passerina caerulea, Passerina cyanea, Peromyscus gossypinus, Peromyscus leucopus, Peromyscus maniculatus, Phalacrocorax auritus, Phasianus colchicus, Picoides villosus, Pipilo erythrophthalmus, Poecile carolinensis, Quiscalus quiscula, Rattus norvegicus, Rattus rattus, Regulus calendula, Saimiri boliviensis, Sayornis phoebe, Scalopus aquaticus, Sciurus carolinensis, Sciurus niger, Sciurus vulgaris, Scolopax minor, Setophaga citrina, Setophaga coronata, Setophaga dominica, Setophaga petechia, Setophaga pinus, Sialia sialis, Sigmodon hispidus, Sitta carolinensis, Spatula clypeata, Spinus tristis, Spizella passerina, Spizella pusilla, Spizelloides arborea, Struthio camelus, Sturnus vulgaris, Sus scrofa, Sylvilagus floridanus, Tachycineta bicolor, Tamias striatus, Tamiasciurus hudsonicus, Thryothorus ludovicianus, Toxostoma rufum, Troglodytes aedon, Turdus migratorius, Tursiops truncatus, Vicugna pacos, Vireo griseus, Vireo olivaceus, Zalophus californianus, Zenaida macroura, Zonotrichia albicollis, Unknown",STRING,ManifestColumn,ManifestColumn
specimenAge,"The subject's age at the time of specimen extraction is the individual's age (since birth) at the time a given specimen was extracted. Measured as age in years. Other, Unknown, Not collected, Not applicable",,STRING,ManifestColumn,ManifestColumn
specimenSource,Indicate the biological area of the specimen,,STRING,ManifestColumn,ManifestColumn
specimenType,Type of biological material comprising the Specimen,"blood,Cerebrospinal Fluid (CSF),Not applicable,Not collected,Not specified,organoid,plasma,saliva,serum,sputum,stool,swabs,tissue,Unknown,urine",STRING,ManifestColumn,ManifestColumn
stage,Stage of the experimental design.,"Discovery,Not applicable,Not collected,Not specified,Other,Replication,Unknown",STRING,ManifestColumn,ManifestColumn
statisticalModel,"A brief description of the statistical model used to determine association significance. It is important to distinguish studies that would otherwise appear identical (e.g., the same trait analyzed using additive, dominant, and recessive models). Example - additive model",,STRING,ManifestColumn,ManifestColumn
studyCode,"Unique identifier for the study, assigned by the DCC","CDCP,ILO,LC,LG,LLFS,Other",STRING,ManifestColumn,ManifestColumn
studyKey,The short acronym for a study name in a URL-friendly format (ex. LLFS_Metabolomics OR ELPSCRNA),,STRING,ManifestColumn,ManifestColumn
summaryFile,The name of any summary statistics file uploaded to Synapse. Example - example.tsv,,STRING,ManifestColumn,ManifestColumn
summaryStatisticsAssembly,Genome assembly for the summary statistics. Example - GRCh38,,STRING,ManifestColumn,ManifestColumn
targetGene,"Targeted gene or locus name for marker gene studies. Provide a value OR provide one of these values - Unknown Not collected, Not applicable, Not specified",,STRING,ManifestColumn,ManifestColumn
taxon,"Taxonomic identifier. The National Center for Biotechnology Information taxon ID (formatted as, ex. ""txid9989"")",,STRING,ManifestColumn,ManifestColumn
technologyPlatformVersion,"The specific version (application, manufacturer, model, lab, etc.) of a technology that is used to carry out a laboratory or computational experiment. Provide a value OR provide one of these values - Unknown Not collected, Not applicable, Not specified",,STRING,ManifestColumn,ManifestColumn
tissueVolume,The volume of the tissue sample. Measured in microliters.,,STRING,ManifestColumn,ManifestColumn
transcriptType,The type of transcript reported,"lincRNA,mRNA,total RNA minus rRNA,Not applicable,Not collected,Not specified,Other,snRNA,Unknown",STRING,ManifestColumn,ManifestColumn
treatmentAmountUnit,Unit of treatment amount.,"AFU,AI,AU/ml,DK units/ml,g/dl,g/l,gm,HAU,IU,iu/l,IU/ml,Kallikrein Inactivator Unit per Milliliter,kg,l,M,mg,mg/dl,mg/l,mg/ml,miu/ml,ml,mM,MOI,ng,ng/dl,ng/ml,ng/nl,ng/ul,nl,nM,Not specified,NPX,optical density,other,PFU,PFUe,pg,pg/mg creatinine,pg/ml,pg/nl,pg/ul,pl,pM,Pound,TCID50,ug,ug/dl,ug/l,ug/ml,ug/ul,uiu/ml,ul,uM,umol/l,units/ml",NUMBER,ManifestColumn,ManifestColumn
treatmentAmountValue,"The Amount Value indicates how much (concentration, mass, volume) of a treatment agent was applied to a sample.",,STRING,ManifestColumn,ManifestColumn
treatmentDurationUnit,Unit of treatment duration.,"d.p.c.,Days,Hours,Minutes,Months,Not applicable,Not collected,Not specified,Seconds,Unknown,Weeks,Years",STRING,ManifestColumn,ManifestColumn
treatmentDurationValue,Duration of treatment.,,NUMBER,ManifestColumn,ManifestColumn
treatmentIDs,"One or more identifiers, separated by a semicolon (;). The treatment identifier(s) must be stored in a data dictionary .csv file uploaded to Synapse.",,STRING,ManifestColumn,ManifestColumn
treatmentName,"Treatments refer to in vitro modifications of samples. Three treatment types are supported- agent amount, duration, and temperature.  The treatment name is an alternate identifier to the Treatment ID.",,STRING,ManifestColumn,ManifestColumn
treatmentTemperatureUnit,Unit of treatment temperature.,"C,F,K,Not specified",STRING,ManifestColumn,ManifestColumn
treatmentTemperatureValue,Value of treatment temperature.,,NUMBER,ManifestColumn,ManifestColumn
useReadMeFile,Was a readme file uploaded to Synapse?,,STRING,ManifestColumn,ManifestColumn
useReagent,Was a reagent applied to the sample?,"FALSE,TRUE",BOOLEAN,ManifestColumn,ManifestColumn
useSummaryFile,Was a summary statitics file uploded to Synapse?,,STRING,ManifestColumn,ManifestColumn
useTreatment,Was a treatment applied to the sample?,,BOOLEAN,ManifestColumn,ManifestColumn
vacuumPressure,The recorded vacuum pressure value,,NUMBER,ManifestColumn,ManifestColumn
vacuumPressureUnit,Unit of vacuum pressure value,"AFU,AI,AU/ml,bp g/dl,DK units/ml,g/l,gm,HAU,IU,iu/l,IU/ml,Kallikrein Inactivator Unit per Milliliter,kg,l,M,mg,mg/dl,mg/l,mg/ml,miu/ml,ml,mM,MOI,ng,ng/dl,ng/ml,ng/nl,ng/ul,nl,nM,Not specified,NPX,optical density,PFU,PFUe,pg,pg/mg creatinine,pg/ml,pg/nl,pg/ul,pl,pM,Pound,TCID50,ug,ug/dl,ug/l,ug/ml,ug/ul,uiu/ml,ul,uM,umol/l,units/ml",STRING,ManifestColumn,ManifestColumn
valueReported,The count or gene count for the transcript,,STRING,ManifestColumn,ManifestColumn
variantCount,The number of variants analysed in the discovery stage (after QC). Example - 52500,,STRING,ManifestColumn,ManifestColumn
visitCode,"Indicate which longitudinal visit for the individual the data comes from, provided by the data contributor's data dictionary",,NUMBER,ManifestColumn,ManifestColumn
