,Attribute,Description,Valid Values,DependsOn,Properties,Required,Parent,DependsOn Component,Source,Validation Rules
0,specimenID,"Identifying string linked to a particular sample or specimen, provide by the data contributor",,,,True,dataProperty,,Sage Bionetworks,matchAtLeastOne Biospecimenhuman.specimenID value
1,sampleType,The type of sample collected,"Amniotic Fluid,Appendix,B cell,Basophils,Bone,Bone Marrow,Brachial lymph node,brain,Breast Milk,Bronchoalveolar Lavage Fluid,Carbohydrate,Cell culture supernatant,cell line,Cerebrospinal Fluid,Cervical lymph nodes,Colon,Colonic Lamina Propria,Convalescent Plasma,Cord blood,Dendritic cell,Dermis,DNA,Dried Blood Spot,Endotracheal aspirate,Epithelium,Feces,Fibroblast,Gastric lamina propria,Ileum,Inguinal lymph node,Jejunum,Kidney,Leukocytes,Lipid,Liver,Lung,Lung lymph node,Lymph node,Lymphocyte,Macrophage,Mesenteric lymph node,Monocyte,Mouse Ear,Nasal lavage fluid,Nasal Swab,Nasal Swab or Nose Specimen,Nasopharyngeal Swab Specimen,Negative Control,Neutrophil,NK cell,Not Specified,Optic Nerve,Organoids,Oropharyngeal Swab Specimen,Osteoblasts,OtherSampleType,Pancreas,Pancreatic Stellate Cells,PBL,PBMC,Placenta,Plasma,Pooled Sample,Popliteal lymph node,Positive Control,Protein,Rectal Swab Specimen,Red Blood Cell,Saliva,Salivary Glands,Serum,Skin of body,Small intestine,Spleen,Sputum,Stomach,Synovial fluid,Synovial tissue,T cell,Thymus,Tonsil,Trachea,Tumor Tissue,Umbilical cord blood,Urinary bladder,Urine,Vagina,Whole blood",,,True,dataProperty,,"Sage Bionetworks,ImmPort",
2,specifySampleType,"If ""other"" is selected list the type of sample",,,,False,dataProperty,,Sage Bionetworks,
3,specifyMeasurementTechnique,"If ""other"" is selected list the name of the measurement technique used",,,,False,dataProperty,,Sage Bionetworks,
4,technologyPlatformVersion,"The specific version (application, manufacturer, model, lab, etc.) of a technology that is used to carry out a laboratory or computational experiment.","10x Visium Spatial Gene Expression,Affymetrix Genome-Wide Human SNP 5.0 Array,Affymetrix Genome-Wide Human SNP 6.0 Array,Affymetrix Human Gene 1.0 ST Array,Affymetrix Human Genome U133 Plus 2.0 Array,Affymetrix U133AB,Agilent 44Karray,BGISEQ-500,Bionano Irys,Cherry Imaging FACE Platform,Cherry Imaging TRACE Platform,Chromium X,EnVision 2103 Multiplate Reader,Illumina 1M,Illumina Genome Analyzer IIx,Illumina h650,Illumina HiSeq 2000,Illumina HiSeq 2500,Illumina HiSeq 3000,Illumina HiSeq 4000,Illumina HiSeq X,Illumina Human660W-Quad v1.0 BeadChip,Illumina HumanHap300,Illumina HumanMethylation450,Illumina HumanOmni1-Quadv1.0,Illumina HumanOmniExpress-24 v1.0 BeadChip,Illumina HumanOmniExpress-24 v1.2 BeadChip,Illumina Infinium MethylationEPIC BeadChip v1.0 (850k),Illumina Infinium MethylationEPIC BeadChip v2.0 (935k)Illumina MiSeq,Illumina MouseWG-6 v2.0 expression BeadChip,Illumina NextSeq 1000,Illumina NextSeq 2000,Illumina NextSeq 500,Illumina NextSeq 550,Illumina NovaSeq 6000,Illumina Omni2pt5M,Illumina Omni5M,Illumina WholeGenome DASL,Infinium HumanOmniExpressExome,LI-COR Odyssey CLx,LifeViz Infinity System,LifeViz Micro System,LTQ Orbitrap XL,Nanostring Counter,Nanostring GeoMx,Olympus DP80,Orbitrap Fusion Lumos Tribrid,PacBio RS II,PacBio Sequel II System,PacBio Sequel IIe System,Perlegen 300Karray,Promega GloMax Discover,Q Exative HF,scale,Spectramax M Series,Vectra H1 3D Imaging System,Vevo 3100 Imaging System,Zeiss LSM 980,OtherTechnologyPlatformVersion,Unknown,Not collected,Not applicable,Not Specified",,,True,dataProperty,,Sage Bionetworks,
5,specifyPlatformVersion,"If ""other"" list the name of the platform version",,,,False,dataProperty,,Sage Bionetworks,
6,platformLocation,"The name of the laboratory, facility, vendor, company, or location where the data generation platform was located, provided by the data contributor","OtherPlatformLocation,Unknown,Not collected,Not applicable,Not Specified",,,True,dataProperty,,Sage Bionetworks,
7,specifyPlatformLocation,"If ""other"" list the name of the platform location",,,,False,dataProperty,,Sage Bionetworks,
8,referenceTranscriptID,The ID for the transcript/gene. Either the NCBI ID or the Ensembl ID must be provided,"Unknown,Not collected,Not applicable,Not Specified",,,True,dataProperty,,Sage Bionetworks,
9,dnaBatchID,DNA isolation batch,"Other,Unknown,Not collected,Not applicable",,,True,dataProperty,,Sage Bionetworks,
10,dnaBatchSize,The number of samples,,,,True,dataProperty,,Sage Bionetworks,regex search ([0-9]+\.[0-9]*.)|([0-9]+)
11,dnaBatchSizeUnit,The unit of measurement for number of samples in a batch,"AFU,AI,AU/ml,DK units/ml,bpg/dl,g/l,gm,HAU,IU,iu/l,IU/ml,Kallikrein Inactivator Unit per Milliliter,kg,l,M,mg,mg/dl,mg/l,mg/ml,miu/ml,ml,mM,MOI,ng,ng/dl,ng/ml,ng/nl,ng/ul,nl,nM,Not Specified,NPX,optical density,PFU,PFUe,pg,pg/mg creatinine,pg/ml,pg/nl,pg/ul,pl,pM,Pound,TCID50,ug,ug/dl,ug/l,ug/ml,ug/ul,uiu/ml,ul,uM,umol/l,units/ml,OtherDnaBatchSizeUnit",,,True,dataProperty,,Sage Bionetworks,
12,specifyDNABatchSizeUnit,"If ""other"" list unit of measure",,,,False,dataProperty,,Sage Bionetworks,
13,libraryBatchID,"Library batch identifier, provided by the data contributor to Sage Bionetworks. The batch identifier(s) must be stored in a data dictionary .csv file uploaded to Synapse",,,,True,dataProperty,,Sage Bionetworks,
14,libraryPrep,The general strategy by which the library was prepared,"amplicon,cellHashing,Chromium Single Cell 3',DNALibraryConstruction,EndItDNAEndRepairKit,KapaHyperPrep,lncRNAenrichment,methylSeq,miRNAenrichment,multiome,MULTIseq,PCRfree,polyAselection,proximity ligation,rRNAdepletion,SPLITseq,STARRSeq,SureCell,totalRNA,OtherLibraryPrep,Unknown,Not collected,Not applicable,Not Specified",,,True,dataProperty,,Sage Bionetworks,
15,specifyLibraryPrep,"If ""other"" list the name of the general strategy used to prepare the library",,,,False,dataProperty,,Sage Bionetworks,
16,libraryPreparationMethod,Method by which library was prepared,"10x,Accel-NGS 2S Plus,Accel-NGS Methyl-Seq,CEL-seq,Drop-Seq,NEBNext,NexteraXT,Omni-ATAC,sac-seq,Smart-seq1,Smart-seq2,Smart-seq4,SMRTbell,TruSeq,Ultralow Methyl-Seq,OtherLibraryPreparationMethod,Unknown,Not collected,Not applicable,Not Specified",,,True,dataProperty,,Sage Bionetworks,
17,specifyLibraryPreparationMethod,"If ""other"" list the name of the library preparation methods",,,,False,dataProperty,,Sage Bionetworks,
18,libraryVersion,"Library Version: for example, rnaSeq 10x library version","OtherLibraryVersion,Unknown,Not collected,Not applicable,Not Specified",,,True,dataProperty,,Sage Bionetworks,
19,specifyLibraryVersion,"If ""other"" list the name of the library version",,,,False,dataProperty,,Sage Bionetworks,
20,sequencingBatchID,"Sequencing batch identifier, provided by the data contributor to Sage Bionetworks. The batch identifier(s) must be stored in a data dictionary .csv file uploaded to Synapse","Unknown,Not collected,Not applicable,Not Specified",,,True,dataProperty,,Sage Bionetworks,
21,sequencingBatchSize,The number of samples,,,,True,dataProperty,,Sage Bionetworks,regex search ([0-9]+\.[0-9]*.)|([0-9]+)
22,sequencingBatchSizeUnit,The unit of measurement for number of samples in a batch,"AFU,AI,AU/ml,DK units/ml,bpg/dl,g/l,gm,HAU,IU,iu/l,IU/ml,Kallikrein Inactivator Unit per Milliliter,kg,l,M,mg,mg/dl,mg/l,mg/ml,miu/ml,ml,mM,MOI,ng,ng/dl,ng/ml,ng/nl,ng/ul,nl,nM,Not Specified,NPX,optical density,PFU,PFUe,pg,pg/mg creatinine,pg/ml,pg/nl,pg/ul,pl,pM,Pound,TCID50,ug,ug/dl,ug/l,ug/ml,ug/ul,uiu/ml,ul,uM,umol/l,units/ml,OtherSequencingBatchSizeUnit",,,True,dataProperty,,Sage Bionetworks,
23,specifySequencingBatchSizeUnit,"If ""other"" list unit of measure",,,,False,dataProperty,,Sage Bionetworks,
24,isStranded,Whether or not the library is stranded.,"TRUE,FALSE",,,True,dataProperty,,Sage Bionetworks,
25,readStrandOrigin,The strand from which the read originates in a strand-specific protocol,"forward,reverse",,,True,dataProperty,,Sage Bionetworks,
26,readLength,The length of the read,,,,True,dataProperty,,Sage Bionetworks,regex search ([0-9]+\.[0-9]*.)|([0-9]+)
27,readLengthUnits,The units of measurement.,"AFU,AI,AU/ml,DK units/ml,bpg/dl,g/l,gm,HAU,IU,iu/l,IU/ml,Kallikrein Inactivator Unit per Milliliter,kg,l,M,mg,mg/dl,mg/l,mg/ml,miu/ml,ml,mM,MOI,ng,ng/dl,ng/ml,ng/nl,ng/ul,nl,nM,Not Specified,NPX,optical density,PFU,PFUe,pg,pg/mg creatinine,pg/ml,pg/nl,pg/ul,pl,pM,Pound,TCID50,ug,ug/dl,ug/l,ug/ml,ug/ul,uiu/ml,ul,uM,umol/l,units/ml,OtherReadLengthUnits",,,True,dataProperty,,Sage Bionetworks,
28,specifyReadLengthUnits,"If ""other"" provide the unit of measure",,,,False,dataProperty,,Sage Bionetworks,
29,runType,The type of run,"singleEnd,pairedEnd",,,True,dataProperty,,Sage Bionetworks,
30,totalReads,Total number of sequencing reads from a library.,,,,True,dataProperty,,Sage Bionetworks,regex search ([0-9]+\.[0-9]*.)|([0-9]+)
31,directionalBSseqLibrary,Indicates whether or not the bisulfiteSeq library is directional,"TRUE,FALSE,Unknown,Not collected,Not applicable",,,True,dataProperty,,Sage Bionetworks,
32,gDNAconc,gDNA Concentration in ng,,,,True,dataProperty,,Sage Bionetworks,regex search ([0-9]+\.[0-9]*.)|([0-9]+)
33,lambdaDNAconc,Lambda DNA spike-in concentration in ng,,,,True,dataProperty,,Sage Bionetworks,regex search ([0-9]+\.[0-9]*.)|([0-9]+)
34,pcrCycles,Number of PCR cycles to amplify transposased DNA fragments,,,,True,dataProperty,,Sage Bionetworks,regex search ([0-9]+\.[0-9]*.)|([0-9]+)
35,meanCoverage,Total number of bases covered by ATAC-seq reads/size of genome,,,,True,dataProperty,,Sage Bionetworks,regex search ([0-9]+\.[0-9]*.)|([0-9]+)
36,conversionRatio,The ratio or % detailing how well the bisulfite conversion worked,,,,True,dataProperty,,Sage Bionetworks,
37,conversionRatioUnits,The units of measurement.,"AFU,AI,AU/ml,DK units/ml,bpg/dl,g/l,gm,HAU,IU,iu/l,IU/ml,Kallikrein Inactivator Unit per Milliliter,kg,l,M,mg,mg/dl,mg/l,mg/ml,miu/ml,ml,mM,MOI,ng,ng/dl,ng/ml,ng/nl,ng/ul,nl,nM,Not Specified,NPX,optical density,PFU,PFUe,pg,pg/mg creatinine,pg/ml,pg/nl,pg/ul,pl,pM,Pound,TCID50,ug,ug/dl,ug/l,ug/ml,ug/ul,uiu/ml,ul,uM,umol/l,units/ml,OtherConversionRatioUnits",,,True,dataProperty,,Sage Bionetworks,
38,specifyConversionRatioUnit,"If ""other"" list unit of measure",,,,False,dataProperty,,Sage Bionetworks,
39,enrichmentMethod,The method used for performing an enrichment of specific regions by a restriction enzyme digest,"Other,Unknown,Not collected,Not applicable",,,True,dataProperty,,Sage Bionetworks,
40,specifyEnrichmentMethod,"If ""other"" list the method used for enrichment",,,,False,dataProperty,,Sage Bionetworks,
41,repositoryName,"The public repository name for the transcript (for example, Ensembl or NCBI Gene)","ArrayExpress,Broad Single Cell Portal,dbGAP,ENA,Ensembl,FlowRepository,GenBank,GEO,GISAID,IEDB,ImmPort,MassIVE,MetaboLights,Metabolomics Workbench,MGnify,NCBI Gene,PRIDE,SRA,UniProt,OtherRepositoryName,Unknown,Not collected,Not applicable,Not Specified",,,True,dataProperty,,Sage Bionetworks,
42,specifyRepositoryName,"If ""other"" list the name of the repository",,,,False,dataProperty,,Sage Bionetworks,
43,transcriptType,The type of transcript reported,"lincRNA,mRNA,snRNA,OtherTranscriptType,Unknown,Not collected,Not applicable,Not Specified",,,True,dataProperty,,ImmPort,
44,specifyTranscriptType,"If ""other"" list the transcript type",,,,False,dataProperty,,Sage Bionetworks,
45,resultUnit,The unit for the result value,"FPKM,RPKM,TPM,Not Specified",,,True,dataProperty,,Sage Bionetworks,
46,valueReported,The count or gene count for the transcript,,,,True,dataProperty,,Sage Bionetworks,regex search ([0-9]+\.[0-9]*.)|([0-9]+)
47,rnaBatchID,"RNA isolation batch identifier, provided by the data contributor to Sage Bionetworks. The batch identifier(s) must be stored in a data dictionary .csv file uploaded to Synapse","Unknown,Not collected,Not applicable,Not Specified",,,True,dataProperty,,Sage Bionetworks,
48,rnaBatchSize,The number of samples,,,,False,dataProperty,,Sage Bionetworks,regex search ([0-9]+\.[0-9]*.)|([0-9]+)
49,rnaBatchSizeUnit,The unit of measurement for number of samples in a batch,"AFU,AI,AU/ml,DK units/ml,bpg/dl,g/l,gm,HAU,IU,iu/l,IU/ml,Kallikrein Inactivator Unit per Milliliter,kg,l,M,mg,mg/dl,mg/l,mg/ml,miu/ml,ml,mM,MOI,ng,ng/dl,ng/ml,ng/nl,ng/ul,nl,nM,Not Specified,NPX,optical density,PFU,PFUe,pg,pg/mg creatinine,pg/ml,pg/nl,pg/ul,pl,pM,Pound,TCID50,ug,ug/dl,ug/l,ug/ml,ug/ul,uiu/ml,ul,uM,umol/l,units/ml,OtherRnaBatchSizeUnit",,,True,dataProperty,,Sage Bionetworks,
50,specifyRNABatchSizeUnit,"If ""other"" list unit of measure",,,,False,dataProperty,,Sage Bionetworks,
51,useReagent,Was a reagent applied to the sample,"YesUseReagent,No",,,True,dataProperty,,"Sage Bionetworks,ImmPort",
52,reagentID(s),"One or more identifiers, separated by a semicolon (;). The reagent identifier(s) must be stored in a data dictionary .csv file uploaded to Synapse",,,,False,dataProperty,,"Sage Bionetworks,ImmPort",
53,reagentName,The reagent name is an alternative to the Reagent ID,,,,False,dataProperty,,"Sage Bionetworks,ImmPort",
54,reagentManufacturer,"The manufacturer is the source of a reagent and may include commercial vendors as well as non-commercial sources (e.g., collaborating labs)",,,,False,dataProperty,,"Sage Bionetworks,ImmPort",
55,reagentCatalogNumber,"If the assay reagent is a commercial product, enter the vendor's catalog identifier. If the reagent is a custom preparation enter 'NA'. ",,,,False,dataProperty,,"Sage Bionetworks,ImmPort",
56,reagentLotNumber,The lot number is often provided by a reagent source when the reagent is replenished over time. ,,,,False,dataProperty,,"Sage Bionetworks,ImmPort",
57,reagentWeblink,An internet address that may provide details of an assay reagent.,,,,False,dataProperty,,"Sage Bionetworks,ImmPort",
58,reagentContact,The contact information is particularly helpful when the reagent is not from a commercial vendor.,,,,False,dataProperty,,"Sage Bionetworks,ImmPort",
59,useTreatment,Was a treatment applied to the sample,"YesUseTreatment,No",,,True,dataProperty,,"Sage Bionetworks,ImmPort",
60,treatmentID(s),"One or more identifiers, separated by a semicolon (;). The treatment identifier(s) must be stored in a data dictionary .csv file uploaded to Synapse",,,,False,dataProperty,,"Sage Bionetworks,ImmPort",
61,treatmentName,"Treatments refer to in vitro modifications of samples. Three treatment types are supported: agent amount, duration, and temperature.  Treatment name is an alternate identifier to the Treatment ID ",,,,False,dataProperty,,"Sage Bionetworks,ImmPort",
62,treatmentAmountValue,"The Amount Value indicates how much (concentration, mass, volume) of a treatment agent was applied to a sample.",,,,False,dataProperty,,"Sage Bionetworks,ImmPort",
63,treatmentAmountUnit,Unit of treatment amount,"AFU,AI,AU/ml,DK units/ml,g/dl,g/l,gm,HAU,IU,iu/l,IU/ml,Kallikrein Inactivator Unit per Milliliter,kg,l,M,mg,mg/dl,mg/l,mg/ml,miu/ml,ml,mM,MOI,ng,ng/dl,ng/ml,ng/nl,ng/ul,nl,nM,Not Specified,NPX,optical density,PFU,PFUe,pg,pg/mg creatinine,pg/ml,pg/nl,pg/ul,pl,pM,Pound,TCID50,ug,ug/dl,ug/l,ug/ml,ug/ul,uiu/ml,ul,uM,umol/l,units/ml",,,False,dataProperty,,"Sage Bionetworks,ImmPort",regex search ([0-9]+\.[0-9]*.)|([0-9]+)
64,treatmentDurationValue,Duration of treatment,,,,False,dataProperty,,,regex search ([0-9]+\.[0-9]*.)|([0-9]+)
65,treatmentDurationUnit,Unit of treatment duration,"d.p.c.,Days,Hours,Minutes,Months,Not Specified,Seconds,Weeks,Years",,,False,dataProperty,,"Sage Bionetworks,ImmPort",
66,treatmentTemperatureValue,Value of treatment temperature,,,,False,dataProperty,,"Sage Bionetworks,ImmPort",regex search ([0-9]+\.[0-9]*.)|([0-9]+)
67,treatmentTemperatureUnit,Unit of treatment temperature,"C,F,K,Not Specified",,,False,dataProperty,,"Sage Bionetworks,ImmPort",
68,msTarget,specifies whether or not a specific molecule(s) is/are targeted for detection/measurement by the assay,"TargetedMsTarget,UnTargetedMsTarget,Unknown,Not collected,Not applicable,Not Specified",,,True,dataProperty,,Sage Bionetworks,
69,msAnalyzerTypeMS1,"Describes the mass spectrometer analyzer used to read out parent ions (quadrupole, ion-trap, time-of-flight, FT-ICR, including combinations of these for hybrid instruments)","LTQ Orbitrap XL,Orbitrap Fusion,Orbitrap Fusion Lumos,Q Exactive,Q Exactive HF,Q Exactive HF-X,Q Exactive Plus,Exploris 240Exploris 480quadrupole time-of-flight,time-of-flight,triple quadrupole,Xevo G2 QTOF,Xevo TQ-S,Bruker Avance IIITimsTOF ProOtherMsAnalyzerTypeMS1,Unknown,Not collected,Not applicable,Not Specified",,,True,dataProperty,,"Sage Bionetworks,Proposed minimum metadata relative to mass spectrometry ",
70,specifyMSAnalyzerTypeMS1,"If ""other"" is selected list the name of the mass spectrometer analyzer used",,,,False,dataProperty,,Sage Bionetworks,
71,msAnalyzerTypeMS2,"Describes the mass spectrometer analyzer used to read out fragment ions(quadrupole, ion-trap, time-of-flight, FT-ICR, including combinations of these for hybrid instruments)","LTQ Orbitrap XL,Orbitrap Fusion,Orbitrap Fusion Lumos,Q Exactive,Q Exactive HF,Q Exactive HF-X,Q Exactive Plus,Exploris 240Exploris 480quadrupole time-of-flight,time-of-flight,triple quadrupole,Xevo G2 QTOF,Xevo TQ-S,Bruker Avance IIITimsTOF ProOtherMsAnalyzerTypeMS2,Unknown,Not collected,Not applicable,Not Specified",,,True,dataProperty,,"Sage Bionetworks,Proposed minimum metadata relative to mass spectrometry ",
72,specifyMSAnalyzerTypeMS2,"If ""other"" is selected list the name of the mass spectrometer analyzer used",,,,False,dataProperty,,Sage Bionetworks,
73,msAssayTechnique,Specified the mass spectrometer technique used,"DDA-MS,DIA-MS,FIA-MSMS,HPLC-MSMS,LC-MS,LC-MSMS,MDMS-SL,MIB-MS,UPLC-MSMS,UPLC-ESI-QTOF-MS,LC-SRMOtherMsAssayTechnique,Unknown,Not collected,Not applicable,Not Specified",,,True,dataProperty,,"Sage Bionetworks,DSLWG",
74,specifyMSAssayTechnique,"If ""other"" is selected list the name of the mass spectrometer technique used or the name of the proteomics assay used",,,,False,dataProperty,,Sage Bionetworks,
75,msAnalyteType,the type of biospecimen subjected to analysis,"Protein,metabolite,Lipid,Other,Unknown,Not collected,Not applicable,Not Specified",,,False,dataProperty,,http://purl.obolibrary.org/obo/NCIT_C156434,
76,specifyMSAnalyteType,"If ""other"" list the type of analyte ",,,,False,dataProperty,,Sage Bionetworks,
77,msInstrumentModel,The model of the mass spectrometer  used,"Possible values are listed under the instrument model term.OtherMsInstrumentModel,Unknown,Not collected,Not applicable,Not Specified",,,True,dataProperty,,"Sage Bionetworks,Proposed minimum metadata relative to mass spectrometry  ",
78,specifyMSInstrumentModel,"If ""other"" is selected list the name of the instrument model",,,,False,dataProperty,,Sage Bionetworks,
79,sampleIntroduction,"The sample introduction and delivery. From GC, from LC, direct infusion without chromatography, direct infusion using dedicated autosampler flow rate.","Other,Unknown,Not collected,Not applicable,Not Specified",,,True,dataProperty,,"Sage Bionetworks,Proposed minimum metadata relative to mass spectrometry  ",
80,specifySampleIntroduction,"If ""other"" list the name of the sample introduction",,,,False,dataProperty,,Sage Bionetworks,
81,extractionMethod,The name of the process used to separate a desired component of an input material from the remainder,"Unknown,Not collected,Not applicable,Not Specified",,,True,dataProperty,,http://purl.obolibrary.org/obo/OBI_0302884,
82,acquisitionMode,"The specific aspect of a mass spectrometer method by which mass ranges are selected and possibly dissociated (full scan, MSn, SIM, MRM, etc.).","Unknown,Not collected,Not applicable,Not Specified",,,True,dataProperty,,https://www.ebi.ac.uk/ols/ontologies/ms/termsiri=http%3A%2F%2Fpurl.obolibrary.org%2Fobo%2FMS_1003213,
83,acquisitionSoftware,The name of the acquisition software used,"Unknown,Not collected,Not applicable,Not Specified",,,True,dataProperty,,http://purl.obolibrary.org/obo/MS_1001455,
84,acquistionSoftwareVersion,The version number of software used,,,,True,dataProperty,,Sage Bionetworks,regex search ([0-9]+\.[0-9]*.)|([0-9]+)
85,samplePrepProtocol,An internet address that may provide more details of the protocol information (web link),,,,False,dataProperty,,Sage Bionetworks,
86,databaseName,"The name of the search database (nr, SwissProt or est_human, and/or mass spectral library).","MassBank of North America (MoNA),NIST17,Metlin,HMDB,OtherDatabaseName,Unknown,Not collected,Not applicable,Not Specified",,,True,dataProperty,,http://purl.obolibrary.org/obo/MS_1001013,
87,specifyDatabaseName,"If ""other"" list the name of the search database",,,,False,dataProperty,,Sage Bionetworks,
88,databaseSource,"The name of the organization, project, or laboratory from where the database is obtained (UniProt, NCBI, EBI, other).","OtherDatabaseSource,Unknown,Not collected,Not applicable,Not Specified",,,False,dataProperty,,http://purl.obolibrary.org/obo/MS_1001012,
89,specifyDatabaseSource,"If ""other"" list the name of the database source",,,,False,dataProperty,,Sage Bionetworks,
90,databaseWeblink,"An internet address that may provide details of a database or software search, as well as for labs who generate their own search method",,,,False,dataProperty,,"Sage Bionetworks,DSLWG",
91,spectrometerFrequency,The frequency at which a spectrometer causes hydrogen atoms to resonate (in MHz),,,,True,dataProperty,,Sage Bionetworks,regex search ([0-9]+\.[0-9]*.)|([0-9]+)
92,hasIonizationSource,Were the ionization conditions recorded to enable reproduction of the experiment,"YesHasIonizationSource,No",,,True,dataProperty,,"Sage Bionetworks,Proposed minimum metadata relative to mass spectrometry ",
93,ionProperty,Ion charge state (positive or negative-ion analysis),"Positive,Negative",,,False,dataProperty,,"Sage Bionetworks,Proposed minimum metadata relative to mass spectrometry ",
94,vacuumPressure,The recorded vacuum pressure value,,,,False,dataProperty,,"Sage Bionetworks,Proposed minimum metadata relative to mass spectrometry ",regex search ([0-9]+\.[0-9]*.)|([0-9]+)
95,vacuumPressureUnit,Unit of vacuum pressure value,"AFU,AI,AU/ml,DK units/ml,bpg/dl,g/l,gm,HAU,IU,iu/l,IU/ml,Kallikrein Inactivator Unit per Milliliter,kg,l,M,mg,mg/dl,mg/l,mg/ml,miu/ml,ml,mM,MOI,ng,ng/dl,ng/ml,ng/nl,ng/ul,nl,nM,Not Specified,NPX,optical density,PFU,PFUe,pg,pg/mg creatinine,pg/ml,pg/nl,pg/ul,pl,pM,Pound,TCID50,ug,ug/dl,ug/l,ug/ml,ug/ul,uiu/ml,ul,uM,umol/l,units/ml,OtherVacuumPressureUnit",,,False,dataProperty,,"Sage Bionetworks,Proposed minimum metadata relative to mass spectrometry ",
96,specifyVacuumPressueUnits,"If ""other"" provide the unit of measure",,,,False,dataProperty,,Sage Bionetworks,
97,lensVoltages ,"The skimmer/focusing lens voltages e.g., capillary voltage, etc.",,,,False,dataProperty,,"Sage Bionetworks,Proposed minimum metadata relative to mass spectrometry ",regex search ([0-9]+\.[0-9]*.)|([0-9]+)
98,lensVoltagesUnit ,Unit of lens voltages,"AFU,AI,AU/ml,DK units/ml,bpg/dl,g/l,gm,HAU,IU,iu/l,IU/ml,Kallikrein Inactivator Unit per Milliliter,kg,l,M,mg,mg/dl,mg/l,mg/ml,miu/ml,ml,mM,MOI,ng,ng/dl,ng/ml,ng/nl,ng/ul,nl,nM,Not Specified,NPX,optical density,PFU,PFUe,pg,pg/mg creatinine,pg/ml,pg/nl,pg/ul,pl,pM,Pound,TCID50,ug,ug/dl,ug/l,ug/ml,ug/ul,uiu/ml,ul,uM,umol/l,units/ml,OtherLensVoltagesUnit",,,False,dataProperty,,"Sage Bionetworks,Proposed minimum metadata relative to mass spectrometry ",
99,specifyLensVoltageUnits,"If ""other"" provide the unit of measure",,,,False,dataProperty,,Sage Bionetworks,
100,gasFlowTemperature,"e.g., nebulization gas, cone gas, etc.",,,,False,dataProperty,,"Sage Bionetworks,Proposed minimum metadata relative to mass spectrometry ",regex search ([0-9]+\.[0-9]*.)|([0-9]+)
101,gasFlowTemperatureUnit,Unit of gas flow temperature,"C,F,K,Not Specified",,,False,dataProperty,,"Sage Bionetworks,Proposed minimum metadata relative to mass spectrometry ",
102,hasAssayControl,"Boolean flag indicating whether or not a specimen is a technical or assay control. Examples include study pools or reference pools, blanks, or internal standards.","YesHasAssayControl,No",,,True,dataProperty,,Sage Bionetworks,
103,controlType,Control samples suitable for normalization and batch correction,"GIS,GoldenWest,NIST SRM 1950,AIBL pool,Baker pool,water plus Baker ISTD,study pool,internal standards,Other,Unknown,Not collected,Not applicable,Not Specified",,,False,dataProperty,,https://doi.org/10.1101/2020.05.19.105197https://doi.org/10.1038/sdata.2017.140https://www-s.nist.gov/srmors/view_detail.cfmsrm=1950Sage BionetworksDSLWG,
104,specifyControlType,"If ""other"" specify the control type",,,,False,dataProperty,,Sage Bionetworks,
105,experiementalBatchSize,The number of samples ,,,,False,dataProperty,,Sage Bionetworks,regex search ([0-9]+\.[0-9]*.)|([0-9]+)
106,experiementalBatchSizeUnit,The unit of measurement for number of samples in a experimental batch,"AFU,AI,AU/ml,DK units/ml,bpg/dl,g/l,gm,HAU,IU,iu/l,IU/ml,Kallikrein Inactivator Unit per Milliliter,kg,l,M,mg,mg/dl,mg/l,mg/ml,miu/ml,ml,mM,MOI,ng,ng/dl,ng/ml,ng/nl,ng/ul,nl,nM,Not Specified,NPX,optical density,PFU,PFUe,pg,pg/mg creatinine,pg/ml,pg/nl,pg/ul,pl,pM,Pound,TCID50,ug,ug/dl,ug/l,ug/ml,ug/ul,uiu/ml,ul,uM,umol/l,units/ml,OtherExperiementalBatchSizeUnit",,,False,dataProperty,,Sage Bionetworks,
107,specifyExperimentalBatchSizeUnits,"If ""other"" list units of measure",,,,False,dataProperty,,,
108,batchSize,The number of samples,,,,False,dataProperty,,Sage Bionetworks,regex search ([0-9]+\.[0-9]*.)|([0-9]+)
