,Attribute,Description,Valid Values,DependsOn,Properties,Required,Parent,DependsOn Component,Source,Validation Rules
0,specimenID,"Identifying string linked to a particular sample or specimen, provide by the data contributor",,,dataProperty,True,bsSeq (bisulfite-seq WGBS methylseq methylomics),,Sage Bionetworks,regex search str
1,sampleType,The type of sample collected,"Amniotic Fluid,Appendix,B cell,Basophils,Bone,Bone Marrow,Brachial lymph node,brain,Breast Milk,Bronchoalveolar Lavage Fluid,Carbohydrate,Cell culture supernatant,cell line,Cerebrospinal Fluid,Cervical lymph nodes,Colon,Colonic Lamina Propria,Convalescent Plasma,Cord blood,Dendritic cell,Dermis,DNA,Dried Blood Spot,Endotracheal aspirate,Epithelium,Feces,Fibroblast,Gastric lamina propria,Ileum,Inguinal lymph node,Jejunum,Kidney,Leukocytes,Lipid,Liver,Lung,Lung lymph node,Lymph node,Lymphocyte,Macrophage,Mesenteric lymph node,Monocyte,Mouse Ear,Nasal lavage fluid,Nasal Swab,Nasal Swab or Nose Specimen,Nasopharyngeal Swab Specimen,Negative Control,Neutrophil,NK cell,Not Specified,Optic Nerve,Organoids,Oropharyngeal Swab Specimen,Osteoblasts,OtherSampleType,Pancreas,Pancreatic Stellate Cells,PBL,PBMC,Placenta,Plasma,Pooled Sample,Popliteal lymph node,Positive Control,Protein,Rectal Swab Specimen,Red Blood Cell,Saliva,Salivary Glands,Serum,Skin of body,Small intestine,Spleen,Sputum,Stomach,Synovial fluid,Synovial tissue,T cell,Thymus,Tonsil,Trachea,Tumor Tissue,Umbilical cord blood,Urinary bladder,Urine,Vagina,Whole blood",,dataProperty,True,bsSeq (bisulfite-seq WGBS methylseq methylomics),,"Sage Bionetworks,ImmPort",regex search str
2,specifySampleType,"If ""other"" is selected list the type of sample",,,dataProperty,False,bsSeq (bisulfite-seq WGBS methylseq methylomics),,Sage Bionetworks,regex search str
3,measurementTechnique,The measurement technique describing the assay method,"16S rRNA gene sequencing,1D Gel,2D Gel,Array,B cell receptor repertoire sequencing assay,Cell Culture,Circular Dichroism,CyTOF,Cytometric Bead Array Assay,DNA methylation profiling assay,DNA microarray,ELISA,ELISPOT,EMSA,Exome Sequencing,Flow Cytometry,Fluorescent Antibody Procedure,Hemagglutination Inhibition,HLA Typing,HPLC,Immunoblot,Immunoprecipitation,in situ Hybridization,KIR Typing,Line Probe Assay,Liquid Chromatography,Luminex xMAP,Mass Spectrometry,Meso Scale Discovery ECL,microRNA profiling assay,Microscopy,Mixed Lymphocyte Reaction,Molecular Cloning,Nanostring,Neutralizing Antibody Titer Assay,NMR,Northern Blot,O link,OtherMeasurementTechnique,PCR,phage display binding assay,Protein microarray,Q-PCR,Real time polymerase chain reaction assay,RNA sequencing,Rnase Protection Assay,Sequencing,SNP microarray,SOMAscan,Southern Blot,Surface Plasmon Resonance,T cell receptor repertoire sequencing assay,TCID50,Transcription profiling assay,Transcription profiling by array,Virus Neutralization,Western Blot,Yeast Two Hybrid",,dataProperty,True,bsSeq (bisulfite-seq WGBS methylseq methylomics),,Sage Bionetworks,regex search str
4,specifyMeasurementTechnique,"If ""other"" is selected list the name of the measurement technique used",,,dataProperty,False,bsSeq (bisulfite-seq WGBS methylseq methylomics),,Sage Bionetworks,regex search str
5,technologyPlatformVersion,"The specific version (application, manufacturer, model, lab, etc.) of a technology that is used to carry out a laboratory or computational experiment.","10x Visium Spatial Gene Expression,Affymetrix Genome-Wide Human SNP 5.0 Array,Affymetrix Genome-Wide Human SNP 6.0 Array,Affymetrix Human Gene 1.0 ST Array,Affymetrix Human Genome U133 Plus 2.0 Array,Affymetrix U133AB,Agilent 44Karray,BGISEQ-500,Bionano Irys,Cherry Imaging FACE Platform,Cherry Imaging TRACE Platform,Chromium X,EnVision 2103 Multiplate Reader,Illumina 1M,Illumina Genome Analyzer IIx,Illumina h650,Illumina HiSeq 2000,Illumina HiSeq 2500,Illumina HiSeq 3000,Illumina HiSeq 4000,Illumina HiSeq X,Illumina Human660W-Quad v1.0 BeadChip,Illumina HumanHap300,Illumina HumanMethylation450,Illumina HumanOmni1-Quadv1.0,Illumina HumanOmniExpress-24 v1.0 BeadChip,Illumina HumanOmniExpress-24 v1.2 BeadChip,Illumina Infinium MethylationEPIC BeadChip v1.0 (850k),Illumina Infinium MethylationEPIC BeadChip v2.0 (935k)Illumina MiSeq,Illumina MouseWG-6 v2.0 expression BeadChip,Illumina NextSeq 1000,Illumina NextSeq 2000,Illumina NextSeq 500,Illumina NextSeq 550,Illumina NovaSeq 6000,Illumina Omni2pt5M,Illumina Omni5M,Illumina WholeGenome DASL,Infinium HumanOmniExpressExome,LI-COR Odyssey CLx,LifeViz Infinity System,LifeViz Micro System,LTQ Orbitrap XL,Nanostring Counter,Nanostring GeoMx,Olympus DP80,Orbitrap Fusion Lumos Tribrid,PacBio RS II,PacBio Sequel II System,PacBio Sequel IIe System,Perlegen 300Karray,Promega GloMax Discover,Q Exative HF,scale,Spectramax M Series,Vectra H1 3D Imaging System,Vevo 3100 Imaging System,Zeiss LSM 980,OtherTechnologyPlatformVersion,Unknown,Not collected,Not applicable,Not Specified",,dataProperty,True,bsSeq (bisulfite-seq WGBS methylseq methylomics),,Sage Bionetworks,regex search str
6,specifyPlatformVersion,"If ""other"" list the name of the platform version",,,dataProperty,False,bsSeq (bisulfite-seq WGBS methylseq methylomics),,Sage Bionetworks,regex search str
7,platformLocation,"The name of the laboratory, facility, vendor, company, or location where the data generation platform was located, provided by the data contributor","OtherPlatformLocation,Unknown,Not collected,Not applicable,Not Specified",,dataProperty,True,bsSeq (bisulfite-seq WGBS methylseq methylomics),,Sage Bionetworks,regex search str
8,specifyPlatformLocation,"If ""other"" list the name of the platform location",,,dataProperty,False,bsSeq (bisulfite-seq WGBS methylseq methylomics),,Sage Bionetworks,regex search str
9,referenceTranscriptID,The ID for the transcript/gene. Either the NCBI ID or the Ensembl ID must be provided,"Unknown,Not collected,Not applicable,Not Specified",,dataProperty,True,bsSeq (bisulfite-seq WGBS methylseq methylomics),,Sage Bionetworks,regex search str
10,dnaBatchID,DNA isolation batch,"Other,Unknown,Not collected,Not applicable",,dataProperty,True,bsSeq (bisulfite-seq WGBS methylseq methylomics),,Sage Bionetworks,regex search str
11,dnaBatchSize,The number of samples,,,dataProperty,True,bsSeq (bisulfite-seq WGBS methylseq methylomics),,Sage Bionetworks,regex search ([0-9]+\.[0-9]*.)|([0-9]+)
12,dnaBatchSizeUnit,The unit of measurement for number of samples in a batch,"AFU,AI,AU/ml,DK units/ml,bpg/dl,g/l,gm,HAU,IU,iu/l,IU/ml,Kallikrein Inactivator Unit per Milliliter,kg,l,M,mg,mg/dl,mg/l,mg/ml,miu/ml,ml,mM,MOI,ng,ng/dl,ng/ml,ng/nl,ng/ul,nl,nM,Not Specified,NPX,optical density,PFU,PFUe,pg,pg/mg creatinine,pg/ml,pg/nl,pg/ul,pl,pM,Pound,TCID50,ug,ug/dl,ug/l,ug/ml,ug/ul,uiu/ml,ul,uM,umol/l,units/ml,OtherDnaBatchSizeUnit",,dataProperty,True,bsSeq (bisulfite-seq WGBS methylseq methylomics),,Sage Bionetworks,regex search str
13,specifyDNABatchSizeUnit,"If ""other"" list unit of measure",,,dataProperty,False,bsSeq (bisulfite-seq WGBS methylseq methylomics),,Sage Bionetworks,regex search str
14,libraryBatchID,"Library batch identifier, provided by the data contributor to Sage Bionetworks. The batch identifier(s) must be stored in a data dictionary .csv file uploaded to Synapse",,,dataProperty,True,bsSeq (bisulfite-seq WGBS methylseq methylomics),,Sage Bionetworks,regex search str
15,libraryPrep,The general strategy by which the library was prepared,"amplicon,cellHashing,Chromium Single Cell 3',DNALibraryConstruction,EndItDNAEndRepairKit,KapaHyperPrep,lncRNAenrichment,methylSeq,miRNAenrichment,multiome,MULTIseq,PCRfree,polyAselection,proximity ligation,rRNAdepletion,SPLITseq,STARRSeq,SureCell,totalRNA,OtherLibraryPrep,Unknown,Not collected,Not applicable,Not Specified",,dataProperty,True,bsSeq (bisulfite-seq WGBS methylseq methylomics),,Sage Bionetworks,regex search str
16,specifyLibraryPrep,"If ""other"" list the name of the general strategy used to prepare the library",,,dataProperty,False,bsSeq (bisulfite-seq WGBS methylseq methylomics),,Sage Bionetworks,regex search str
17,libraryPreparationMethod,Method by which library was prepared,"10x,Accel-NGS 2S Plus,Accel-NGS Methyl-Seq,CEL-seq,Drop-Seq,NEBNext,NexteraXT,Omni-ATAC,sac-seq,Smart-seq1,Smart-seq2,Smart-seq4,SMRTbell,TruSeq,Ultralow Methyl-Seq,OtherLibraryPreparationMethod,Unknown,Not collected,Not applicable,Not Specified",,dataProperty,True,bsSeq (bisulfite-seq WGBS methylseq methylomics),,Sage Bionetworks,regex search str
18,specifyLibraryPreparationMethod,"If ""other"" list the name of the library preparation methods",,,dataProperty,False,bsSeq (bisulfite-seq WGBS methylseq methylomics),,Sage Bionetworks,regex search str
19,libraryVersion,"Library Version: for example, rnaSeq 10x library version","OtherLibraryVersion,Unknown,Not collected,Not applicable,Not Specified",,dataProperty,True,bsSeq (bisulfite-seq WGBS methylseq methylomics),,Sage Bionetworks,regex search str
20,specifyLibraryVersion,"If ""other"" list the name of the library version",,,dataProperty,False,bsSeq (bisulfite-seq WGBS methylseq methylomics),,Sage Bionetworks,regex search str
21,sequencingBatchID,"Sequencing batch identifier, provided by the data contributor to Sage Bionetworks. The batch identifier(s) must be stored in a data dictionary .csv file uploaded to Synapse","Unknown,Not collected,Not applicable,Not Specified",,dataProperty,True,bsSeq (bisulfite-seq WGBS methylseq methylomics),,Sage Bionetworks,regex search str
22,sequencingBatchSize,The number of samples,,,dataProperty,True,bsSeq (bisulfite-seq WGBS methylseq methylomics),,Sage Bionetworks,regex search ([0-9]+\.[0-9]*.)|([0-9]+)
23,sequencingBatchSizeUnit,The unit of measurement for number of samples in a batch,"AFU,AI,AU/ml,DK units/ml,bpg/dl,g/l,gm,HAU,IU,iu/l,IU/ml,Kallikrein Inactivator Unit per Milliliter,kg,l,M,mg,mg/dl,mg/l,mg/ml,miu/ml,ml,mM,MOI,ng,ng/dl,ng/ml,ng/nl,ng/ul,nl,nM,Not Specified,NPX,optical density,PFU,PFUe,pg,pg/mg creatinine,pg/ml,pg/nl,pg/ul,pl,pM,Pound,TCID50,ug,ug/dl,ug/l,ug/ml,ug/ul,uiu/ml,ul,uM,umol/l,units/ml,OtherSequencingBatchSizeUnit",,dataProperty,True,bsSeq (bisulfite-seq WGBS methylseq methylomics),,Sage Bionetworks,regex search str
24,specifySequencingBatchSizeUnit,"If ""other"" list unit of measure",,,dataProperty,False,bsSeq (bisulfite-seq WGBS methylseq methylomics),,Sage Bionetworks,regex search str
25,isStranded,Whether or not the library is stranded.,"TRUE,FALSE",,dataProperty,True,bsSeq (bisulfite-seq WGBS methylseq methylomics),,Sage Bionetworks,
26,readStrandOrigin,The strand from which the read originates in a strand-specific protocol,"forward,reverse",,dataProperty,True,bsSeq (bisulfite-seq WGBS methylseq methylomics),,Sage Bionetworks,regex search str
27,readLength,The length of the read,,,dataProperty,True,bsSeq (bisulfite-seq WGBS methylseq methylomics),,Sage Bionetworks,regex search ([0-9]+\.[0-9]*.)|([0-9]+)
28,readLengthUnits,The units of measurement.,"AFU,AI,AU/ml,DK units/ml,bpg/dl,g/l,gm,HAU,IU,iu/l,IU/ml,Kallikrein Inactivator Unit per Milliliter,kg,l,M,mg,mg/dl,mg/l,mg/ml,miu/ml,ml,mM,MOI,ng,ng/dl,ng/ml,ng/nl,ng/ul,nl,nM,Not Specified,NPX,optical density,PFU,PFUe,pg,pg/mg creatinine,pg/ml,pg/nl,pg/ul,pl,pM,Pound,TCID50,ug,ug/dl,ug/l,ug/ml,ug/ul,uiu/ml,ul,uM,umol/l,units/ml,OtherReadLengthUnits",,dataProperty,True,bsSeq (bisulfite-seq WGBS methylseq methylomics),,Sage Bionetworks,regex search str
29,specifyReadLengthUnits,"If ""other"" provide the unit of measure",,,dataProperty,False,bsSeq (bisulfite-seq WGBS methylseq methylomics),,Sage Bionetworks,regex search str
30,runType,The type of run,"singleEnd,pairedEnd",,dataProperty,True,bsSeq (bisulfite-seq WGBS methylseq methylomics),,Sage Bionetworks,regex search str
31,totalReads,Total number of sequencing reads from a library.,,,dataProperty,True,bsSeq (bisulfite-seq WGBS methylseq methylomics),,Sage Bionetworks,regex search ([0-9]+\.[0-9]*.)|([0-9]+)
32,directionalBSseqLibrary,Indicates whether or not the bisulfiteSeq library is directional,"True,False,Unknown,Not collected,Not applicable",,dataProperty,True,bsSeq (bisulfite-seq WGBS methylseq methylomics),,Sage Bionetworks,regex search str
33,gDNAconc,gDNA Concentration in ng,,,dataProperty,True,bsSeq (bisulfite-seq WGBS methylseq methylomics),,Sage Bionetworks,regex search ([0-9]+\.[0-9]*.)|([0-9]+)
34,lambdaDNAconc,Lambda DNA spike-in concentration in ng,,,dataProperty,True,bsSeq (bisulfite-seq WGBS methylseq methylomics),,Sage Bionetworks,regex search ([0-9]+\.[0-9]*.)|([0-9]+)
35,pcrCycles,Number of PCR cycles to amplify transposased DNA fragments,,,dataProperty,True,bsSeq (bisulfite-seq WGBS methylseq methylomics),,Sage Bionetworks,regex search ([0-9]+\.[0-9]*.)|([0-9]+)
36,meanCoverage,Total number of bases covered by ATAC-seq reads/size of genome,,,dataProperty,True,bsSeq (bisulfite-seq WGBS methylseq methylomics),,Sage Bionetworks,regex search ([0-9]+\.[0-9]*.)|([0-9]+)
37,conversionRatio,The ratio or % detailing how well the bisulfite conversion worked,,,dataProperty,True,bsSeq (bisulfite-seq WGBS methylseq methylomics),,Sage Bionetworks,regex search str
38,conversionRatioUnits,The units of measurement.,"AFU,AI,AU/ml,DK units/ml,bpg/dl,g/l,gm,HAU,IU,iu/l,IU/ml,Kallikrein Inactivator Unit per Milliliter,kg,l,M,mg,mg/dl,mg/l,mg/ml,miu/ml,ml,mM,MOI,ng,ng/dl,ng/ml,ng/nl,ng/ul,nl,nM,Not Specified,NPX,optical density,PFU,PFUe,pg,pg/mg creatinine,pg/ml,pg/nl,pg/ul,pl,pM,Pound,TCID50,ug,ug/dl,ug/l,ug/ml,ug/ul,uiu/ml,ul,uM,umol/l,units/ml,OtherConversionRatioUnits",,dataProperty,True,bsSeq (bisulfite-seq WGBS methylseq methylomics),,Sage Bionetworks,regex search str
39,specifyConversionRatioUnit,"If ""other"" list unit of measure",,,dataProperty,False,bsSeq (bisulfite-seq WGBS methylseq methylomics),,Sage Bionetworks,regex search str
40,enrichmentMethod,The method used for performing an enrichment of specific regions by a restriction enzyme digest,"Other,Unknown,Not collected,Not applicable",,dataProperty,True,bsSeq (bisulfite-seq WGBS methylseq methylomics),,Sage Bionetworks,regex search str
41,specifyEnrichmentMethod,"If ""other"" list the method used for enrichment",,,dataProperty,False,bsSeq (bisulfite-seq WGBS methylseq methylomics),,Sage Bionetworks,regex search str
42,repositoryName,"The public repository name for the transcript (for example, Ensembl or NCBI Gene)","ArrayExpress,Broad Single Cell Portal,dbGAP,ENA,Ensembl,FlowRepository,GenBank,GEO,GISAID,IEDB,ImmPort,MassIVE,MetaboLights,Metabolomics Workbench,MGnify,NCBI Gene,PRIDE,SRA,UniProt,OtherRepositoryName,Unknown,Not collected,Not applicable,Not Specified",,dataProperty,True,RNAseq,,Sage Bionetworks,regex search str
43,specifyRepositoryName,"If ""other"" list the name of the repository",,,dataProperty,False,RNAseq,,Sage Bionetworks,regex search str
44,transcriptType,The type of transcript reported,"lincRNA,mRNA,snRNA,OtherTranscriptType,Unknown,Not collected,Not applicable,Not Specified",,dataProperty,True,RNAseq,,ImmPort,regex search str
45,specifyTranscriptType,"If ""other"" list the transcript type",,,dataProperty,False,RNAseq,,Sage Bionetworks,regex search str
46,resultUnit,The unit for the result value,"FPKM,RPKM,TPM,Not Specified",,dataProperty,True,RNAseq,,Sage Bionetworks,regex search str
47,valueReported,The count or gene count for the transcript,,,dataProperty,True,RNAseq,,Sage Bionetworks,regex search ([0-9]+\.[0-9]*.)|([0-9]+)
48,rnaBatchID,"RNA isolation batch identifier, provided by the data contributor to Sage Bionetworks. The batch identifier(s) must be stored in a data dictionary .csv file uploaded to Synapse","Unknown,Not collected,Not applicable,Not Specified",,dataProperty,True,scRNAseq,,Sage Bionetworks,regex search str
49,rnaBatchSize,The number of samples,,,dataProperty,False,scRNAseq,,Sage Bionetworks,regex search ([0-9]+\.[0-9]*.)|([0-9]+)
50,rnaBatchSizeUnit,The unit of measurement for number of samples in a batch,"AFU,AI,AU/ml,DK units/ml,bpg/dl,g/l,gm,HAU,IU,iu/l,IU/ml,Kallikrein Inactivator Unit per Milliliter,kg,l,M,mg,mg/dl,mg/l,mg/ml,miu/ml,ml,mM,MOI,ng,ng/dl,ng/ml,ng/nl,ng/ul,nl,nM,Not Specified,NPX,optical density,PFU,PFUe,pg,pg/mg creatinine,pg/ml,pg/nl,pg/ul,pl,pM,Pound,TCID50,ug,ug/dl,ug/l,ug/ml,ug/ul,uiu/ml,ul,uM,umol/l,units/ml,OtherRnaBatchSizeUnit",,dataProperty,True,scRNAseq,,Sage Bionetworks,regex search str
51,specifyRNABatchSizeUnit,"If ""other"" list unit of measure",,,dataProperty,False,scRNAseq,,Sage Bionetworks,regex search str
52,useReagent,Was a reagent applied to the sample,"YesUseReagent,No",,dataProperty,True,genotyping,,"Sage Bionetworks,ImmPort",
53,reagentID(s),"One or more identifiers, separated by a semicolon (;). The reagent identifier(s) must be stored in a data dictionary .csv file uploaded to Synapse",,,dataProperty,False,genotyping,,"Sage Bionetworks,ImmPort",regex search str
54,reagentName,The reagent name is an alternative to the Reagent ID,,,dataProperty,False,genotyping,,"Sage Bionetworks,ImmPort",regex search str
55,reagentManufacturer,"The manufacturer is the source of a reagent and may include commercial vendors as well as non-commercial sources (e.g., collaborating labs)",,,dataProperty,False,genotyping,,"Sage Bionetworks,ImmPort",regex search str
56,reagentCatalogNumber,"If the assay reagent is a commercial product, enter the vendor's catalog identifier. If the reagent is a custom preparation enter 'NA'. ",,,dataProperty,False,genotyping,,"Sage Bionetworks,ImmPort",regex search str
57,reagentLotNumber,The lot number is often provided by a reagent source when the reagent is replenished over time. ,,,dataProperty,False,genotyping,,"Sage Bionetworks,ImmPort",regex search str
58,reagentWeblink,An internet address that may provide details of an assay reagent.,,,dataProperty,False,genotyping,,"Sage Bionetworks,ImmPort",regex search str
59,reagentContact,The contact information is particularly helpful when the reagent is not from a commercial vendor.,,,dataProperty,False,genotyping,,"Sage Bionetworks,ImmPort",regex search str
60,useTreatment,Was a treatment applied to the sample,"YesUseTreatment,No",,dataProperty,True,genotyping,,"Sage Bionetworks,ImmPort",
61,treatmentID(s),"One or more identifiers, separated by a semicolon (;). The treatment identifier(s) must be stored in a data dictionary .csv file uploaded to Synapse",,,dataProperty,False,genotyping,,"Sage Bionetworks,ImmPort",regex search str
62,treatmentName,"Treatments refer to in vitro modifications of samples. Three treatment types are supported: agent amount, duration, and temperature.  Treatment name is an alternate identifier to the Treatment ID ",,,dataProperty,False,genotyping,,"Sage Bionetworks,ImmPort",regex search str
63,treatmentAmountValue,"The Amount Value indicates how much (concentration, mass, volume) of a treatment agent was applied to a sample.",,,dataProperty,False,genotyping,,"Sage Bionetworks,ImmPort",regex search str
64,treatmentAmountUnit,Unit of treatment amount,"AFU,AI,AU/ml,DK units/ml,g/dl,g/l,gm,HAU,IU,iu/l,IU/ml,Kallikrein Inactivator Unit per Milliliter,kg,l,M,mg,mg/dl,mg/l,mg/ml,miu/ml,ml,mM,MOI,ng,ng/dl,ng/ml,ng/nl,ng/ul,nl,nM,Not Specified,NPX,optical density,PFU,PFUe,pg,pg/mg creatinine,pg/ml,pg/nl,pg/ul,pl,pM,Pound,TCID50,ug,ug/dl,ug/l,ug/ml,ug/ul,uiu/ml,ul,uM,umol/l,units/ml",,dataProperty,False,genotyping,,"Sage Bionetworks,ImmPort",regex search ([0-9]+\.[0-9]*.)|([0-9]+)
65,treatmentDurationValue,Duration of treatment,,,dataProperty,False,genotyping,,,regex search ([0-9]+\.[0-9]*.)|([0-9]+)
66,treatmentDurationUnit,Unit of treatment duration,"d.p.c.,Days,Hours,Minutes,Months,Not Specified,Seconds,Weeks,Years",,dataProperty,False,genotyping,,"Sage Bionetworks,ImmPort",regex search str
67,treatmentTemperatureValue,Value of treatment temperature,,,dataProperty,False,genotyping,,"Sage Bionetworks,ImmPort",regex search ([0-9]+\.[0-9]*.)|([0-9]+)
68,treatmentTemperatureUnit,Unit of treatment temperature,"C,F,K,Not Specified",,dataProperty,False,genotyping,,"Sage Bionetworks,ImmPort",regex search str
69,msTarget,specifies whether or not a specific molecule(s) is/are targeted for detection/measurement by the assay,"TargetedMsTarget,UnTargetedMsTarget,Unknown,Not collected,Not applicable,Not Specified",,dataProperty,True,Metabolomics Human,,Sage Bionetworks,regex search str
70,msAnalyzerTypeMS1,"Describes the mass spectrometer analyzer used to read out parent ions (quadrupole, ion-trap, time-of-flight, FT-ICR, including combinations of these for hybrid instruments)","LTQ Orbitrap XL,Orbitrap Fusion,Orbitrap Fusion Lumos,Q Exactive,Q Exactive HF,Q Exactive HF-X,Q Exactive Plus,Exploris 240Exploris 480quadrupole time-of-flight,time-of-flight,triple quadrupole,Xevo G2 QTOF,Xevo TQ-S,Bruker Avance IIITimsTOF ProOtherMsAnalyzerTypeMS1,Unknown,Not collected,Not applicable,Not Specified",,dataProperty,True,Metabolomics Human,,"Sage Bionetworks,Proposed minimum metadata relative to mass spectrometry ",regex search str
71,specifyMSAnalyzerTypeMS1,"If ""other"" is selected list the name of the mass spectrometer analyzer used",,,dataProperty,False,Metabolomics Human,,Sage Bionetworks,regex search str
72,msAnalyzerTypeMS2,"Describes the mass spectrometer analyzer used to read out fragment ions(quadrupole, ion-trap, time-of-flight, FT-ICR, including combinations of these for hybrid instruments)","LTQ Orbitrap XL,Orbitrap Fusion,Orbitrap Fusion Lumos,Q Exactive,Q Exactive HF,Q Exactive HF-X,Q Exactive Plus,Exploris 240Exploris 480quadrupole time-of-flight,time-of-flight,triple quadrupole,Xevo G2 QTOF,Xevo TQ-S,Bruker Avance IIITimsTOF ProOtherMsAnalyzerTypeMS2,Unknown,Not collected,Not applicable,Not Specified",,dataProperty,True,Metabolomics Human,,"Sage Bionetworks,Proposed minimum metadata relative to mass spectrometry ",regex search str
73,specifyMSAnalyzerTypeMS2,"If ""other"" is selected list the name of the mass spectrometer analyzer used",,,dataProperty,False,Metabolomics Human,,Sage Bionetworks,regex search str
74,msAssayTechnique,Specified the mass spectrometer technique used,"DDA-MS,DIA-MS,FIA-MSMS,HPLC-MSMS,LC-MS,LC-MSMS,MDMS-SL,MIB-MS,UPLC-MSMS,UPLC-ESI-QTOF-MS,LC-SRMOtherMsAssayTechnique,Unknown,Not collected,Not applicable,Not Specified",,dataProperty,True,Metabolomics Human,,"Sage Bionetworks,DSLWG",regex search str
75,specifyMSAssayTechnique,"If ""other"" is selected list the name of the mass spectrometer technique used or the name of the proteomics assay used",,,dataProperty,False,Metabolomics Human,,Sage Bionetworks,regex search str
76,msAnalyteType,the type of biospecimen subjected to analysis,"Protein,metabolite,Lipid,Other,Unknown,Not collected,Not applicable,Not Specified",,dataProperty,False,Metabolomics Human,,http://purl.obolibrary.org/obo/NCIT_C156434,regex search str
77,specifyMSAnalyteType,"If ""other"" list the type of analyte ",,,dataProperty,False,Metabolomics Human,,Sage Bionetworks,regex search str
78,msInstrumentModel,The model of the mass spectrometer  used,"Possible values are listed under the instrument model term.OtherMsInstrumentModel,Unknown,Not collected,Not applicable,Not Specified",,dataProperty,True,Metabolomics Human,,"Sage Bionetworks,Proposed minimum metadata relative to mass spectrometry  ",regex search str
79,specifyMSInstrumentModel,"If ""other"" is selected list the name of the instrument model",,,dataProperty,False,Metabolomics Human,,Sage Bionetworks,regex search str
80,sampleIntroduction,"The sample introduction and delivery. From GC, from LC, direct infusion without chromatography, direct infusion using dedicated autosampler flow rate.","Other,Unknown,Not collected,Not applicable,Not Specified",,dataProperty,True,Metabolomics Human,,"Sage Bionetworks,Proposed minimum metadata relative to mass spectrometry  ",regex search str
81,specifySampleIntroduction,"If ""other"" list the name of the sample introduction",,,dataProperty,False,Metabolomics Human,,Sage Bionetworks,regex search str
82,extractionMethod,The name of the process used to separate a desired component of an input material from the remainder,"Unknown,Not collected,Not applicable,Not Specified",,dataProperty,True,Metabolomics Human,,http://purl.obolibrary.org/obo/OBI_0302884,regex search str
83,acquisitionMode,"The specific aspect of a mass spectrometer method by which mass ranges are selected and possibly dissociated (full scan, MSn, SIM, MRM, etc.).","Unknown,Not collected,Not applicable,Not Specified",,dataProperty,True,Metabolomics Human,,https://www.ebi.ac.uk/ols/ontologies/ms/termsiri=http%3A%2F%2Fpurl.obolibrary.org%2Fobo%2FMS_1003213,regex search str
84,acquisitionSoftware,The name of the acquisition software used,"Unknown,Not collected,Not applicable,Not Specified",,dataProperty,True,Metabolomics Human,,http://purl.obolibrary.org/obo/MS_1001455,regex search str
85,acquistionSoftwareVersion,The version number of software used,,,dataProperty,True,Metabolomics Human,,Sage Bionetworks,regex search ([0-9]+\.[0-9]*.)|([0-9]+)
86,samplePrepProtocol,An internet address that may provide more details of the protocol information (web link),,,dataProperty,False,Metabolomics Human,,Sage Bionetworks,regex search str
87,databaseName,"The name of the search database (nr, SwissProt or est_human, and/or mass spectral library).","MassBank of North America (MoNA),NIST17,Metlin,HMDB,OtherDatabaseName,Unknown,Not collected,Not applicable,Not Specified",,dataProperty,True,Metabolomics Human,,http://purl.obolibrary.org/obo/MS_1001013,regex search str
88,specifyDatabaseName,"If ""other"" list the name of the search database",,,dataProperty,False,Metabolomics Human,,Sage Bionetworks,regex search str
89,databaseSource,"The name of the organization, project, or laboratory from where the database is obtained (UniProt, NCBI, EBI, other).","OtherDatabaseSource,Unknown,Not collected,Not applicable,Not Specified",,dataProperty,False,Metabolomics Human,,http://purl.obolibrary.org/obo/MS_1001012,regex search str
