,Attribute,Description,Valid Values,DependsOn,Properties,Required,Parent,DependsOn Component,Source,Validation Rules
90,specifyDatabaseSource,"If ""other"" list the name of the database source",,,dataProperty,False,Metabolomics Human,,Sage Bionetworks,regex search str
91,databaseWeblink,"An internet address that may provide details of a database or software search, as well as for labs who generate their own search method",,,dataProperty,False,Metabolomics Human,,"Sage Bionetworks,DSLWG",regex search str
92,spectrometerFrequency,The frequency at which a spectrometer causes hydrogen atoms to resonate (in MHz),,,dataProperty,True,Metabolomics Human,,Sage Bionetworks,regex search ([0-9]+\.[0-9]*.)|([0-9]+)
93,hasIonizationSource,Were the ionization conditions recorded to enable reproduction of the experiment,"YesHasIonizationSource,No",,dataProperty,True,Metabolomics Human,,"Sage Bionetworks,Proposed minimum metadata relative to mass spectrometry ",
94,ionProperty,Ion charge state (positive or negative-ion analysis),"Positive,Negative",,dataProperty,False,Metabolomics Human,,"Sage Bionetworks,Proposed minimum metadata relative to mass spectrometry ",regex search str
95,vacuumPressure,The recorded vacuum pressure value,,,dataProperty,False,Metabolomics Human,,"Sage Bionetworks,Proposed minimum metadata relative to mass spectrometry ",regex search ([0-9]+\.[0-9]*.)|([0-9]+)
96,vacuumPressureUnit,Unit of vacuum pressure value,"AFU,AI,AU/ml,DK units/ml,bpg/dl,g/l,gm,HAU,IU,iu/l,IU/ml,Kallikrein Inactivator Unit per Milliliter,kg,l,M,mg,mg/dl,mg/l,mg/ml,miu/ml,ml,mM,MOI,ng,ng/dl,ng/ml,ng/nl,ng/ul,nl,nM,Not Specified,NPX,optical density,PFU,PFUe,pg,pg/mg creatinine,pg/ml,pg/nl,pg/ul,pl,pM,Pound,TCID50,ug,ug/dl,ug/l,ug/ml,ug/ul,uiu/ml,ul,uM,umol/l,units/ml,OtherVacuumPressureUnit",,dataProperty,False,Metabolomics Human,,"Sage Bionetworks,Proposed minimum metadata relative to mass spectrometry ",regex search str
97,specifyVacuumPressueUnits,"If ""other"" provide the unit of measure",,,dataProperty,False,Metabolomics Human,,Sage Bionetworks,regex search str
98,lensVoltages ,"The skimmer/focusing lens voltages e.g., capillary voltage, etc.",,,dataProperty,False,Metabolomics Human,,"Sage Bionetworks,Proposed minimum metadata relative to mass spectrometry ",regex search ([0-9]+\.[0-9]*.)|([0-9]+)
99,lensVoltagesUnit ,Unit of lens voltages,"AFU,AI,AU/ml,DK units/ml,bpg/dl,g/l,gm,HAU,IU,iu/l,IU/ml,Kallikrein Inactivator Unit per Milliliter,kg,l,M,mg,mg/dl,mg/l,mg/ml,miu/ml,ml,mM,MOI,ng,ng/dl,ng/ml,ng/nl,ng/ul,nl,nM,Not Specified,NPX,optical density,PFU,PFUe,pg,pg/mg creatinine,pg/ml,pg/nl,pg/ul,pl,pM,Pound,TCID50,ug,ug/dl,ug/l,ug/ml,ug/ul,uiu/ml,ul,uM,umol/l,units/ml,OtherLensVoltagesUnit",,dataProperty,False,Metabolomics Human,,"Sage Bionetworks,Proposed minimum metadata relative to mass spectrometry ",regex search str
100,specifyLensVoltageUnits,"If ""other"" provide the unit of measure",,,dataProperty,False,Metabolomics Human,,Sage Bionetworks,regex search str
101,gasFlowTemperature,"e.g., nebulization gas, cone gas, etc.",,,dataProperty,False,Metabolomics Human,,"Sage Bionetworks,Proposed minimum metadata relative to mass spectrometry ",regex search ([0-9]+\.[0-9]*.)|([0-9]+)
102,gasFlowTemperatureUnit,Unit of gas flow temperature,"C,F,K,Not Specified",,dataProperty,False,Metabolomics Human,,"Sage Bionetworks,Proposed minimum metadata relative to mass spectrometry ",regex search str
103,hasAssayControl,"Boolean flag indicating whether or not a specimen is a technical or assay control. Examples include study pools or reference pools, blanks, or internal standards.","YesHasAssayControl,No",,dataProperty,True,Metabolomics Human,,Sage Bionetworks,
104,controlType,Control samples suitable for normalization and batch correction,"GIS,GoldenWest,NIST SRM 1950,AIBL pool,Baker pool,water plus Baker ISTD,study pool,internal standards,Other,Unknown,Not collected,Not applicable,Not Specified",,dataProperty,False,Metabolomics Human,,https://doi.org/10.1101/2020.05.19.105197https://doi.org/10.1038/sdata.2017.140https://www-s.nist.gov/srmors/view_detail.cfmsrm=1950Sage BionetworksDSLWG,regex search str
105,specifyControlType,"If ""other"" specify the control type",,,dataProperty,False,Metabolomics Human,,Sage Bionetworks,regex search str
106,experiementalBatchSize,The number of samples ,,,dataProperty,False,Metabolomics Human,,Sage Bionetworks,regex search ([0-9]+\.[0-9]*.)|([0-9]+)
107,experiementalBatchSizeUnit,The unit of measurement for number of samples in a experimental batch,"AFU,AI,AU/ml,DK units/ml,bpg/dl,g/l,gm,HAU,IU,iu/l,IU/ml,Kallikrein Inactivator Unit per Milliliter,kg,l,M,mg,mg/dl,mg/l,mg/ml,miu/ml,ml,mM,MOI,ng,ng/dl,ng/ml,ng/nl,ng/ul,nl,nM,Not Specified,NPX,optical density,PFU,PFUe,pg,pg/mg creatinine,pg/ml,pg/nl,pg/ul,pl,pM,Pound,TCID50,ug,ug/dl,ug/l,ug/ml,ug/ul,uiu/ml,ul,uM,umol/l,units/ml,OtherExperiementalBatchSizeUnit",,dataProperty,False,Metabolomics Human,,Sage Bionetworks,regex search str
108,specifyExperimentalBatchSizeUnits,"If ""other"" list units of measure",,,dataProperty,False,Metabolomics Human,,,
109,batchSize,The number of samples,,,dataProperty,False,Metabolomics Human,,Sage Bionetworks,regex search ([0-9]+\.[0-9]*.)|([0-9]+)
110,batchSizeUnit,The unit of measurement for number of samples in a batch,"AFU,AI,AU/ml,DK units/ml,bpg/dl,g/l,gm,HAU,IU,iu/l,IU/ml,Kallikrein Inactivator Unit per Milliliter,kg,l,M,mg,mg/dl,mg/l,mg/ml,miu/ml,ml,mM,MOI,ng,ng/dl,ng/ml,ng/nl,ng/ul,nl,nM,Not Specified,NPX,optical density,PFU,PFUe,pg,pg/mg creatinine,pg/ml,pg/nl,pg/ul,pl,pM,Pound,TCID50,ug,ug/dl,ug/l,ug/ml,ug/ul,uiu/ml,ul,uM,umol/l,units/ml,OtherBatchSizeUnit",,dataProperty,False,Metabolomics Human,,Sage Bionetworks,regex search str
111,specifyBatchSizeUnits,"If ""other"" list the unit of measure",,,dataProperty,False,Metabolomics Human,,Sage Bionetworks,regex search str
112,batchID,"ID used to identify a batch, provided by the data contributor to Sage Bionetworks. The batch identifier(s) must be stored in a data dictionary .csv file uploaded to Synapse",,,dataProperty,False,Metabolomics Human,,Sage Bionetworks,regex search str
113,batchLabel,Used to supply batch label information with any string value,,,dataProperty,False,Metabolomics Human,,http://purl.obolibrary.org/obo/MS_4000088,regex search str
114,sampleBatchID,"Sample batch lot identifier, provided by the data contributor to Sage Bionetworks. The batch identifier(s) must be stored in a data dictionary .csv file uploaded to Synapse",,,dataProperty,False,Metabolomics Human,,http://purl.obolibrary.org/obo/MS_1000053,regex search str
115,sampleBatchSize,The number of samples,,,dataProperty,False,Metabolomics Human,,Sage Bionetworks,regex search str
116,sampleBatchSizeUnit,The unit of measurement for number of samples in a batch,"AFU,AI,AU/ml,DK units/ml,bpg/dl,g/l,gm,HAU,IU,iu/l,IU/ml,Kallikrein Inactivator Unit per Milliliter,kg,l,M,mg,mg/dl,mg/l,mg/ml,miu/ml,ml,mM,MOI,ng,ng/dl,ng/ml,ng/nl,ng/ul,nl,nM,Not Specified,NPX,optical density,PFU,PFUe,pg,pg/mg creatinine,pg/ml,pg/nl,pg/ul,pl,pM,Pound,TCID50,ug,ug/dl,ug/l,ug/ml,ug/ul,uiu/ml,ul,uM,umol/l,units/ml,OtherSampleBatchSizeUnit",,dataProperty,False,Metabolomics Human,,Sage Bionetworks,regex search str
117,specifySampleBatchSizeUnits,"If ""other"" list the unit of measure",,,dataProperty,False,Metabolomics Human,,Sage Bionetworks,regex search str
118,acquisitionBatchID,"Acquisition batch identifier, provided by the data contributor to Sage Bionetworks. The batch identifier(s) must be stored in a data dictionary .csv file uploaded to Synapse",,,dataProperty,False,Metabolomics Human,,Sage Bionetworks,regex search str
119,acquisitionBatchSize,The number of samples,,,dataProperty,False,Metabolomics Human,,Sage Bionetworks,regex search str
120,acquisitionBatchSizeUnit,The unit of measurement for number of samples in a batch,"AFU,AI,AU/ml,DK units/ml,bpg/dl,g/l,gm,HAU,IU,iu/l,IU/ml,Kallikrein Inactivator Unit per Milliliter,kg,l,M,mg,mg/dl,mg/l,mg/ml,miu/ml,ml,mM,MOI,ng,ng/dl,ng/ml,ng/nl,ng/ul,nl,nM,Not Specified,NPX,optical density,PFU,PFUe,pg,pg/mg creatinine,pg/ml,pg/nl,pg/ul,pl,pM,Pound,TCID50,ug,ug/dl,ug/l,ug/ml,ug/ul,uiu/ml,ul,uM,umol/l,units/ml,OtherAcquisitionBatchSizeUnit",,dataProperty,False,Metabolomics Human,,Sage Bionetworks,regex search str
121,specifyAcquisitionBatchSizeUnits,"If ""other"" list units of measure",,,dataProperty,False,Metabolomics Human,,,
122,processingBatchID,"Processing batch identifier, provided by the data contributor to Sage Bionetworks. The batch identifier(s) must be stored in a data dictionary .csv file uploaded to Synapse",,,dataProperty,False,Metabolomics Human,,Sage Bionetworks,regex search str
123,processingBatchSize,The number of samples,,,dataProperty,False,Metabolomics Human,,Sage Bionetworks,regex search str
124,processingBatchSizeUnit,The unit of measurement for number of samples in a batch,"AFU,AI,AU/ml,DK units/ml,bpg/dl,g/l,gm,HAU,IU,iu/l,IU/ml,Kallikrein Inactivator Unit per Milliliter,kg,l,M,mg,mg/dl,mg/l,mg/ml,miu/ml,ml,mM,MOI,ng,ng/dl,ng/ml,ng/nl,ng/ul,nl,nM,Not Specified,NPX,optical density,PFU,PFUe,pg,pg/mg creatinine,pg/ml,pg/nl,pg/ul,pl,pM,Pound,TCID50,ug,ug/dl,ug/l,ug/ml,ug/ul,uiu/ml,ul,uM,umol/l,units/ml,OtherProcessingBatchSizeUnit",,dataProperty,False,Metabolomics Human,,Sage Bionetworks,regex search str
125,specifyProcessingBatchSizeUnit,"If ""other"" list units of measure",,,dataProperty,False,Metabolomics Human,,Sage Bionetworks,regex search str
126,f,"The data file provides the name of the raw file generated by the instrument. The data files can be instrument raw files but also converted peak lists such as mzML, MGF or result files like mzIdentML.","Unknown,Not collected,Not applicable,Not Specified",,dataProperty,True,Metabolomics Human,,Proteomics Sample Metadata,regex search str
127,specifyExtractionMethod,"If ""other"" list the name of the extraction method",,,dataProperty,False,Microbiome,,Sage Bionetworks,regex search str
128,protoemicsAssayType,Type of peptide quantification used (ex. Label Free),"Label Free,TMT,ITRAQ,SILAC,Targeted Absolute Quantitation,Other,Unknown,Not collected,Not applicable",,dataProperty,True,proteomics,,"Sage Bionetworks,DSLWG,https://www.ebi.ac.uk/ols/ontologies/pride/termsiri=http%3A%2F%2Fpurl.obolibrary.org%2Fobo%2FPRIDE_0000514&viewMode=All&siblings=false",regex search str
129,specifyProteomicsAssayType,"If ""other"" is selected list the name of the type of peptide quantification used",,,dataProperty,False,proteomics,,Sage Bionetworks,regex search str
130,digestionMethod,"The type of digestion - in-solution, in-gel, etc. (ex. ""in-gel digestion"")","in-solution,in-gel,OtherDigestionMethod,Unknown,Not collected,Not applicable,",,dataProperty,True,proteomics,,"Sage Bionetworks,DSLWG",regex search str
131,specifyDigestionMethod,"If ""other"" list the type of digestion",,,dataProperty,False,proteomics,,Sage Bionetworks,regex search str
132,fractionIdentifier,"Identifier string that describes the sample fraction. This identifier should contain the fraction number(s) or similar information. (It MUST start from 1; if the experiment is not fractionated, 1 MUST be used for each MSRun (assay).",,,dataProperty,True,proteomics,,"Sage Bionetworks,The Proteomics Sample Metadata Project,MS Ontology",regex search ([0-9]+\.[0-9]*.)|([0-9]+)
133,modificationParameters,Modification parameters for the search engine run. [ PSI: PI http://www.w3.org/2002/07/owl#Axiom ],"Possible values are listed under modification parameters,OtherModificationParameters,Unknown,Not collected,Not applicable,Not Specified",,dataProperty,True,proteomics,,https://www.ebi.ac.uk/ols/ontologies/ms/termsiri=http%3A%2F%2Fpurl.obolibrary.org%2Fobo%2FMS_1001055,regex search str
134,specifyOtherModificationParameters,"If ""other"" is selected, list the custom modification name. We recommend using an intuitive name",,,dataProperty,False,proteomics,,Sage Bionetworks,regex search str
135,cleavageAgents,Name(s) of the enzyme used,"Possible values are listed under the cleavage agent nameOtherCleavageAgents,Unknown,Not collected,Not applicable,Not Specified",,dataProperty,True,proteomics,,Proteomics Sample Metadata,regex search str
136,specifyOtherCleavageAgent,"If ""other"" is selected, list the enzyme name. ",,,dataProperty,False,proteomics,,Sage Bionetworks,regex search str
137,fragmentMassTolerance,"Units of measure are Da or ppm (ex. ""0.6 Da"" or ""20 ppm"")",,,dataProperty,True,proteomics,,Proteomics Sample Metadata,regex search str
138,precursorMassTolerance,"Units of measure are Da or ppm (ex. ""0.6 Da"" or ""20 ppm"")",,,dataProperty,True,proteomics,,Proteomics Sample Metadata,regex search str
139,dataFile,"The data file provides the name of the raw file generated by the instrument. The data files can be instrument raw files but also converted peak lists such as mzML, MGF or result files like mzIdentML.","Unknown,Not collected,Not applicable,Not Specified",,dataProperty,True,proteomics,,Proteomics Sample Metadata,regex search str
140,individualID,"Identifying string linked to the individual or animal being studied, provided by the data contributor",,,dataProperty,True,Biospecimen human,,Sage Bionetworks,regex search str
141,specimenType,Type of biological material comprising the Specimen,"blood,Plasma,Urine,Saliva,stool,Serum,tissue,swabs,Sputum,Cerebrospinal Fluid (CSF),organoid,Other,Unknown,Not collected,Not applicable",,dataProperty,True,Biospecimen human,,"Sage Bionetworks,http://purl.obolibrary.org/obo/NCIT_C70713",regex search str
142,specimenAge,The subject's age at the time of specimen extraction is the individual's age (since birth) at the time a given specimen was extracted. Measured as age in years.,"Other,Unknown,Not collected,Not applicable",,dataProperty,True,Biospecimen human,,Sage Bionetworks,regex search str
143,samplingAge,"The calculated age of the sample, measurement is determined or coded by the data contributor. ","Other,Unknown,Not collected,Not applicable",,dataProperty,True,Biospecimen human,,Sage Bionetworks,regex search str
144,organ,Indicate the organ the specimen is from,"NCI values (not listed for purposes of this RFC),Other,Unknown,Not collected,Not applicable",,dataProperty,True,Biospecimen human,,http://purl.obolibrary.org/obo/NCIT_C13018,regex search str
145,tissue,Indicate the tissue the specimen is from,"NCI values (not listed for purposes of this RFC),Other,Unknown,Not collected,Not applicable",,dataProperty,True,Biospecimen human,,http://purl.obolibrary.org/obo/NCIT_C12801,regex search str
146,tissueVolume,The volume of the tissue sample. Measured in microliters.,"Unknown,Not collected,Not applicable",,dataProperty,True,Biospecimen human,,Sage Bionetworks,regex search str
147,tissueWeight,The mass of the tissue specimen. Measured in mg.,"Unknown,Not collected,Not applicable",,dataProperty,True,Biospecimen human,,Sage Bionetworks,regex search str
148,specimenSource,Indicate the biological area of the specimen,"Human Reference Atlas values (not listed for purposes of this RFC),Other,Unknown,Not collected,Not applicable",,dataProperty,True,Biospecimen human,,https://www.ebi.ac.uk/ols/ontologies/ccf/termsiri=http%3A%2F%2Fpurl.obolibrary.org%2Fobo%2FUBERON_0004537&lang=en&viewMode=PreferredRoots&siblings=false,regex search str
149,nucleicAcidSource,"Specifies the type of nucleic acid (DNA, RNA, Pooled, etc.) found in a sample.","bulk cell,single cell,bulk nuclei,single nucleus,mitochondria,sorted cells,sorted nuclei,Other,Unknown,Not collected,Not applicable",,dataProperty,True,Biospecimen human,,https://ncithesaurus.nci.nih.gov/ncitbrowser/ConceptReport.jspdictionary=NCI_Thesaurus&version=23.04d&ns=ncit&code=C171278&key=1146649015&b=1&n=1,regex search str
150,cellType,Indicate the cell type. ,"CCF-BSO values (not listed for purposes of this RFC),Other,Unknown,Not collected,Not applicable",,dataProperty,True,Biospecimen human,,"https://bioportal.bioontology.org/ontologies/CCF/p=classes&conceptid=http%3A%2F%2Fpurl.org%2Fccf%2Fcell_type,https://www.ebi.ac.uk/ols/ontologies/ccf/termsiri=http%3A%2F%2Fpurl.org%2Fccf%2Fcell_type",regex search str
151,fastingState,Was individual fasting when the sample was taken (true/false),"True,False,Other,Uknown,Not collected,Not applicable",,dataProperty,True,Biospecimen human,,Sage Bionetworks,regex search str
152,isPostMortem,Was the sample taken after death (true/false),"True,False,Other,Uknown,Not collected,Not applicable",,dataProperty,True,Biospecimen human,,Sage Bionetworks,regex search str
153,specimenIdSource,"The repository or database to which a specimenID maps; or, the group or lab that generated the specimen. For cell culture studies, the commercial source or lab that generated the cells.",,,dataProperty,False,Biospecimen nonHuman,,Sage Bionetworks,regex search str
154,dataGenerationSite,The place where data from a particular specimen was generated.,,,dataProperty,False,Biospecimen nonHuman,,Sage Bionetworks,regex search str
155,assay,The analysis or technology used to generate the data in this file,TBD,,dataProperty,True,Biospecimen nonHuman,,Sage Bionetworks,regex search str
156,parentSpecimenID,"Unique identifier for the direct Parent from which the Specimen was derived, processed, pooled, etc. (if applicable)",,,dataProperty,False,Biospecimen nonHuman,,Sage Bionetworks,regex search str
157,parentSpecimenType,Type of biological material comprising the Parent Specimen (if applicable),,,dataProperty,False,Biospecimen nonHuman,,Sage Bionetworks,regex search str
158,laboratoryProcedure,Procedure by which the Specimen was derived from Parent Specimen (if applicable),,,dataProperty,False,Biospecimen nonHuman,,Sage Bionetworks,regex search str
159,cohort,Name of the cohort the individual belongs to,"Centenarian,US Family,Denmark Family,The Osteoporotic Fractures in Men (MrOS) Study,Study of Osteoporotic Fractures (SOF),The Health,Aging,and Body Composition Study (HealthABC),Cardiovascular Health Study (CHS),Other,Unknown,Not collected,Not applicable",,dataProperty,True,Individual Human,,Sage Bionetworks,regex search str
160,studyCode,"Unique identifier for the study, assigned by the DCC","LC,LG,ILO,LLFS",,dataProperty,True,Individual Human,,Sage Bionetworks,regex search str
161,fieldCenterCode,Name of the field center ,"BU,PT,NY,DK,Other,Unknown,Not collected,Not applicable",,dataProperty,True,Individual Human,,Sage Bionetworks,regex search str
162,visitCode,"Indicate which longitudinal visit for the individual the data comes from, provided by the data contributor's data dictionary",",Other,Unknown,Not collected,Not applicable",,dataProperty,True,Individual Human,,Sage Bionetworks,regex search ([0-9]+\.[0-9]*.)|([0-9]+)
163,countryCode,"Indicate the geographic region for the individual (shown as ex. ""840"")","World Bank country codes (not listed for purposes of this RFC),Other,Unknown,Not collected,Not applicable",,dataProperty,True,Individual Human,,https://wits.worldbank.org/countryprofile/metadata/en/country/all,regex search ([0-9]+)
164,consentGroupID,"Indicate the consent group for the individual, provided by the data contributor's data dictionary",",Other,Unknown,Not collected,Not applicable",,dataProperty,True,Individual Human,,Sage Bionetworks,regex search str
165,speciesGroup,The taxonomic ranking including both species and subspecies the individual belongs to.,"Human,Rodent,Bird,Mammal,Primate,Other,UnknownNot collected,Not applicable",,dataProperty,True,Individual Human,,"https://ontobee.org/ontology/NCITiri=http://purl.obolibrary.org/obo/NCIT_C62690https://www.ebi.ac.uk/ols/ontologies/edam/termsiri=http%3A%2F%2Fedamontology.org%2Fdata_1045,",regex search str
166,sex,The biological sex of the individual,"Male,Female,Other,Unknown,Not collected,Not applicable",,dataProperty,True,Individual Human,,"Sage Bionetworks,https://www.synapse.org/#!Synapse:syn25878249",regex search str
167,race,Race of individual,"White,Black or African American,Asian,American Indian or Alaska Native,Native Hawaiian or Other Pacific Islander,Multiracial,Other race,Prefer not to answer,Unknown,Not collected,Not applicable",,dataProperty,True,Individual Human,,"Sage Bionetworks,https://www.synapse.org/#!Synapse:syn25878249,https://jamanetwork.com/pages/inclusive-language,https://thesaurus.cancer.gov/ncitbrowser/pages/home.jsfversion=23.04d",regex search str
168,ethnicity,Ethnicity of individual,"Not Hispanic or latinoEthnicity,Hispanic or latinoEthnicity,Prefer not to answer,Other,Unknown,Not collected,Not applicable",,dataProperty,True,Individual Human,,"Sage Bionetworks,https://www.synapse.org/#!Synapse:syn25878249",regex search str
169,ethnicGroupCode,"A coded value specifying the self-declared ethnic origination independent of racial origination, provided by the data contributor's data dictionary",,,dataProperty,False,Individual Human,,https://ncithesaurus.nci.nih.gov/ncitbrowser/pages/concept_details.jsfdictionary=NCI_Thesaurus&version=23.04d&code=C93563&ns=ncit&type=properties&key=1040179992&b=1&n=0&vse=null,regex search str
170,age,"Age of the individual (age in years of the individual at first recorded study event (enrollment, visit, observation, sample collection, survey completion, etc.)","Unknown,Not collected,Not applicable",,dataProperty,True,Individual Human,,"Sage Bionetworks,",regex search str
171,diagnosisStatus,"Whether the individual has been diagnosed with a condition or disease (physical and/or cognitive), ""True"" indicates the individual has been diagnosed","TrueDiagnosisStatus,False,Unknown,Not collected,Not applicable",,dataProperty,True,Individual Human,,Sage Bionetworks,regex search str
172,diagnosis,Indicate the disease or condition.,"HPO,MONDO,MAXO codes or labels (not listed for purposes of this RFC),Other,Unknown,Not collected,Not applicable",,dataProperty,False,Individual Human,,"https://www.ebi.ac.uk/ols/ontologies/mondo,https://www.ebi.ac.uk/ols/ontologies/maxo,https://www.ebi.ac.uk/ols/ontologies/hp",regex search str
173,taxon,"Taxonomic identifier. The National Center for Biotechnology Information taxon ID (formatted as, ex. ""txid9989"")","NCBI taxonomy values (not listed for purposes of this RFC),Unknown,Not collected,Not applicable",,dataProperty,True,Individual nonHuman,,"https://www.ncbi.nlm.nih.gov/taxonomy,http://edamontology.org/data_1179,http://purl.obolibrary.org/obo/TAXRANK_0000010",regex search str
174,speciesName,"The scientific name of the species (typically a taxonomic group, ex. ""Eremophila alpestris"") the individual belongs to.","NCBI taxonomy values (not listed for purposes of this RFC),Unknown,Not collected,Not applicable",,dataProperty,True,Individual nonHuman,,https://www.ebi.ac.uk/ols/ontologies/edam/termsiri=http%3A%2F%2Fedamontology.org%2Fdata_1045,regex search str
175,commonName,"The biological species common name the individual belongs to (ex. ""Horned Lark"").note: As a default, the valid scientific name for the species should be indicated. ","Genbank common names (not listed for purposes of this RFC)Unknown,Not collected,Not applicable",,dataProperty,True,Individual nonHuman,,https://www.ebi.ac.uk/ols/ontologies/edam/termsiri=http%3A%2F%2Fedamontology.org%2Fdata_1874,regex search str
176,lifeStage,The life stage of the individual. note: Other values are possible depending on life stage terminology for individual species. Please let the data curation team know.,"Juvenile,Post-Juvenile,Adult,Other,Unknown,Not collected,Not applicable",,dataProperty,True,Individual nonHuman,,"Biological Collections Ontology,https://www.animalaudiograms.org/audiogram_metadata_scheme#:~:text=range%3A%20female%3B%20male-,life%20stage,-The%20life%20stage,https://www.ebi.ac.uk/ols/ontologies/pato",regex search str
177,speciesAge,"Age of individual (formatted in months, ex. ""72 months""). note: Uncertainty about the age might require recording age by specifying a lower and upper estimate in months for the age of the animal.","Unknown,Not collected,Not applicable",,dataProperty,True,Individual nonHuman,,"Sage Bionetworks,https://www.animalaudiograms.org/audiogram_metadata_scheme#:~:text=species%20are%20possible.-,age,-The%20age%20of",regex search str
178,captivityStatus,"The status of the individual with regard to captivity. note: Wild, captive, and stranded values are applicable, especially for marine mammals. Depending on life stage terminology for individual species, other values are possible. Please let the data curation team know.","CaptiveCaptivityStatus,Stranded,Wild,Other,Unknown,Not collected,Not applicable",,dataProperty,True,Individual nonHuman,,"https://www.animalaudiograms.org/audiogram_metadata_scheme#:~:text=of%20the%20animal.-,captivity%20status,-The%20status%20of",regex search str
179,captivityDuration,"The duration of captivity in months for the individuals in captivity (formatted in months, ex. 72 months). note: Applicable only to animals with captivity status captive.","Unknown,Not collected,Not applicable",,dataProperty,False,Individual nonHuman,,"https://www.animalaudiograms.org/audiogram_metadata_scheme#:~:text=species%20are%20possible.-,captivity%20duration,-The%20duration%20of",regex search str
180,OtherSampleType,"If ""other"" is selected list the type of sample",,specifySampleType,validValue,False,bsSeq (bisulfite-seq WGBS methylseq methylomics),,Sage Bionetworks,regex search str
181,OtherMeasurementTechnique,"If ""other"" is selected list the name of the measurement technique used",,specifyMeasurementTechnique,validValue,False,bsSeq (bisulfite-seq WGBS methylseq methylomics),,Sage Bionetworks,regex search str
182,OtherTechnologyPlatformVersion,"If ""other"" list the name of the platform version",,specifyPlatformVersion,validValue,False,bsSeq (bisulfite-seq WGBS methylseq methylomics),,Sage Bionetworks,regex search str
183,OtherPlatformLocation,"If ""other"" list the name of the platform location",,specifyPlatformLocation,validValue,False,bsSeq (bisulfite-seq WGBS methylseq methylomics),,Sage Bionetworks,regex search str
